,Event,Stage,Query Date,Query Term,Id,Username,Text,Date,Hashtags,Location
1479,ne_bomb_cyclone,during,2019-10-17,power outage,1184314628010053632,LaurelMaisie,@OGandE yo spill the tea on the power outage at Piedmont I know you’ll get it fixed at like 11:40 but I just want the tea ,2019-10-16 03:46:25+00:00,,
1480,ne_bomb_cyclone,during,2019-10-17,power outage,1184314267320774657,JJ_Angelus,"Thank God. I manage to have my flights this weekend. Many thanks to our Singapore Consulate. Using very limited mobile data and weak wifi with power outages in Yokohama, Japan. Have manage to book a limousine shuttle to Haneda Airport. Fingers crossed. #PrayForJapan",2019-10-16 03:44:59+00:00,#PrayForJapan,
1481,ne_bomb_cyclone,during,2019-10-17,power outage,1184313458608594944,PapaESoCo,PD Editorial: Massive power outages can’t be a new normal https://www.pressdemocrat.com/opinion/10175814-181/pd-editorial-massive-power-outages,2019-10-16 03:41:46+00:00,,
1482,ne_bomb_cyclone,during,2019-10-17,power outage,1184312629235466247,bryanpackebush,"I’d be curious to know what got into the transformer(s) that caused the #poweroutage for #powermagedon2019 was it a squirrel, a bird, a dinosaur?",2019-10-16 03:38:28+00:00,#poweroutage #powermagedon2019,
1483,ne_bomb_cyclone,during,2019-10-17,power outage,1184312362855206913,wsretv,"These outages are due to the cutover to the new transmitter, which will take place on 10/24. We had to reduce power on the old transmitter so that the tower crew could work safely. 1/2",2019-10-16 03:37:25+00:00,,
1484,ne_bomb_cyclone,during,2019-10-17,power outage,1184312312724738055,papanielson,"@HiltonHotels unbelievable what you charge to stay at the Alii Tower in the Hilton Hawaiian Village at Waikiki, and the power is now out in the whole building? Unreal. We are big Nats fans from DC and, because of power outage, we missed the end of the game vs Cardinals",2019-10-16 03:37:13+00:00,,
1485,ne_bomb_cyclone,during,2019-10-17,power outage,1184311609465815041,PapaESoCo,'Unacceptable situation': State regulator slams PG&E over power outages ,2019-10-16 03:34:25+00:00,,
1486,ne_bomb_cyclone,during,2019-10-17,power outage,1184311236940455937,austinenergy,Hi. We know it's frustrating to be without power but our crews are still working on 47 outages. Thank you for your patience as our crews work as safely and quickly as possible to restore power throughout the night. We hope to have everyone restored by early Wednesday morning.,2019-10-16 03:32:56+00:00,,
1487,ne_bomb_cyclone,during,2019-10-17,power outage,1184310530921652224,ABC10,"PG&E: Historic power outage was the 'right call' after 100+ incidents of damage, hazards found ",2019-10-16 03:30:08+00:00,,
1488,ne_bomb_cyclone,during,2019-10-17,power outage,1184309810658807808,RocketmanUS,"Fire started well after PG&E shut power down. No electrical lines in area of fire. About 150 firefighter responded, reason $1M+ homes. Harder for people to evacuate do to PG&amp;E power outage. ",2019-10-16 03:27:16+00:00,,
1489,ne_bomb_cyclone,during,2019-10-17,power outage,1184309598674673664,rkollaus,"LOS ANGELES EARTHQUAKE: FIRES, POWER OUTAGES, EVACUATIONS https://youtu.be/UaO_QCLCaDU via @YouTube",2019-10-16 03:26:26+00:00,,
1490,ne_bomb_cyclone,during,2019-10-17,power outage,1184309321175314432,JonBownePolitix,What a night for a blackout! (Power outage) not personal debauchery. Sad I missed Tulsi.,2019-10-16 03:25:20+00:00,,
1491,ne_bomb_cyclone,during,2019-10-17,power outage,1184309072541171712,lovekendrak,omg. waited for the a train at penn but apparently the A trains were running on the orange tracks due to a power outage. so then i walk to the orange/yellow and decide to take the m which gets me pretty close to my house. thats another 20 minute wait.,2019-10-16 03:24:20+00:00,,
1492,ne_bomb_cyclone,during,2019-10-17,power outage,1184309070402150401,A_New_Day_2020,"The power outage was planned. During these blackouts, 2100 innocent children were rescued from the satanic ritual abuse DUMBs. This is fact: https://timothycharlesholmseth.com/seals-and-marines-rescue-2100-children-from-california-underground-bunkers/. In the meantime, the governor of CA was caught on video practicing martial law for the Agenda 21.",2019-10-16 03:24:20+00:00,,
1493,ne_bomb_cyclone,during,2019-10-17,power outage,1184308420993863680,indignesvouz,another power outage in @Tenleytown_DC. Visiting my old neighborhood and not missing it - #Pepco is it an annual thing around here?,2019-10-16 03:21:45+00:00,#Pepco,
1494,ne_bomb_cyclone,during,2019-10-17,power outage,1184307831832375297,bambam_782,Freaking my aunt out talking about her Bay Area power outages #zombies,2019-10-16 03:19:25+00:00,#zombies,
1495,ne_bomb_cyclone,during,2019-10-17,power outage,1184307383968980993,xandatoto,Every other household I know makes contingency plans for power outage - I expect a dairy farm to do the same. I’ve no doubt they do. Seems we got half the story,2019-10-16 03:17:38+00:00,,
1496,ne_bomb_cyclone,during,2019-10-17,power outage,1184307383759040512,ThatOtherTrisha,I’m about to sass talk Mother.... Because there sure are a lot of leaves up in those trees..... and a power outage is not whats needed tomorrow. ,2019-10-16 03:17:38+00:00,,
1497,ne_bomb_cyclone,during,2019-10-17,power outage,1184307268831064065,bryanpackebush,I’m glad this #poweroutage didn’t occur during the heat and humidity of this last summer! #powermagedon2019,2019-10-16 03:17:10+00:00,#poweroutage #powermagedon2019,
1498,ne_bomb_cyclone,during,2019-10-17,power outage,1184307097489608704,VincentMeitakau,"So fires, power outages, earthquakes, refinery fires, middle schoolers... Y’ALL THOUGHT I WAS WEIRD FOR BUYING ALL MY TACTICAL/BUGOUT GEAR, BUT WHO’S GOT HIS EDC AND COFFEE READY FOR THE CALIFORNIA APOCALYPSE?!?!... https://www.facebook.com/1372127008/posts/10220231786089471/",2019-10-16 03:16:30+00:00,,
1499,ne_bomb_cyclone,during,2019-10-17,power outage,1184306608970428416,glenda380,Can Solar and Batteries Outlast an Extended Power Outage? https://sgq.io/X8UHDjO via @greentechmedia,2019-10-16 03:14:33+00:00,,
1500,ne_bomb_cyclone,during,2019-10-17,power outage,1184306496861069313,austinenergy,"10 p.m. Update: 47 outages 1,640 customers without power Thank you for your patience as our crews work as safely and quickly as possible to restore power throughout the night. We hope to have everyone restored by early Wednesday morning.",2019-10-16 03:14:06+00:00,,
1501,ne_bomb_cyclone,during,2019-10-17,power outage,1184306452871016448,Mike_Combe,Too bad they didn't hold the debates in CA. We have power outages.,2019-10-16 03:13:56+00:00,,
1502,ne_bomb_cyclone,during,2019-10-17,power outage,1184306355571699712,aniistoll,Crapppp there is a power outage??? So no trains •____• I was gonna wait this situation out but now I’m like I need to walk home it try to find a cab,2019-10-16 03:13:33+00:00,,
1503,ne_bomb_cyclone,during,2019-10-17,power outage,1184305997243920384,bryanpackebush,This #poweroutage was handled well by my to 7yr olds. They helped get the candles and flashlights out. #teachthemyoung #powermagedon2019,2019-10-16 03:12:07+00:00,#poweroutage #teachthemyoung #powermagedon2019,
1504,ne_bomb_cyclone,during,2019-10-17,power outage,1184305913966006274,stevej73,@ElectricityNW Since 2am tonight we have had 3 short power outages at SK63JE. Any update on issue?,2019-10-16 03:11:47+00:00,,
1505,ne_bomb_cyclone,during,2019-10-17,power outage,1184305586495774720,TECtwwi,"We are currently experiencing several outages in Leon County affecting 2,188 Members. Crews are en route to restore power as quickly and safely as possible.",2019-10-16 03:10:29+00:00,,
1506,ne_bomb_cyclone,during,2019-10-17,power outage,1184305323940728832,bryanpackebush,I like @OGandE because they offer a text alert feature for power outages that will give you an ETA on restoration of #power which is helpful. #powemagedon2019,2019-10-16 03:09:27+00:00,#power #powemagedon2019,
1507,ne_bomb_cyclone,during,2019-10-17,power outage,1184305054792204293,BexarCOSW,"Some sporadic @cpsenergy power outages being reported across the county. Road conditions fairing a bit better with only two road closures being reported at this time. (Hausman &amp; Maltsberger, Lane) - via http://bexarflood.org #SATWX",2019-10-16 03:08:23+00:00,#SATWX,
1508,ne_bomb_cyclone,during,2019-10-17,power outage,1184304966459985922,thenovelteacher,Reason #3812 why middle schoolers are the best: their grit and kindness know no bounds. Photo #1 is from a student who didn’t want to stop reading The Giver during a power outage and #2 is thanks to my 7th grader who made sure I was on-trend with ocean-themed HydroFlask stickers. ,2019-10-16 03:08:01+00:00,,
1509,ne_bomb_cyclone,during,2019-10-17,power outage,1184304807277813761,Ccc_jdvvnl,There is scheduled power outage due to maintenance in ur area supply will resume around 12:00pm……,2019-10-16 03:07:24+00:00,,
1510,ne_bomb_cyclone,during,2019-10-17,power outage,1184304618286800896,bryanpackebush,"Power outage preparedness tips - Avoid carbon monoxide poisoning. Generators, camp stoves, or charcoal grills should always be used outdoors and at least 20 feet away from windows. Never use a gas stovetop or oven to heat your home. #powermagedon2019",2019-10-16 03:06:38+00:00,#powermagedon2019,
1511,ne_bomb_cyclone,during,2019-10-17,power outage,1184304559415427072,Global0rganics,Is it true the power outage in California was used by special ops to rescue children in underground tunnels from human trafficking?,2019-10-16 03:06:24+00:00,,
1512,ne_bomb_cyclone,during,2019-10-17,power outage,1184304026432819200,bryanpackebush,"Power outage preparedness tips If safe, go to an alternate location for heat or cooling. #powermagedon2019",2019-10-16 03:04:17+00:00,#powermagedon2019,
1513,ne_bomb_cyclone,during,2019-10-17,power outage,1184303633162219520,rehownet2,"[Ideal Co., Ltd.] Disaster prevention goods during earthquakes, typhoons and power outages! Portable power supplies with “large capacity”, “light” and “compact” have appeared. https://re-how.net/product/224709/",2019-10-16 03:02:44+00:00,,
1514,ne_bomb_cyclone,during,2019-10-17,power outage,1184303617085456386,bryanpackebush,Power outage preparedness tips - Have alternate plans for refrigerating medicines or using power-dependent medical devices. #powermagedon2019,2019-10-16 03:02:40+00:00,#powermagedon2019,
1515,ne_bomb_cyclone,during,2019-10-17,power outage,1184303572944470017,hopebonillas,"Power outage, earthquake, fire... Bay Area falling apart ",2019-10-16 03:02:29+00:00,,
1516,ne_bomb_cyclone,during,2019-10-17,power outage,1184303351975952386,LashawniquaG,"@Maglite During the PG and E power outage I discovered that the tops on my 3 mini mags lights were all stuck. I've tried brut force, I've tried a vise grip. Can't get them open. Maybe corroded batteries inside? Any hints?",2019-10-16 03:01:37+00:00,,
1517,ne_bomb_cyclone,during,2019-10-17,power outage,1184303345164587013,FeroshusKitsu,I just got downed by a power outage. ,2019-10-16 03:01:35+00:00,,
1518,ne_bomb_cyclone,during,2019-10-17,power outage,1184303302734831616,drWilda,Unprecedented power outages have raised questions about how California's progressive environmental practices contributed to putting two million residents in the dark.,2019-10-16 03:01:25+00:00,,
1519,ne_bomb_cyclone,during,2019-10-17,power outage,1184303291469049861,CityPowerJhb,"We are aware of the outage in your area, technicians are on site working on power restorations^GR",2019-10-16 03:01:22+00:00,,
1520,ne_bomb_cyclone,during,2019-10-17,power outage,1184303220127981569,bryanpackebush,Power outage preparedness tips -Disconnect appliances and electronics to avoid damage from electrical surges. #powermagedon2019,2019-10-16 03:01:05+00:00,#powermagedon2019,
1521,ne_bomb_cyclone,during,2019-10-17,power outage,1184303139656101888,_hennnnnn,Power outage again!!!!! Wtf!!!!!!!,2019-10-16 03:00:46+00:00,,
1522,ne_bomb_cyclone,during,2019-10-17,power outage,1184303122467958784,drWilda,Unprecedented power outages have raised questions about how California's progressive environmental practices contributed to putting two million residents in the dark. ,2019-10-16 03:00:42+00:00,,
1523,ne_bomb_cyclone,during,2019-10-17,power outage,1184302949327081472,melstrum333,Fire & Power Outage https://youtu.be/bwM0fVy6RR0 via @YouTube,2019-10-16 03:00:01+00:00,,
1524,ne_bomb_cyclone,during,2019-10-17,power outage,1184302908218716160,fIetcherpeters,trying to stay cool ..... in class ... in a meeting... in subway power outages... take me home please all I have had to eat today is 2 kind bars,2019-10-16 02:59:51+00:00,,
1525,ne_bomb_cyclone,during,2019-10-17,power outage,1184302903760183296,bryanpackebush,Live tweeting a power outage in NW OKC #powermagedon,2019-10-16 02:59:50+00:00,#powermagedon,
1526,ne_bomb_cyclone,during,2019-10-17,power outage,1184302628798377984,bryanpackebush,Power outage preparedness tips. - Only use generators outdoors and away from windows. #poweroutageprearedness #powermagedon2019,2019-10-16 02:58:44+00:00,#poweroutageprearedness #powermagedon2019,
1527,ne_bomb_cyclone,during,2019-10-17,power outage,1184302288149635073,bryanpackebush,Power outage preparedness tips. Keep freezers and refrigerators closed. #poweroutageprearedness #powermagedon2019,2019-10-16 02:57:23+00:00,#poweroutageprearedness #powermagedon2019,
1528,ne_bomb_cyclone,during,2019-10-17,power outage,1184302231732047872,StormCenter7,Here is an updated look at power outages across the Miami Valley. More information: http://www.whio.com,2019-10-16 02:57:09+00:00,,
1529,ne_bomb_cyclone,during,2019-10-17,power outage,1184301883281723393,TheButterZone,"Listening to SDFD radio traffic & living in the power outage area, seemed like SDGE de-energized lines way before SDFD was told they did. Usually the radio traffic is SDGE doing that minutes after SDFD asks.",2019-10-16 02:55:46+00:00,,
1530,ne_bomb_cyclone,during,2019-10-17,power outage,1184301655677902849,Angel87488763,"While you were all distracted from the power outage, CA governor passes 15 gun control laws including red flag laws https://www.blacklistednews.com/article/75064/while-you-were-all-distracted-from-the-power-outage-ca-governor-passes-15-gun-control-laws.html",2019-10-16 02:54:52+00:00,,
1531,ne_bomb_cyclone,during,2019-10-17,power outage,1184301346565935104,SheriSachse,@russellcrowe when it's that time of year that we start having power outages. Lights go out - tea lights come on. I love my Fenton. ,2019-10-16 02:53:38+00:00,,
1532,ne_bomb_cyclone,during,2019-10-17,power outage,1184301163862212610,DawgGabriel,And San Francisco has power outages ... as if they were Venezuela!,2019-10-16 02:52:55+00:00,,
1533,ne_bomb_cyclone,during,2019-10-17,power outage,1184300934601555968,negociosenusa,California Demands PG&E Compensate Customers Affected By Forced Power Outage https://beto2020.net/2019/10/14/california-demands-pge-compensate-customers-affected-by-forced-power-outage/,2019-10-16 02:52:00+00:00,,
1534,ne_bomb_cyclone,during,2019-10-17,power outage,1184300824098492416,UmemeLtd,The team is aware of the outage and will be doing everything possible to rectify the power issue today. RB,2019-10-16 02:51:34+00:00,,
1535,ne_bomb_cyclone,during,2019-10-17,power outage,1184300795140988929,CleantechWatch,"Can Solar and Batteries Outlast an Extended Power Outage? | Greentech Media https://www.greentechmedia.com/articles/read/can-solar-and-storage-weather-a-days-long-power-outage-it-depends, see more http://tweetedtimes.com/v/460?s=tnp",2019-10-16 02:51:27+00:00,,
1536,ne_bomb_cyclone,during,2019-10-17,power outage,1184300776337727488,Michonne,"Power outage debacles, wildfires here and there, a cluster of earthquakes, oh, and there’s a refinery on fire. It’s no wonder this album—and this song in particular—is speaking to me right now. #doomdays #Bastille #california",2019-10-16 02:51:22+00:00,#doomdays #Bastille #california,
1537,ne_bomb_cyclone,during,2019-10-17,power outage,1184300094549573632,Yolanda_Mo,"Who was still trying to work in the jewelry room with a power outage? I brought out my lights from my night time vendor events. Yes, it’s just that serious. After about an hour, I had to stop because I couldn’t invoice since we had a poor signal thanks to Sprint.",2019-10-16 02:48:40+00:00,,
1538,ne_bomb_cyclone,during,2019-10-17,power outage,1184300010285883397,ntavarespfs,Bobby Allen talks about how bunkers were destroyed during the PG & E power outages &amp; fires. 2100 kids rescued from these bunkers that were being used for Andrenochrome. Pretty amazing if true. ,2019-10-16 02:48:20+00:00,,
1539,ne_bomb_cyclone,during,2019-10-17,power outage,1184299286659506178,SeptembersRain,Power outage. I hope it doesn't last too long. The silence is deafening.,2019-10-16 02:45:27+00:00,,
1540,ne_bomb_cyclone,during,2019-10-17,power outage,1184299074939322368,Astro_Clark,"Sure - that is correct. However, a country like France, which produces ~70% of its energy using nuclear power doesn't have extreme power outages due to plant downtime. If managed correctly, it's a non-issue.",2019-10-16 02:44:37+00:00,,
1541,ne_bomb_cyclone,during,2019-10-17,power outage,1184299050365009921,dqrpyy,full power outage so i’m playing games with parents :),2019-10-16 02:44:31+00:00,,
1542,ne_bomb_cyclone,during,2019-10-17,power outage,1184298324326801408,Druid999S,"Given recovery of over 2,000 trafficked kids from hidden tunnels under Democratic CA streets during the power outages ... plus phoney impeachment ... yeah there will be a violent false flag called up to try to distract the MSM!! Maybe another MK-Ultra triggered this time?",2019-10-16 02:41:38+00:00,,
1543,ne_bomb_cyclone,during,2019-10-17,power outage,1184298140419182593,Commodork,Here’s to the Yukon/OKC power outage. ,2019-10-16 02:40:54+00:00,,
1544,ne_bomb_cyclone,during,2019-10-17,power outage,1184298105820405760,BSmithwood,With the power outages in the state there has been lots of talk about how batteries and solar can help us ride through the outages. Couple problems: getting enough batteries and sizing them correctly. Not as pedestrian as it sounds!(9/),2019-10-16 02:40:46+00:00,,
1545,ne_bomb_cyclone,during,2019-10-17,power outage,1184297807538089984,ImMonaRoll,"So many things are happening. Power outage, earthquake, now an oil refinery fire. Bay Area can’t catch a break. ",2019-10-16 02:39:35+00:00,,
1546,ne_bomb_cyclone,during,2019-10-17,power outage,1184297271330004993,ForeverRuth13,Some Bray Wyatt BS with this power outage with it flickering as much as it did,2019-10-16 02:37:27+00:00,,
1547,ne_bomb_cyclone,during,2019-10-17,power outage,1184297145022722048,PhilRoder,"Big power outage in NW OKC and Yukon. A car hit a pole near Sarah Road in NW OKC which has left a total of 7,840 customers without power at 9:30pm. #BREAKING @kfor #OG&amp;E #electric",2019-10-16 02:36:57+00:00,#BREAKING #OG #electric,
1548,ne_bomb_cyclone,during,2019-10-17,power outage,1184297083555188736,AJtheRetro,Frequent power outage pro tip: Wrap a headlamp around a water bottle to create a lantern. Arrange with candles. Marvel at your artistic prowess. ,2019-10-16 02:36:42+00:00,,
1549,ne_bomb_cyclone,during,2019-10-17,power outage,1184296858866327552,UMobileRams,"VB | Mid-match power outage doesn’t slow down Mobile as Lady Rams cruise to a straight-set victory over rival, William Carey! #Rammit",2019-10-16 02:35:48+00:00,#Rammit,
1550,ne_bomb_cyclone,during,2019-10-17,power outage,1184296427746480128,1200WOAI,"CPS Energy is reporting 1,970 customers still without power as a result of the storms. Most of the outages are centered along Highway 281 south of Highway 46.",2019-10-16 02:34:06+00:00,,
1551,ne_bomb_cyclone,during,2019-10-17,power outage,1184296333982744577,SeptembersRain,Power outage. Whee. Damn it's dark out here.,2019-10-16 02:33:43+00:00,,
1552,ne_bomb_cyclone,during,2019-10-17,power outage,1184296259013791744,TLSullivan,A combination between strong winds and heavy rains could lead to local power outages. Our #Massachusetts &amp; #RhodeIsland @nationalgridus customers can report a outage: http://ngrid.com/outagecentral Text ‘REG’ to 64743 Call 1-800-465-1212 https://twitter.com/ericfisher/status/1184276807920640000,2019-10-16 02:33:25+00:00,#Massachusetts #RhodeIsland,
1553,ne_bomb_cyclone,during,2019-10-17,power outage,1184296256539123713,clb5_,Power outage &amp; my family going dumb playing hide &amp; seek ,2019-10-16 02:33:25+00:00,,
1554,ne_bomb_cyclone,during,2019-10-17,power outage,1184296196061286400,_thetaylorj,"First the fires , then the power outages, now these damn earthquakes...somebody playin ",2019-10-16 02:33:10+00:00,,
1555,ne_bomb_cyclone,during,2019-10-17,power outage,1184296191737114624,jnabwire,"I fee thoroughly fed up if you go through your tweets on the daily, i am reporting power outage in a part of Nabuti! Why can’t this be rectified once and for all?",2019-10-16 02:33:09+00:00,,
1556,ne_bomb_cyclone,during,2019-10-17,power outage,1184296040360484864,We4EverOvercome,"breath either unless you call the noxious fumes air which is already causing health problems all over the world in people. You're going to need three things be it you don't want to cause power outages all across the world renewable energy, carbon capture technology and fuel...",2019-10-16 02:32:33+00:00,,
1557,ne_bomb_cyclone,during,2019-10-17,power outage,1184295999092604928,alanarondoy,what is happening to the bay area? - power outages - multiple earthquakes in the past 24 hrs - oil refinery fire and this is all happening within the span of 2 weeks!,2019-10-16 02:32:23+00:00,,
1558,ne_bomb_cyclone,during,2019-10-17,power outage,1184295937511804928,Stump6426,Kirk Gibson Barry Sanders Everything left over preparing for last weeks power outage. That never happened. On the Bright side. Thank you PG&amp;E for getting us prepared for an earthquake.,2019-10-16 02:32:09+00:00,,
1559,ne_bomb_cyclone,during,2019-10-17,power outage,1184295881266421761,Biglexx32,Well they had it on a smaller area and only a limited amount of tickets. They sold out early for the early tickets due to the power outage and were only selling tickets 1hr before hand for those who couldnt get them. So everyone was standing in line for nothing,2019-10-16 02:31:55+00:00,,
1560,ne_bomb_cyclone,during,2019-10-17,power outage,1184295513904078849,rssanch86,I guess I should be grateful there's at least a storm during this power outage.... ,2019-10-16 02:30:28+00:00,,
1561,ne_bomb_cyclone,during,2019-10-17,power outage,1184295281489145861,Staci72805,"Ues. Power outages, earthquake, refinery fire and another quake. Interesting week in the Bay Area. Reminders to be prepared.",2019-10-16 02:29:32+00:00,,
1562,ne_bomb_cyclone,during,2019-10-17,power outage,1184295072780734464,Tbonedeluxe,@PedernalesCoop any updates on power restoration for Fair Oaks Ranch? Is it still 11:45 as per outage map?,2019-10-16 02:28:43+00:00,,
1563,ne_bomb_cyclone,during,2019-10-17,power outage,1184294992677867525,MrScottHendrix,"After tonight’s thunderstorm, it’s homework by candlelight...and computer batteries. #poweroutage #parenting",2019-10-16 02:28:24+00:00,#poweroutage #parenting,
1564,ne_bomb_cyclone,during,2019-10-17,power outage,1184294635012853762,FEngole,"Hi Isabel, Power was restored after resolving the fault on the powerline. The teams are always on standby to resolve any unforeseen incidents that may cause service interruptions and ensure quick restoration. All inconveniences caused by the outage are regreted. #SafetyFirst",2019-10-16 02:26:58+00:00,#SafetyFirst,
1565,ne_bomb_cyclone,during,2019-10-17,power outage,1184294335052795904,chlobethbyrd,"there’s a private beach on base right down the street, i think it’s a california law. we are supposed to have power outages too but they sent that email out a week ago and we still haven’t had one",2019-10-16 02:25:47+00:00,,
1566,ne_bomb_cyclone,during,2019-10-17,power outage,1184294189409996806,baseballndshit,I’m flying home today and all I keep hearing about is earthquakes and power outages and fires plus I got into a motorbike accident a couple of days ago. All of this bad juju has me freaking out for my flight,2019-10-16 02:25:12+00:00,,
1567,ne_bomb_cyclone,during,2019-10-17,power outage,1184293980680400896,steveg690,"I wanted to watch, but there was a widespread power outage. Drat, Buffy.",2019-10-16 02:24:22+00:00,,
1568,ne_bomb_cyclone,during,2019-10-17,power outage,1184293765667840001,sgtmac825,@koconews anything about why power outages on NW side / Yukon? 7-10k folks,2019-10-16 02:23:31+00:00,,
1569,ne_bomb_cyclone,during,2019-10-17,power outage,1184293728040574977,RachBee09,First power outages now earthquakes! My nerves ain’t right ,2019-10-16 02:23:22+00:00,,
1570,ne_bomb_cyclone,during,2019-10-17,power outage,1184293712752304129,ashleybarnes_24,How close are you? We’re about ten blocks and get AC. But they’re shortening our COLA pay and making us go through 24-hour power outages twice in two weeks - on weekends! To “save energy” on the whole base.,2019-10-16 02:23:18+00:00,,
1571,ne_bomb_cyclone,during,2019-10-17,power outage,1184293666933755904,disillusionedi6,"I don't have a strong view on Newsom, but I think the BK courts opening up the reorg process give him a nice out especially given the disaster that was the preventative power outages. 1. It doesn't matter if affects the BK process so much because there is a viable plan to end it",2019-10-16 02:23:07+00:00,,
1572,ne_bomb_cyclone,during,2019-10-17,power outage,1184293477640749057,Tinakaav,I work at a college dorm. Power/internet outage is practically the same as an apocalypse -_-,2019-10-16 02:22:22+00:00,,
