,Event,Stage,Query Date,Query Term,Id,Username,Text,Date,Hashtags,Location
463,ne_bomb_cyclone,during,2019-10-17,power outage,1184542037917491208,NJBPU,"A coastal storm will bring wind & rain to many parts of the state today through Thursday. Keep an eye on local weather, use caution while driving, and if you experience a power outage report it to your utility right away. Utility info from @ReadyNJ: http://bit.ly/2MhSHV0",2019-10-16 18:50:04+00:00,,
464,ne_bomb_cyclone,during,2019-10-17,power outage,1184541803418136576,aedcelectricity,"Hello Sandra, we sincerely apologize for the prolonged power outage, there is a technical fault affecting the 33KV feeder 8 from AT5, our technical team are currently working to ensure that power is restored as soon as possible. Kindly bear with us.",2019-10-16 18:49:08+00:00,,
465,ne_bomb_cyclone,during,2019-10-17,power outage,1184541607695175680,CleanAirMoms,"#RT @FredKrupp: RT @JustinHGillis: Floods, fires, power outages: the long-predicted future has arrived. In this piece I ask: What now? https://www.nytimes.com/2019/10/12/opinion/california-power-outage-climate.html?smtyp=cur&amp;smid=tw-nytopinion",2019-10-16 18:48:21+00:00,#RT,
466,ne_bomb_cyclone,during,2019-10-17,power outage,1184541107042050048,topcoach7,Power outage in Colonia,2019-10-16 18:46:22+00:00,,
467,ne_bomb_cyclone,during,2019-10-17,power outage,1184541102629629952,JonWGME,A nor’easter is expected to hit Maine Wednesday night into Thursday. Strong winds and heavy rain are expected to cause power outages. ,2019-10-16 18:46:21+00:00,,
468,ne_bomb_cyclone,during,2019-10-17,power outage,1184541101279105024,LandersLewisLLC,Power outages can be a major inconvenience. Here are 10 reasons to consider buying a home generator of your own. ,2019-10-16 18:46:20+00:00,,
469,ne_bomb_cyclone,during,2019-10-17,power outage,1184541080563474432,bluestonearcher,"(We’ve got gallon jugs from the last power outage with well water, so the dogs have enough to drink for a while)",2019-10-16 18:46:15+00:00,,
470,ne_bomb_cyclone,during,2019-10-17,power outage,1184541022233210880,EversourceCT, Heavy rain and strong winds are expected to hit the state tonight and tomorrow – and our crews are ready to respond. Please report any power outages at 800-286-2000 or online at http://Eversource.com We’re there when you need us!,2019-10-16 18:46:02+00:00,,
471,ne_bomb_cyclone,during,2019-10-17,power outage,1184540738832478209,PetersonCat,Get prepared for the next California power outage! Visit https://www.petersonpower.com/california-power-outage,2019-10-16 18:44:54+00:00,,
472,ne_bomb_cyclone,during,2019-10-17,power outage,1184540625158443008,IgwanyaEsther,@KenyaPower_Care power outage at Witeithie opposite Mangu school. Mtr no.37163582390.,2019-10-16 18:44:27+00:00,,
473,ne_bomb_cyclone,during,2019-10-17,power outage,1184540377279123456,UmemeLtd,"This outage is due to a technical fault along the main power line and we are handling, power will be restored upon completion. SM",2019-10-16 18:43:28+00:00,,
474,ne_bomb_cyclone,during,2019-10-17,power outage,1184540344291090432,Dknowzappare,I cant wait for michael moore’s next doc to debunk this. They are not base load energy sources & are intermittent. Great if you like power outages though,2019-10-16 18:43:20+00:00,,
475,ne_bomb_cyclone,during,2019-10-17,power outage,1184539884914126851,berkeleysocwel,Last week's power outages forced some East Bay residents with disabilities to take matters into their own hands. Read how doctoral student Katie Savin helped coordinate a response. https://www.kqed.org/news/11779283/how-the-disabled-community-supported-each-other-when-the-power-went-out,2019-10-16 18:41:30+00:00,,
476,ne_bomb_cyclone,during,2019-10-17,power outage,1184539809882263552,GWayFUN,"Good afternoon, Aileen! It's sunny but cold here too! We're supposed to get a noreaster soon! >.power outage backup). Haha Hope you have a great day!",2019-10-16 18:41:13+00:00,,
477,ne_bomb_cyclone,during,2019-10-17,power outage,1184539796015706112,SaudaAinra,"If your power goes out, you can check Currenr Outages on Pepco’s website. Call Pepco, NOT your property manager. Love you ",2019-10-16 18:41:09+00:00,,
478,ne_bomb_cyclone,during,2019-10-17,power outage,1184539538477080576,nynjpaweather,"I would not be surprised to see reports of flash flooding, coastal flooding, wind damage, poor visibility, and power outages.",2019-10-16 18:40:08+00:00,,
479,ne_bomb_cyclone,during,2019-10-17,power outage,1184539405769297920,Xfinity,We can help! Is there power to your modem? Are you seeing an outage on your My Account app?,2019-10-16 18:39:36+00:00,,
480,ne_bomb_cyclone,during,2019-10-17,power outage,1184539364338126849,robertburger9,@CityPowerJhb @CityofJoburgZA 3rd unscheduled power outage in less than a week in Westdene .what's the problem? @WSresidents @JHBWestdene @NewsNMT,2019-10-16 18:39:26+00:00,,
481,ne_bomb_cyclone,during,2019-10-17,power outage,1184539350761201665,TanyaDMiltonRE,Take these precautions and you'll be prepared for the next power outage. #lifetips #homeowners http://cpix.me/a/83673510,2019-10-16 18:39:23+00:00,#lifetips #homeowners,
482,ne_bomb_cyclone,during,2019-10-17,power outage,1184539282100371461,grantdebz,@CityPowerJhb is the power outage in glenvista loadshedding or a fault,2019-10-16 18:39:07+00:00,,
483,ne_bomb_cyclone,during,2019-10-17,power outage,1184539169869185024,DConeCity,"S: Pepco Power Outage Pepco reports a power outage affecting approximately 2650 customers in Petworth, Brightwood Park and Fort Totten neighborhoods. Current estimate time of restoration is 7 PM.",2019-10-16 18:38:40+00:00,,
484,ne_bomb_cyclone,during,2019-10-17,power outage,1184538761704755202,runescapegoblin,How the fuck we dodge that power outage,2019-10-16 18:37:03+00:00,,
485,ne_bomb_cyclone,during,2019-10-17,power outage,1184538731711258624,ryansnoddon,"First 'weather bomb' of the season hits the Maritimes on Thursday with strong winds & rain. Some power outages look likely, along with localized flooding, thanks to wind blown fallen leaves. Timeline &amp; details here + on CBC-TV at 6pm: https://www.cbc.ca/news/canada/nova-scotia/snoddon-wednesday-weather-1.5322841 #nsstorm #nbstorm",2019-10-16 18:36:55+00:00,#nsstorm #nbstorm,
486,ne_bomb_cyclone,during,2019-10-17,power outage,1184538370627833861,cmpco,"With heavy rains and winds expected, customers may experience power outages. Crews and company personnel are actively preparing to respond as needed. For current information or to report an outage, visit: https://outagemap.cmpco.com/cmp/",2019-10-16 18:35:29+00:00,,
487,ne_bomb_cyclone,during,2019-10-17,power outage,1184538356899860483,yaBoy_JP123,"@Ask_Spectrum Any outages in the greater Syracuse, NY area? Have an entire operation just outside the inner harbor without internet but have power",2019-10-16 18:35:26+00:00,,
488,ne_bomb_cyclone,during,2019-10-17,power outage,1184538269909966850,clifftone_white,"As you go to sleep, kindly note that your ""emergency team"" has been responding for power outage on ref no 4905841 for 25 hours now. I have not been able to work, or do anything. There's no water, food is going stale too. Good job Kenya power ",2019-10-16 18:35:05+00:00,,
489,ne_bomb_cyclone,during,2019-10-17,power outage,1184538255259295746,AlertDCio,"Pepco reports a power outage affecting approximately 2650 customers in Petworth, Brightwood Park and Fort Totten ne http://alertdc.io/t/4Mr",2019-10-16 18:35:02+00:00,,
490,ne_bomb_cyclone,during,2019-10-17,power outage,1184538251769589767,denicewross,I'm a huge fan of this emPower work at HHS -- saving lives during power outages with responsible data sharing ,2019-10-16 18:35:01+00:00,,
491,ne_bomb_cyclone,during,2019-10-17,power outage,1184538144567365637,LaurensElectric,Crews are responding to a power outage affecting 512 members in Laurens and Greenville counties. https://www.laurenselectric.com/outage-center/,2019-10-16 18:34:35+00:00,,
492,ne_bomb_cyclone,during,2019-10-17,power outage,1184537865683910656,wxaseymore,"A wet and windy Wednesday afternoon across Delmarva. The heaviest rain will fall through about 6pm before tapering off. The winds, which are now just beginning to gust to near 40mph, will remain quite strong through Thursday evening. Sporadic power outages cannot be ruled out. ",2019-10-16 18:33:29+00:00,,
493,ne_bomb_cyclone,during,2019-10-17,power outage,1184537666982989825,mjabrams,Power outage here...when do we start killing each other? @PPLElectric get to work!!,2019-10-16 18:32:42+00:00,,
494,ne_bomb_cyclone,during,2019-10-17,power outage,1184537409691836422,cbccolleenjones,My story-fresh off of Dorian & with cleanup still ongoing-we are as @ryansnoddon says expecting a weather bomb tomorrow. @nspowerinc has mobilized crews fearful of Dorian weakened trees falling on lines and cause power outages. Fulls Tory tonight on CBCTV @6 ,2019-10-16 18:31:40+00:00,,
495,ne_bomb_cyclone,during,2019-10-17,power outage,1184537367220125696,redeceptor,"Full moon hangover. Freak out Friday, five Mondays on a Tuesday and wet & wild Wednesday is now a write off due to a town wide power outage.",2019-10-16 18:31:30+00:00,,
496,ne_bomb_cyclone,during,2019-10-17,power outage,1184536988369723392,mrctv,"California has banned hotels from offering toiletry items in plastic bottles. This is during a time where California is dealing with a homelessness crisis, and widespread power outages to mitigate wildfire risks. ",2019-10-16 18:30:00+00:00,,
497,ne_bomb_cyclone,during,2019-10-17,power outage,1184536727718940672,clipperssc,"Unfortunately practices for our Jr. Clippers, Purple & Bronze Groups will be cancelled this afternoon (Wednesday October 16th) due to the power outage. Practices will resume this Friday (October 18th).",2019-10-16 18:28:58+00:00,,
498,ne_bomb_cyclone,during,2019-10-17,power outage,1184536418900758534,jess_dfm,Sheesh! I haven’t experienced a long power outage since 2000. Lol. It was out for 3 or 4 days during a snowstorm when the new year rang in. That’s the only one I remember in Atlanta.,2019-10-16 18:27:44+00:00,,
499,ne_bomb_cyclone,during,2019-10-17,power outage,1184536373186961409,ilovemelville,"Dear @CityPowerJhb, thank you for all your hard work, #MyMelville is just pondering, we were not scheduled (as per our ward cllr @Blouix) for any outages tonight, and yet... its pretty dark out there.. any idea why block 7A is without power..... #AskingForAFriendslashCommunity",2019-10-16 18:27:33+00:00,#MyMelville #AskingForAFriendslashCommunity,
500,ne_bomb_cyclone,during,2019-10-17,power outage,1184535580425756673,plutofy_tv,@CityPowerJhb RandParkRidge power is out. Came back on briefly. The fact I have signal means that it’s an outage not load shedding,2019-10-16 18:24:24+00:00,,
501,ne_bomb_cyclone,during,2019-10-17,power outage,1184535424443789313,KenyaPower_Care,"Hi, If you're experiencing a power outage, please provide your a/c number for assistance. ^BT",2019-10-16 18:23:47+00:00,,
502,ne_bomb_cyclone,during,2019-10-17,power outage,1184535373160046598,lydiafhall,I could do without a power outage now.,2019-10-16 18:23:35+00:00,,
503,ne_bomb_cyclone,during,2019-10-17,power outage,1184535357297254401,tmashru,This happens only with us all the time. We always have to pay a bribe to get power after the outage is over. I have been following since 6pm and saying its not general issie but we are not listened,2019-10-16 18:23:31+00:00,,
504,ne_bomb_cyclone,during,2019-10-17,power outage,1184535277001424896,HansonMAPolice,"Stormy weather ahead! As always we are here for emergencies, but please take down these numbers in case you experience a power outage. National Grid 1-800-465-1212 (Power outage and emergencies) Non-emergency HPD Dispatch 781-293-4625 Consider all downed wires as live!",2019-10-16 18:23:12+00:00,,
505,ne_bomb_cyclone,during,2019-10-17,power outage,1184535247658061831,andreaaaelliott,"@DominionEnergy any idea what's caused the power outage in Fairfax, VA and when it will be resolved?",2019-10-16 18:23:05+00:00,,
506,ne_bomb_cyclone,during,2019-10-17,power outage,1184534841175560195,annette442,That explains the power outage and underground fires! ,2019-10-16 18:21:28+00:00,,
507,ne_bomb_cyclone,during,2019-10-17,power outage,1184534749320220672,SpecNewsCLT,Still cloudy in Charlotte with a few showers developing on the cold front as it comes off the mountains. Clearing out later. Mountain winds may gust over 40mph tonight and tomorrow. Watch for tree damage and power outages. #cltwx #ncwx,2019-10-16 18:21:06+00:00,#cltwx #ncwx,
508,ne_bomb_cyclone,during,2019-10-17,power outage,1184534683410993153,WellYouSeeNorm,@petworthdcnews Power Outage in Petworth. Any idea how big or how long?,2019-10-16 18:20:50+00:00,,
509,ne_bomb_cyclone,during,2019-10-17,power outage,1184534621284896769,DougWxonthe1s,Still cloudy in Charlotte with a few showers developing on the cold front as it comes off the mountains. Clearing out later. Mountain winds may gust over 40mph tonight and tomorrow. Watch for tree damage and power outages. #cltwx #ncwx,2019-10-16 18:20:35+00:00,#cltwx #ncwx,
510,ne_bomb_cyclone,during,2019-10-17,power outage,1184534537910607873,cristellamac,@hydroottawa poweroutage on Winlock Cresent (knoxdale area),2019-10-16 18:20:16+00:00,,
511,ne_bomb_cyclone,during,2019-10-17,power outage,1184534489206349827,Joseph_Santoro,"Ummm... Massive power outage up here (at @FahrenheitApts in Washington, DC)",2019-10-16 18:20:04+00:00,,
512,ne_bomb_cyclone,during,2019-10-17,power outage,1184534459556814848,Lenky_R,Sow how long does a power outage last ke since load shedding is a thing again ,2019-10-16 18:19:57+00:00,,
513,ne_bomb_cyclone,during,2019-10-17,power outage,1184534266031607812,mbindangachinyu,Please help me reach 1k followers am hardly online due to power outages in my country,2019-10-16 18:19:11+00:00,,
514,ne_bomb_cyclone,during,2019-10-17,power outage,1184534242556088321,Jefferson_PUD,Update 11:15am: Power has been restored to 116 customers near East Quilcene Rd. There are currently four areas still affected by outages with approx 112 customers without power. https://ebill.jeffpud.org/maps/Outag_Web_Map,2019-10-16 18:19:05+00:00,,
515,ne_bomb_cyclone,during,2019-10-17,power outage,1184534133059575809,aleee510,I have 2 midterms this week and what did i do during the power outage/5 day weekend ??? NI MADRES,2019-10-16 18:18:39+00:00,,
516,ne_bomb_cyclone,during,2019-10-17,power outage,1184534092748066816,Itsyab0y04,"There’s a bunch of reasons for needing to restart, but power outages is a big one for me esp in the summer time, i wouldn’t trade my setup with reprovison to go back to needing my Mac again.",2019-10-16 18:18:29+00:00,,
517,ne_bomb_cyclone,during,2019-10-17,power outage,1184534057205542912,NottawasagaCA,"Our phone lines are currently down. If you need to get a hold of the NVCA, please message us here or email admin@nvca.on.ca. Thank you for your patience and understanding. #poweroutage",2019-10-16 18:18:21+00:00,#poweroutage,
518,ne_bomb_cyclone,during,2019-10-17,power outage,1184533966474436609,IlL0umin8,In Central Florida you mostly deal with power outages and falling trees. To be honest it ain't that bad. But every few years or so a big one does hit. At worst you'd be without power for a while.,2019-10-16 18:17:59+00:00,,
519,ne_bomb_cyclone,during,2019-10-17,power outage,1184533864749907970,AndersonFirePro,"In the instance of a power outage, emergency lighting is what can help building residents stay calm and, if necessary, lead them to safety. ",2019-10-16 18:17:35+00:00,,
520,ne_bomb_cyclone,during,2019-10-17,power outage,1184533718331002882,GuitarSlayer713,Power Outage at Work- Get to go home early! Power Outage also at home- Crap...,2019-10-16 18:17:00+00:00,,
521,ne_bomb_cyclone,during,2019-10-17,power outage,1184533479935168512,DiscoverDupont,Wednesday Will Be The Windiest Day In A Stormy Week Ahead - Watch for downed trees and prepare for power outages. https://patch.com/washington/lakewood-jblm/s/gvnr3/wednesday-will-be-windiest-day-stormy-week-ahead,2019-10-16 18:16:03+00:00,,
522,ne_bomb_cyclone,during,2019-10-17,power outage,1184533262674337799,BloomHairDesign," We are experiencing a power outage at the moment. We apologize for the inconvenience. We are unable to take calls at this time, please message us on Facebook or email if you need to get in touch. It’s expected to be back on by 3:30. ",2019-10-16 18:15:12+00:00,,
523,ne_bomb_cyclone,during,2019-10-17,power outage,1184533194349129730,ryanhanrahan,Strong and gusty winds this evening around midnight - possibly as high as 60 mph at the shoreline. Expect some power outages. #nbcct,2019-10-16 18:14:55+00:00,#nbcct,
524,ne_bomb_cyclone,during,2019-10-17,power outage,1184532869563240448,SkittlesStadium,Dean and the LA Power Outage ! #NewNameSameCurse,2019-10-16 18:13:38+00:00,#NewNameSameCurse,
525,ne_bomb_cyclone,during,2019-10-17,power outage,1184532726076137476,SHbarman,"""At least there are no 34 minute power outages!!"" ",2019-10-16 18:13:04+00:00,,
526,ne_bomb_cyclone,during,2019-10-17,power outage,1184532201922351109,strategy49,"Shallow M6.4 Earthquake Hits the Philippines, Sending People Running in the Streets – Death, Injuries, Damage, Power Outage, Panic https://strangesounds.org/2019/10/philippines-earthquake-video-photo.html via @Strange_Sounds",2019-10-16 18:10:59+00:00,,
527,ne_bomb_cyclone,during,2019-10-17,power outage,1184532140240920576,Ela_Hadrun,September: no sick days!! October: halfway through and already three sick days but one was childcare and one was the power outage but I'm still bummed my incredible upswing is pffft,2019-10-16 18:10:44+00:00,,
528,ne_bomb_cyclone,during,2019-10-17,power outage,1184532012675272704,RMofPortage,"If you're an RM resident or know of an RM resident in need of emergency shelter due to the power outage, please contact us directly at 204-857-3821 Ext. 1 or at info@rmofportage.ca.",2019-10-16 18:10:14+00:00,,
529,ne_bomb_cyclone,during,2019-10-17,power outage,1184531985211052039,uga_status,"Power outage affecting Cobb House, International Education Building, Wilson Center https://t.uga.edu/5lb",2019-10-16 18:10:07+00:00,,
530,ne_bomb_cyclone,during,2019-10-17,power outage,1184531769267310592,Jefferson_PUD,The wind is keeping our crews busy. There are approximately 225 customers affected. Winds are expected to continue until 5pm. Our crews will be on the scene until power is restored to all customers. Check our outage map for updates: https://ebill.jeffpud.org/maps/Outag_Web_Map/,2019-10-16 18:09:15+00:00,,
531,ne_bomb_cyclone,during,2019-10-17,power outage,1184531626891644930,gatewaygazette,Scheduled Planned Power Outage Postponed in High River http://bit.ly/2MKs2hr #Foothills #GatewayGazette,2019-10-16 18:08:42+00:00,#Foothills #GatewayGazette,
532,ne_bomb_cyclone,during,2019-10-17,power outage,1184531251946016768,dr_abebi,"America, THIS would have been an appropriate time for a power outage! This man is single-handedly destructing our foreign policy #CutTheMic #TrumpMeltdown",2019-10-16 18:07:12+00:00,#CutTheMic #TrumpMeltdown,
533,ne_bomb_cyclone,during,2019-10-17,power outage,1184530701305176064,PiedmontNG,"Stay warm and keep your home running during unpredictable weather and power outages with a natural gas generator. Learn more, including how to get a free 10-year warranty, at http://spr.ly/601311rSP.",2019-10-16 18:05:01+00:00,,
534,ne_bomb_cyclone,during,2019-10-17,power outage,1184530594455310336,consumerprote17,"Problem is we have had water outages for weeks now and the other day someone reported water gushing out of a pavement up the road from us. Understand water pressure being low when no power, but almost no water? &amp; all the other days with power &amp; no water. It’s 2019!",2019-10-16 18:04:35+00:00,,
535,ne_bomb_cyclone,during,2019-10-17,power outage,1184530592823726086,bukiswa,"I think we are extra in SA though, a lot of developed and developing countries have power outages and still grow just fine ",2019-10-16 18:04:35+00:00,,
536,ne_bomb_cyclone,during,2019-10-17,power outage,1184530498888130560,allterrasolar,"PG&E Says Power Outages Aren’t Going Away, Leaving California Businesses to Confront an Uncertain Future ",2019-10-16 18:04:13+00:00,,
537,ne_bomb_cyclone,during,2019-10-17,power outage,1184529915007422464,NLHydro,OUTAGE ADVISORY - PARTS OF UPPER LAKE MELVILLE Possible power outage from approximately 10PM Thursday (Oct. 17) to 6AM Friday morning: -North side of Happy Valley-Goose Bay -5 Wing Goose Bay base -Sheshatshiu -North West River View full advisory: ,2019-10-16 18:01:53+00:00,,
538,ne_bomb_cyclone,during,2019-10-17,power outage,1184529814352551938,TownCollingwood,Current power outage affecting approx 8215 customers in central &amp; western portion of Collingwood due to loss of supply on an incoming high voltage feeder line. Epcor will update soon. See the EPCOR power outage update page &gt;&gt; ,2019-10-16 18:01:29+00:00,,
539,ne_bomb_cyclone,during,2019-10-17,power outage,1184529776796688387,SuaveLlave,"I’m so exhausted. Horny tarantulas, power outages, earthquakes and explosions. All the same week as mortgage is due? I’m tired Bay Area. ",2019-10-16 18:01:20+00:00,,
540,ne_bomb_cyclone,during,2019-10-17,power outage,1184529693028040704,Barrie360Alerts,"POWER OUTAGE: @EPCOROntario reports 8, 214 customers in #Collingwood and the surrounding area are impacted by a power outage. @HydroOne is assisting in investigating the cause of the outage.",2019-10-16 18:01:00+00:00,#Collingwood,
541,ne_bomb_cyclone,during,2019-10-17,power outage,1184529570457882633,char_shutes,In a power outage - like what happened in California last week - you can use just SMS to kickoff #Commvault #DisasterRecovery in @Azure! Amazing demo at #CommvaultGO,2019-10-16 18:00:31+00:00,#Commvault #DisasterRecovery #CommvaultGO,
542,ne_bomb_cyclone,during,2019-10-17,power outage,1184529510147985408,poweralertsbot,"Power outage reported at Machakos, Kenya.(machakos)",2019-10-16 18:00:17+00:00,,
543,ne_bomb_cyclone,during,2019-10-17,power outage,1184529438911934465,PA_Consulting,#Utilities need to refine their proactive approach to #power outages. #Drones &amp; high-res cameras can help evaluate equipment conditions so utilities can decide which equipment to take offline. #Reliability expert @edeson1 discusses in @SPGlobalPlatts,2019-10-16 18:00:00+00:00,#Utilities #power #Drones #Reliability,
544,ne_bomb_cyclone,during,2019-10-17,power outage,1184529435560677378,SeekonkDispatch,"Stormy weather ahead! As always we are here for emergencies, but please take down these numbers in case you experience an outage. National Grid 1-800-465-1212 (Power outage and emergencies) Comcast 1-800-266-2278 Non-emergency Dispatch... https://www.facebook.com/story.php?story_fbid=138703527526475&amp;id=112369046826590",2019-10-16 17:59:59+00:00,,
545,ne_bomb_cyclone,during,2019-10-17,power outage,1184529253762850817,CityofBangorME,"#HeyBangor #mewx Fall nor'easter expected to bring strong winds and heavy rain to the region late tonight into tomorrow. Peak wind gusts of 30-40mph tomorrow. 1-1.5"" rain possible. Many trees still have full canopy of leaves, may be susceptible to damage or lead to power outage. ",2019-10-16 17:59:16+00:00,#HeyBangor #mewx,
546,ne_bomb_cyclone,during,2019-10-17,power outage,1184529146824855552,ibrushnroll,"Power Outage The ""Real Story"" Behind Historic Power Shutdown California ... https://youtu.be/r7HpA1VKSK8 via @YouTube",2019-10-16 17:58:50+00:00,,
547,ne_bomb_cyclone,during,2019-10-17,power outage,1184529052968902667,shafinaaz,So Eskom announces stage 2 load shedding but schedules are amiss and Sandton has been in the grip of a power outage for the past 4 hours and counting. Traffic is immeasurable chaos. It's hot. Mosquitoes hover like... https://www.facebook.com/772785369/posts/10162510358930370/,2019-10-16 17:58:28+00:00,,
548,ne_bomb_cyclone,during,2019-10-17,power outage,1184528941169696769,perch35km,Not to mention a massive area of the province is still displaced with the power outages,2019-10-16 17:58:01+00:00,,
549,ne_bomb_cyclone,during,2019-10-17,power outage,1184528934991548416,FOIGM,"Daily News Surrounding Israel STORMS FLATTEN TREES AND SUKKAHS, CAUSING BLACKOUTS AND CONCERT CANCELLATIONS An early season storm rattled Israel on Tuesday (15th), causing sporadic power outages, a bridge collapse, beaches to shut down and concerts to... http://foi.org/news/news-digest-10-16-19/",2019-10-16 17:58:00+00:00,,
550,ne_bomb_cyclone,during,2019-10-17,power outage,1184528777231192069,indayblanche,"sbihin na nating, sobrang occupied ko dahil sa pagpapanic, init ng kwarto dahil power outage, sa dilim, sa lakas lindol.",2019-10-16 17:57:22+00:00,,
551,ne_bomb_cyclone,during,2019-10-17,power outage,1184528735204233216,indayblanche,"i just wanted to ask, so naglindol kanina. syempre nagpanic ka, may power outage pa for 3 straight hour tas ikaw lng magisa sa bhouse mo.",2019-10-16 17:57:12+00:00,,
552,ne_bomb_cyclone,during,2019-10-17,power outage,1184528664379179008,TomJoyceSports,"Never thought of what happens when they come down, but this makes sense. Saw they kill animals and cause power outages",2019-10-16 17:56:55+00:00,,
553,ne_bomb_cyclone,during,2019-10-17,power outage,1184528621333073925,BlueShieldCA,"When disasters like power outages have the potential to impede our daily operations, our members’ needs never stop. We would like to thank and recognize our Customer Experience Teams who ensured our member services remained stable when our Redding office went dark. #WeNeverStop",2019-10-16 17:56:45+00:00,#WeNeverStop,
