,Event,Stage,Query Date,Query Term,Id,Username,Text,Date,Hashtags,Location
930,ne_bomb_cyclone,during,2019-10-17,power outage,1184474600178098176,realjackmaxwell,@k12albemarle is scottsville elementary school getting out early due to the power outage,2019-10-16 14:22:05+00:00,,
931,ne_bomb_cyclone,during,2019-10-17,power outage,1184474463179440128,TetsuharuHarag1,#HeavyRain #PowerOutage #WaterOutage #TyphoonDamage #Japan #大雨 #停電 #断水 #台風被害 #Day5 #5日目,2019-10-16 14:21:33+00:00,#HeavyRain #PowerOutage #WaterOutage #TyphoonDamage #Japan #Day5 #5,
932,ne_bomb_cyclone,during,2019-10-17,power outage,1184474239920934914,obamanonsense,"Side effects of Green New Deal ""Test Drive"" - Power Outage Takes Electric Vehicles With It - Granite Grok ",2019-10-16 14:20:39+00:00,,
933,ne_bomb_cyclone,during,2019-10-17,power outage,1184474044445417480,NWCjam,#NWCNewstream | HIGH TURBIDITY AND JPSCo POWER OUTAGE AFFECT SECTIONS OF ST. THOMAS AND EAST RURAL ST. ANDREW | Customers served by Wilmington Water Facility in St. Thomas are experiencing a disruption in their water supply due to high turbidity levels.. ,2019-10-16 14:19:53+00:00,#NWCNewstream,
934,ne_bomb_cyclone,during,2019-10-17,power outage,1184473603502272512,EnglandCorp,ATTENTION! A COASTAL STORM IS HEADED OUR WAY - MAKE SURE YOUR GENERATOR IS IN AUTO AND READY TO RUN. POWER OUTAGES ARE EXPECTED TO OCCUR WITH THE STRONG WINDS AND FLASH FLOODING. STAY SAFE! ,2019-10-16 14:18:08+00:00,,
935,ne_bomb_cyclone,during,2019-10-17,power outage,1184473459939667968,Pathfinder_Help,"We have identified an outage affecting Woody Creek and Old Snowmass and are working diligently to resolve the issue. If you are still experiencing an issue after you receive our resolution notification, please power cycle your modem. Thanks for your patience.",2019-10-16 14:17:33+00:00,,
936,ne_bomb_cyclone,during,2019-10-17,power outage,1184473376846483462,julie_romanszky,@KnoxKUB Carter Middle was without Power earlier this morning and now Mascot receiving a light flicker like the Electricity is going to shut off. What is going on in our area to cause the outages?,2019-10-16 14:17:14+00:00,,
937,ne_bomb_cyclone,during,2019-10-17,power outage,1184473293270609922,kadajoza,SAN FRANCISCO: California utility regulator sanctions PG&E over power outages ,2019-10-16 14:16:54+00:00,,
938,ne_bomb_cyclone,during,2019-10-17,power outage,1184473278846509059,Heidi_BP,Save them for a power outage? ,2019-10-16 14:16:50+00:00,,
939,ne_bomb_cyclone,during,2019-10-17,power outage,1184473149972406274,Chyanne1107,"So when there are power outages, and criminals are hitting up rich people whose alarms are off, they can’t even defend themselves! Way to go Cali! ",2019-10-16 14:16:20+00:00,,
940,ne_bomb_cyclone,during,2019-10-17,power outage,1184472788398170117,MasonAllMighty_, there was a power outage... aka class is cancelled... aka I came here for no reason.. the frank stand is open today,2019-10-16 14:14:53+00:00,,
941,ne_bomb_cyclone,during,2019-10-17,power outage,1184472716361027584,TECtwwi,"We are currently experiencing an outage affecting 1,423 Members out of the Chaires substation. Crews are en route to restore power as quickly and safely as possible.",2019-10-16 14:14:36+00:00,,
942,ne_bomb_cyclone,during,2019-10-17,power outage,1184472697503408133,SeelyDurlandIns,A nor'easter will bring drenching rains of up to 3 inches and extremely high winds to the #HudsonValley region tonight and tomorrow. Officials warn the storm could lead to flooding and widespread power outages. Are you prepared for the #storm? https://weather.com/en-CA/canada/news/news/2018-05-04-wind-storm-protect-home-from-wind-wind-protection,2019-10-16 14:14:32+00:00,#HudsonValley #storm,
943,ne_bomb_cyclone,during,2019-10-17,power outage,1184472449540349952,ashleyy_ji,Power outage ,2019-10-16 14:13:33+00:00,,
944,ne_bomb_cyclone,during,2019-10-17,power outage,1184472429718130688,lillymae92900,we had a power outage so classes before noon were all cancelled and i was so excited for more sleep but now my head hurts because i went back to sleep after waking up well rested so we are THRIVING,2019-10-16 14:13:28+00:00,,
945,ne_bomb_cyclone,during,2019-10-17,power outage,1184472311673606145,SAfmnews,"The Western Cape Education Department says 30 matric examination centres have been affected by loadshedding. Ministry spokesperson, Bronagh Hammond, says power outages have had an impact on the writing of today's Computor Applications Technology paper. #sabcnews",2019-10-16 14:13:00+00:00,#sabcnews,
946,ne_bomb_cyclone,during,2019-10-17,power outage,1184472281759789057,sarahwroblewski,"WIND ADVISORY for eastern MA, HIGH WIND WATCH for Cape Cod & Islands tonight through early THU. Gusty winds may blow around unsecured objects. Tree limbs & damage also possible leading to scattered power outages. Keep in mind driving may be difficult for high profile vehicles. ",2019-10-16 14:12:53+00:00,,
947,ne_bomb_cyclone,during,2019-10-17,power outage,1184472158053060608,hydroottawa,"We're keeping an eye on the weather today. A Special Weather Statement is in effect for #Ottawa. Outages are possible. Please keep devices charged and check your flashlight batteries. If the power goes out, call 613-738-0188 to report. #ottnews",2019-10-16 14:12:23+00:00,#Ottawa #ottnews,
948,ne_bomb_cyclone,during,2019-10-17,power outage,1184471917161598981,busrep,Zimbabwe starts further power cuts due to Eskom outages http://bit.ly/31l8aqc #Zimbabwe #LOADSHEDDING #ESKOM,2019-10-16 14:11:26+00:00,#Zimbabwe #LOADSHEDDING #ESKOM,
949,ne_bomb_cyclone,during,2019-10-17,power outage,1184471832885366786,FlanaganNJTV,"Reading between the power lines (pun intended)... expect some outages, and expect delays in repairs because it could be too windy Thursday to put workers up in cherry pickers... ",2019-10-16 14:11:06+00:00,,
950,ne_bomb_cyclone,during,2019-10-17,power outage,1184471766518784001,Met_Ed,"If you experience an outage due to weather, please let us know: 888-544-4877 http://spr.ly/report Text OUT to 544487 STAY FAR AWAY from downed power lines! Extra caution should be used where lines are tangled in debris. Report them ASAP 888-544-4877 or 911 2/2 ",2019-10-16 14:10:50+00:00,,
951,ne_bomb_cyclone,during,2019-10-17,power outage,1184471705147727872,PMalinMS,"Have you been impacted by the PG&E power outage? Let me know if there’s anything I can do to assist you, or contact the Morgan Stanley Client Service Center at 1 (888) 454-3965. ",2019-10-16 14:10:35+00:00,,
952,ne_bomb_cyclone,during,2019-10-17,power outage,1184471702719197187,ryan_cernochMS,"Have you been impacted by the PG&E power outage? Let me know if there’s anything I can do to assist you, or contact the Morgan Stanley Client Service Center at 1 (888) 454-3965. ",2019-10-16 14:10:35+00:00,,
953,ne_bomb_cyclone,during,2019-10-17,power outage,1184471649103568896,JCP_L,"If you experience an outage due to weather, please let us know: 888-544-4877 http://spr.ly/report Text OUT to 544487 STAY FAR AWAY from downed power lines! Extra caution should be used where lines are tangled in debris. Report them ASAP 888-544-4877 or 911 2/2 ",2019-10-16 14:10:22+00:00,,
954,ne_bomb_cyclone,during,2019-10-17,power outage,1184471601577893891,GCgettysburgian,A source familiar with the situation says that a squirrel is not responsible for this power outage. More to come.,2019-10-16 14:10:10+00:00,,
955,ne_bomb_cyclone,during,2019-10-17,power outage,1184471557420339200,michelscorp,"Michels has the equipment & resources needed to restore power after an outage. Our crews have the experience to work quickly &amp; efficiently, without sacrificing safety. We'll be showcasing our capabilities at the Outage Response &amp; Restoration Conference on Oct. 28-30 in Atlanta. ",2019-10-16 14:10:00+00:00,,
956,ne_bomb_cyclone,during,2019-10-17,power outage,1184471548146716677,CBCWindsor,"Almost 7,000 customers are without power in the Leamington, Harrow and Kingsville areas, according to the @HydroOne outage map. ",2019-10-16 14:09:58+00:00,,
957,ne_bomb_cyclone,during,2019-10-17,power outage,1184471392961617921,gecdsbpro,Widespread power outages on the south shore...phone networks are down at many schools in the area - if you need to reach a school call 519-255-3200,2019-10-16 14:09:21+00:00,,
958,ne_bomb_cyclone,during,2019-10-17,power outage,1184471305007124481,asknbid,I’m sure there is an useful explanation like the dog eat the report and it was already dark bc there was a power outage and the printer didn’t work properly and Excel did crash ... could be that the numbers are not reported per year but more by appearance ...,2019-10-16 14:09:00+00:00,,
959,ne_bomb_cyclone,during,2019-10-17,power outage,1184471285059014662,Verstr8Julie,How to Stay Safe in a Power Outage https://rismedia.com/ace2-branded/Content-Library/92268/MkFoY1FIeXFhbWhybytPSEQ5RHFaQT09/Twitter,2019-10-16 14:08:55+00:00,,
960,ne_bomb_cyclone,during,2019-10-17,power outage,1184471170722091008,bsesdelhi,"We have noted your complaint. For ""No Current/ Power Outage"" complaints you can register through WhatsApp no. (BRPL) 9999919123 Type #NC &lt;space&gt; 9-digit-CA-Number and send on WhatsApp via registered mobile number for that CA",2019-10-16 14:08:28+00:00,#NC,
961,ne_bomb_cyclone,during,2019-10-17,power outage,1184470499906195457,RedCrossMA,Do you know how to prepare for a #poweroutage? Learn more at https://rdcrss.org/2CewwL7 Make sure you charge those phones and devices tonight!,2019-10-16 14:05:48+00:00,#poweroutage,
962,ne_bomb_cyclone,during,2019-10-17,power outage,1184470439751536640,consbad75,They are some dumbass people. Call and report power outage at house. They call back and say they don’t show any outage here. Well ma’am I’m sitting here and I’m telling u it’s out. Neighbor calls too. After three or four calls from my road OH NOW THERE IS A OUTAGE!!!!,2019-10-16 14:05:33+00:00,,
963,ne_bomb_cyclone,during,2019-10-17,power outage,1184470253150982145,Homegrown_OP,Our current situation is closed due to a power outage in OP! We will keep you posted when our lights are back on! @Homegrown Bistro https://www.instagram.com/p/B3rokdjB5Cd/?igshid=j8vv3k6r5kf1,2019-10-16 14:04:49+00:00,,
964,ne_bomb_cyclone,during,2019-10-17,power outage,1184470103934537729,xandatoto,Zimbabwe Starts Further Power Cuts Due to Eskom Outages ,2019-10-16 14:04:13+00:00,,
965,ne_bomb_cyclone,during,2019-10-17,power outage,1184469961122680832,wrrv,"Everything you need to know about the Nor'easter that officials warn could lead to flooding and ""widespread power outages."" ",2019-10-16 14:03:39+00:00,,
966,ne_bomb_cyclone,during,2019-10-17,power outage,1184469801370079232,BikoIntellect,"@KenyaPower_Care hi, I am reporting a power outage. Details in the DM",2019-10-16 14:03:01+00:00,,
967,ne_bomb_cyclone,during,2019-10-17,power outage,1184469646424059906,filipe_pombeiro,Johannesburg will soon be experiencing a planned power outage! I will be in the DARK but you don’t have to. 5 reactions coming up 15 minutes apart from each other!!! Enjoy #fablesquad,2019-10-16 14:02:24+00:00,#fablesquad,
968,ne_bomb_cyclone,during,2019-10-17,power outage,1184469466689789953,CSIDayDreamer,Should we have to worry about power outages?,2019-10-16 14:01:41+00:00,,
969,ne_bomb_cyclone,during,2019-10-17,power outage,1184469187869237249,SydesJokes,California's power outages show #climatechange is coming for everyone #ClimateCrisis #ClimateEmergency,2019-10-16 14:00:35+00:00,#climatechange #ClimateCrisis #ClimateEmergency,
970,ne_bomb_cyclone,during,2019-10-17,power outage,1184468862630273024,JillBemi,"The Red River always causes us issues. Just never this early. We had a lot of snow late last week, which caused a lot of power outages and a lot of downed trees, because it was so wet and heavy.",2019-10-16 13:59:17+00:00,,
971,ne_bomb_cyclone,during,2019-10-17,power outage,1184468769894289408,CornerstoneVB,"Last time this matchup brought a tornado, a power outage, a 48 hour delay, and a five set win! You won’t want to miss it! #TogetherweSOAR",2019-10-16 13:58:55+00:00,#TogetherweSOAR,
972,ne_bomb_cyclone,during,2019-10-17,power outage,1184468593616052225,ReadyNJ,Weather Update Check http://511nj.org for traffic conditions before your evening commute NEVER drive through flooded areas! Obey traffic barriers! Stay tuned to your local weather for updates Report a power outage #ReadyNJ #WednesdayWisdom #FloodSafety,2019-10-16 13:58:13+00:00,#ReadyNJ #WednesdayWisdom #FloodSafety,
973,ne_bomb_cyclone,during,2019-10-17,power outage,1184468498833010696,Lunisity,power outage in #vancouver my phones about to die and i have work soon uh oh,2019-10-16 13:57:51+00:00,#vancouver,
974,ne_bomb_cyclone,during,2019-10-17,power outage,1184468132079067138,EastKingstonFD,Get ready. Powerful nor’ Easter on its way. Winds topping 40 mph expected overnight along with power outages. https://ekfd.org/2019/10/16/get-ready-powerful-nor-easter-on-its-way-winds-topping-40-mph-expected-overnight-along-with-power-outages/,2019-10-16 13:56:23+00:00,,
975,ne_bomb_cyclone,during,2019-10-17,power outage,1184467530632454144,remstacenter,"Drills and exercises are an important piece to your school's #emergency #preparedness efforts. If you need a refresher for your #school on how to handle a power outage, check out our Power Outage Tabletop Exercise: https://rems.ed.gov/Docs/5B_PowerOutage_TabletopExercise_508C.pdf #WednesdayWisdom #SchoolSafety",2019-10-16 13:54:00+00:00,#emergency #preparedness #school #WednesdayWisdom #SchoolSafety,
976,ne_bomb_cyclone,during,2019-10-17,power outage,1184467512890667009,943litefm,"Everything you need to know about the Nor'easter that officials warn could lead to flooding and ""widespread power outages."" https://now977.com/timing-impact-of-noreaster-in-the-hudson-valley/",2019-10-16 13:53:56+00:00,,
977,ne_bomb_cyclone,during,2019-10-17,power outage,1184467200683511808,naidoo7,"@CyrilRamaphosa Dear Mr President - ""Power outage during MATRIC EXAMS"" How do you feel about LOAD SHEDDING affecting our children's 2019 MATRIC Technical EXAMS? The Youth of South Africa are continuously looking to Government for signs of support, ESKOM not supporting !",2019-10-16 13:52:41+00:00,,
978,ne_bomb_cyclone,during,2019-10-17,power outage,1184466633181392896,bsesdelhi,"We have noted your complaint. For ""No Current/ Power Outage"" complaints you can register through WhatsApp no. (BRPL) 9999919123 Type #NC &lt;space&gt; 9-digit-CA-Number and send on WhatsApp via registered mobile number for that CA",2019-10-16 13:50:26+00:00,#NC,
979,ne_bomb_cyclone,during,2019-10-17,power outage,1184466533336018945,jennifer_abell,Daniel of St. Thomas Jenifer Elementary School closed today due to power outage ,2019-10-16 13:50:02+00:00,,
980,ne_bomb_cyclone,during,2019-10-17,power outage,1184466402855526407,CNPalerts,Attention #Houston-area electric customers: Outage Tracker Power and Alert Service are back in service - thanks for your patience. Visit http://CenterPointEnergy.com/StayInformed to get #electric service details.,2019-10-16 13:49:31+00:00,#Houston #electric,
981,ne_bomb_cyclone,during,2019-10-17,power outage,1184466296991174657,SaraStinsonNews,This is interesting...PG&E found about 100 different instances of damage to power lines from the high wind we had during the power shutoff. Do you think the outages are a good thing after seeing this? I know a lot of people I met and interviewed weren't happy during the #PSPS.,2019-10-16 13:49:06+00:00,#PSPS,
982,ne_bomb_cyclone,during,2019-10-17,power outage,1184466252946989056,bebarce,"This may have flown under the radar, but digital copies of Power Outage now sell for only $15 (used to be $20). Now is an excellent chance to pick up a copy. Also, I'll soon be releasing the first stand alone adventure, Out of the Pan! Click below #ttrpg https://www.drivethrurpg.com/product/266133/Power-Outage-Core-Guide-Book",2019-10-16 13:48:55+00:00,#ttrpg,
983,ne_bomb_cyclone,during,2019-10-17,power outage,1184466205421297664,NBC10Boston,"#FirstAlertWeather: Nor'easter to bring 40-60 MPH winds, cause power outages http://on.nbcboston.com/YUtAtN7",2019-10-16 13:48:44+00:00,#FirstAlertWeather,
984,ne_bomb_cyclone,during,2019-10-17,power outage,1184465836926558208,hvcountry,"Everything you need to know about the Nor'easter that officials warn could lead to flooding and ""widespread power outages."" ",2019-10-16 13:47:16+00:00,,
985,ne_bomb_cyclone,during,2019-10-17,power outage,1184465783604350977,DukesHuman,"Give it a rest Swallowwell, your state is on fire with power outages and poop in the streets. Maybe you should be working for your constituents ",2019-10-16 13:47:03+00:00,,
986,ne_bomb_cyclone,during,2019-10-17,power outage,1184465454791827457,FEAS_Panthers,"IMPORTANT Schedule Change for FEAS: Due to the power outage FEAS will be dismissing early today, Wednesday, October 16. Frankfort Elementary will be dismissed at 10:30 AM and Frankfort High School will be dismissed at 10:40 AM￼. Busses will be running. ",2019-10-16 13:45:45+00:00,,
987,ne_bomb_cyclone,during,2019-10-17,power outage,1184464628434247681,CoastTec,"The main #function of an #uninterruptiblepowersupply (#UPS) is to #protect the #criticalload during a #poweroutage by supplying #backuppower from a stored-#energy device, and by providing stable #voltage and #frequency.",2019-10-16 13:42:28+00:00,#function #uninterruptiblepowersupply #UPS #protect #criticalload #poweroutage #backuppower #energy #voltage #frequency,
988,ne_bomb_cyclone,during,2019-10-17,power outage,1184464018053853184,lisamflower,We're now a lone blip on the outage map for our area. I don't imagine our power will be up anytime soon now that they've moved on from this area. Borrowing a generator so we can at least get some heat. Little Big and Small have been real champs throughout this. #MBOutage,2019-10-16 13:40:02+00:00,#MBOutage,
989,ne_bomb_cyclone,during,2019-10-17,power outage,1184464004447522817,Ccc_jdvvnl,Sir we had word with concerned jen sir due to 11 kv line broken power outage in ur area. And they will do the needful asap...,2019-10-16 13:39:59+00:00,,
990,ne_bomb_cyclone,during,2019-10-17,power outage,1184463789225320451,serversteph,"In the last week we’ve had, in order, power outages, earthquakes and refinery fires oh my!!! (said in my best Dorthy voice)",2019-10-16 13:39:08+00:00,,
991,ne_bomb_cyclone,during,2019-10-17,power outage,1184463574325964801,ClaimOut,"#ClaimOut-News ""Widespread power outages"" #Zimbabwe: Customers throughout Zimbabwe reportedly suffer power outages on October 15 after a tower is vandalized; further power disruptions expected through October 16 Was your flight disrupted? http://claimout.com",2019-10-16 13:38:17+00:00,#ClaimOut #Zimbabwe,
992,ne_bomb_cyclone,during,2019-10-17,power outage,1184463393153060865,wpdhfm,"Everything you need to know about the Nor'easter that officials warn could lead to flooding and ""widespread power outages."" https://wpdh.com/timing-impact-of-noreaster-in-the-hudson-valley/",2019-10-16 13:37:33+00:00,,
993,ne_bomb_cyclone,during,2019-10-17,power outage,1184463353521070085,WestHazletonEMA,RT ReadyPA We've got rain and wind in the forecast across PA today (10/16) through Thursday (10/17). Be #prepared by securing outdoor objects &amp; knowing who to call in case of a #poweroutage. Always follow your trusted local weather source &amp; get #PAwx…,2019-10-16 13:37:24+00:00,#prepared #poweroutage #PAwx,
994,ne_bomb_cyclone,during,2019-10-17,power outage,1184463323926056960,PEMAHQ,We've got rain and wind in the forecast across PA today (10/16) through Thursday (10/17). Be #prepared by securing outdoor objects &amp; knowing who to call in case of a #poweroutage. Always follow your trusted local weather source &amp; get #PAwx alerts in multiple ways! ,2019-10-16 13:37:17+00:00,#prepared #poweroutage #PAwx,
995,ne_bomb_cyclone,during,2019-10-17,power outage,1184463001484713984,DominionEnergy,"Hi, Tonya. Unfortunately, we do not give credits for power outages.",2019-10-16 13:36:00+00:00,,
996,ne_bomb_cyclone,during,2019-10-17,power outage,1184462981347860482,robertgrimm_wx,"Expecting strong gusting winds*! ...~Projected wind gusts Thursday into Friday, between 30-40 mph. Winds will be strong enough to bring down some tree branches/limbs and cause a few localized power outages. #mewx #nbstorm",2019-10-16 13:35:55+00:00,#mewx #nbstorm,
997,ne_bomb_cyclone,during,2019-10-17,power outage,1184462794063781890,AdvancedDiesel_,Suffering from a #powercut in the #WA9 #WA10 or #WA11? Have a read of this: http://bit.ly/2TwnZYz #poweroutage #business #DieselGenerator,2019-10-16 13:35:11+00:00,#powercut #WA9 #WA10 #WA11 #poweroutage #business #DieselGenerator,
998,ne_bomb_cyclone,during,2019-10-17,power outage,1184462742801002496,YorkCountyEMA,"High winds expected tonight into tomorrow. Power outages are a possibility. Charge phones, locate flashlights, and ensure your emergency kit is available. Stay tuned for updates. ",2019-10-16 13:34:58+00:00,,
999,ne_bomb_cyclone,during,2019-10-17,power outage,1184462489448148993,gaurav_ipx,"@narendramodi @PMOIndia : I was in Tokyo Kiba area during the typhoon 19 and I must say the attentiveness and readiness of Tokyo administration to combat the Typhoon was really amazing... Not even a single minute power, water or telecom outage.",2019-10-16 13:33:58+00:00,,
1000,ne_bomb_cyclone,during,2019-10-17,power outage,1184462079039815681,st616k,"Oh boy, mine is probably in the early seasons when i used to play in this small gaming cafe, and suddenly me and premades all DCd due to a power outage, and only that one random teammate remained, and after about 8-9 mins we reconnected and still managed to win the game",2019-10-16 13:32:20+00:00,,
1001,ne_bomb_cyclone,during,2019-10-17,power outage,1184462015219277824,ScottsvilleTown,Power outage now affecting most of the town and nearby area. @AppalachianPowe currently expects 2:30pm. We'll sharecsafety information and updates.,2019-10-16 13:32:05+00:00,,
1002,ne_bomb_cyclone,during,2019-10-17,power outage,1184461856573771776,JPFerrerMS,"Have you been impacted by the PG&E power outage? Let me know if there’s anything I can do to assist you, or contact the Morgan Stanley Client Service Center at 1 (888) 454-3965. ",2019-10-16 13:31:27+00:00,,
1003,ne_bomb_cyclone,during,2019-10-17,power outage,1184461765243035648,maximummeh,I have a dog afraid of - Power outages.,2019-10-16 13:31:05+00:00,,
1004,ne_bomb_cyclone,during,2019-10-17,power outage,1184461741398192128,incidentAlertMe,Power Outage: 00:19: (2521 premises) - Bentleigh East - ETA restoration: 4:00 AM today. - Poss cause: Suspected cause - under investigation See https://outagemap.unitedenergy.com.au/ #vicPower,2019-10-16 13:31:00+00:00,#vicPower,
1005,ne_bomb_cyclone,during,2019-10-17,power outage,1184461740223807488,incidentAlertMe,Power Outage: 00:19: (1977 premises) - Oakleigh East - ETA restoration: 4:00 AM today. - Poss cause: Suspected cause - under investigation See https://outagemap.unitedenergy.com.au/ #vicPower,2019-10-16 13:30:59+00:00,#vicPower,
1006,ne_bomb_cyclone,during,2019-10-17,power outage,1184461739032662017,incidentAlertMe,Power Outage: 00:19: (2760 premises) - Oakleigh South - ETA restoration: 4:00 AM today. - Poss cause: Suspected cause - under investigation See https://outagemap.unitedenergy.com.au/ #vicPower,2019-10-16 13:30:59+00:00,#vicPower,
1007,ne_bomb_cyclone,during,2019-10-17,power outage,1184461737837285376,incidentAlertMe,Power Outage: 00:19: (3199 premises) - Clayton - ETA restoration: 4:00 AM today. - Poss cause: Suspected cause - under investigation See https://outagemap.unitedenergy.com.au/ #vicPower,2019-10-16 13:30:59+00:00,#vicPower,
1008,ne_bomb_cyclone,during,2019-10-17,power outage,1184461736662818816,incidentAlertMe,Power Outage: 00:19: (2959 premises) - Clarinda - ETA restoration: 4:00 AM today. - Poss cause: Suspected cause - under investigation See https://outagemap.unitedenergy.com.au/ #vicPower,2019-10-16 13:30:58+00:00,#vicPower,
1009,ne_bomb_cyclone,during,2019-10-17,power outage,1184461648884568065,Kissanurse75,Power outage AGAIN!,2019-10-16 13:30:37+00:00,,
1010,ne_bomb_cyclone,during,2019-10-17,power outage,1184461599135977472,poweralertsbot,"Power outage reported at Juja, Kenya.(juja c)",2019-10-16 13:30:26+00:00,,
1011,ne_bomb_cyclone,during,2019-10-17,power outage,1184461590835404800,poweralertsbot,"Power outage reported at Mombasa, Kenya.(mombasa)",2019-10-16 13:30:24+00:00,,
1012,ne_bomb_cyclone,during,2019-10-17,power outage,1184461070414446593,nicksplitter,Wonderful that a power outage causes our unused and disabled house alarm to beep loudly every 60 seconds outside the baby's bedroom. @UnitedEnergyAU says ETA for power is 4am. Wonderful.,2019-10-16 13:28:20+00:00,,
1013,ne_bomb_cyclone,during,2019-10-17,power outage,1184460898968031237,rohitkrgupta,Very less outage in Gurgaon. Sometimes we get messages from DHVBN about the timings of power outages. One should must appreciate Haryana Govt.,2019-10-16 13:27:39+00:00,,
1014,ne_bomb_cyclone,during,2019-10-17,power outage,1184460695288664065,elkenergyinc,Portions of E.L.K.'s Harrow and Kingsville service area is currently experiencing a power outage. The outage is currently being investigated to determine an estimated restoration time.,2019-10-16 13:26:50+00:00,,
1015,ne_bomb_cyclone,during,2019-10-17,power outage,1184460577063817216,Paparazzi1010,@aedcelectricity pls there is power outage in some part of Aco estate. Particularly around save heritage crest schools n environs.,2019-10-16 13:26:22+00:00,,
1016,ne_bomb_cyclone,during,2019-10-17,power outage,1184460277309497345,Q104Kenora,"A power outage is affecting the entire town of Sioux Lookout and Alcona. The outage has caused some bus delays, but all schools remain open.",2019-10-16 13:25:10+00:00,,
