,Event,Stage,Query Date,Query Term,Id,Username,Text,Date,Hashtags,Location
482,january-mid,during,2019-01-20,power outage,1086681736623341569,springfieldnews,Power Outages: The latest outages from around the Miami Valley https://www.springfieldnewssun.com/news/local/power-outages-latest-totals-from-around-the-miami-valley/1WmQLnb0rlaVJMKbuOT4HP/,2019-01-19 17:48:10+00:00,,
483,january-mid,during,2019-01-20,power outage,1086681680663007233,journalnews,Power Outages: The latest outages from around the Miami Valley https://www.journal-news.com/news/local/power-outages-latest-totals-from-around-the-miami-valley/1WmQLnb0rlaVJMKbuOT4HP/,2019-01-19 17:47:56+00:00,,
484,january-mid,during,2019-01-20,power outage,1086681388575834112,SegunTekun,"Dear aedc, We have experience power outage in wuye since early hour of today..Please kindly help us do the needful to restore power..",2019-01-19 17:46:47+00:00,,
485,january-mid,during,2019-01-20,power outage,1086681162637078529,daytondailynews,Power Outages: The latest outages from around the Miami Valley ,2019-01-19 17:45:53+00:00,,
486,january-mid,during,2019-01-20,power outage,1086681129388781570,WHIORadio,Power Outages: The latest outages from around the Miami Valley https://www.whio.com/news/local/power-outages-latest-totals-from-around-the-miami-valley/1WmQLnb0rlaVJMKbuOT4HP/,2019-01-19 17:45:45+00:00,,
487,january-mid,during,2019-01-20,power outage,1086681107976859648,whiotv,Power Outages: The latest outages from around the Miami Valley https://www.whio.com/news/local/power-outages-latest-totals-from-around-the-miami-valley/1WmQLnb0rlaVJMKbuOT4HP/,2019-01-19 17:45:40+00:00,,
488,january-mid,during,2019-01-20,power outage,1086680970068197376,TECtwwi,We are currently experiencing an outage to the Killearn substation affecting around 2300 members. Crews are working to restore power.,2019-01-19 17:45:07+00:00,,
489,january-mid,during,2019-01-20,power outage,1086680966754639872,TrustSteve19,Here is my new forecast HAZARDS EVENING & OVERNIGHT: 1. Frz Rain/Sleet for a couple of hours 2. Flash Freezing of wet surfaces 3. Snow on top of ice 4. Snow accum 5. Wind = Power Outages 6. Wind = Blowing Snow 7. Wind Chill &lt; ZERO by dawn 8. Cold Temps #snow #forecast,2019-01-19 17:45:06+00:00,#snow #forecast,
490,january-mid,during,2019-01-20,power outage,1086680962799419393,poweralertsbot,"Power outage reported at Kisumu, Kenya.(kisumu)",2019-01-19 17:45:05+00:00,,
491,january-mid,during,2019-01-20,power outage,1086680563820478464,OlympusAHrsdnt,#poweroutage Power outage in Olympus again,2019-01-19 17:43:30+00:00,#poweroutage,
492,january-mid,during,2019-01-20,power outage,1086680556119748609,shotgunner101,Oh great well looks like we have potential power outages to look forward to again . ,2019-01-19 17:43:28+00:00,,
493,january-mid,during,2019-01-20,power outage,1086680411554631680,MarksmanMarine,"Let's hope for the best and prepare for the worst Hopefully when we open our door tomorrow morning, it won't look like this. The snow combined with the ice, will cause power outages. Be safe! ",2019-01-19 17:42:54+00:00,,
494,january-mid,during,2019-01-20,power outage,1086680238619271169,WLKYJohnBelski,"Already about 2,500 power outages in central Indiana. That number will increase with more ice this afternoon and 40 mph winds this evening. ",2019-01-19 17:42:13+00:00,,
495,january-mid,during,2019-01-20,power outage,1086680178397458434,The_snave,@KenyaPower_Care power outage I'm kisumu from 7. Same happened yesterday. What's up?,2019-01-19 17:41:58+00:00,,
496,january-mid,during,2019-01-20,power outage,1086680075976597504,Vandahmier,"Dangerous blizzard, ice storm wallops Midwest with treacherous travel and power outages http://AccuWeather.com As a storm with snow and ice strengthens, gusty winds and plummeting temperatures will lead to blizzard conditions in many areas of the… http://fxmb.info/Qx2tsN",2019-01-19 17:41:34+00:00,,
497,january-mid,during,2019-01-20,power outage,1086679982749949953,KennyBholanauth,How long should we expect the power outages to last for?,2019-01-19 17:41:12+00:00,,
498,january-mid,during,2019-01-20,power outage,1086679503139680257,skyskiIIer,our power was already out for like an hour and a half this morning and widespread power outages are expected WITH the oncoming snow sgksg rip,2019-01-19 17:39:17+00:00,,
499,january-mid,during,2019-01-20,power outage,1086679385229459457,Riamaria__,We have a power outage until 2pm ,2019-01-19 17:38:49+00:00,,
500,january-mid,during,2019-01-20,power outage,1086679271085617152,Scalphunter99,@TECtwwi what's up with the #poweroutage in Killearn Lakes that's been going on for over an hour on this beautiful Saturday???,2019-01-19 17:38:22+00:00,#poweroutage,
501,january-mid,during,2019-01-20,power outage,1086679217188814850,milieuxhresyll,"IM TRYNA LOOK FOR A FLASHLIGHT IN CASE OF POWER OUTAGE AND I COULDNT FIND ONE. THEN I REALIZED, I COULD JUST USE MY ARMY BOMB!!! ",2019-01-19 17:38:09+00:00,,
502,january-mid,during,2019-01-20,power outage,1086678990776123392,bd3c63faeccf44e,POWER OUTAGE Ref:64 of 01/19/2019 (Savannah Country Estate-Old Bronkhorspruit Road and Solomon Mahlangu) I just phoned a lady at your call center and she advised that the outage has been escalated but has not been assigned to a technician. Power has been gone since 01H00??,2019-01-19 17:37:15+00:00,,
503,january-mid,during,2019-01-20,power outage,1086678314868228096,NWSIndianapolis,Temperatures have dropped below freezing in #Indy. Expect some ice accumulation on trees and elevated surfaces. Accumulated ice may cause more widespread power outages this afternoon as winds gust up to 40 mph. We still expect a transition to snow by 2-3 PM. #INwx,2019-01-19 17:34:34+00:00,#Indy #INwx,
504,january-mid,during,2019-01-20,power outage,1086678286191812609,TLSullivan,"Outage news &amp; updates : Receive local @nationalgridus power restoration text alerts by texting the word SUM followed by your town, county, or state to NGRID (64743) For example, if you live in Newport simply text “SUM Newport” ",2019-01-19 17:34:27+00:00,,
505,january-mid,during,2019-01-20,power outage,1086678180012920832,shenry1,Getting ready for the possibility of power outages by charging up my @GoalZero power packs.,2019-01-19 17:34:02+00:00,,
506,january-mid,during,2019-01-20,power outage,1086677920511254529,DanLovallo,"Storm could lead to ice, power outages and much more. Listen to @BradFieldWx podcast for the latest. http://bradfieldweather.com/field-i-84-corridor-will-be-treacherous-ice-40-mph-winds-power-outages/",2019-01-19 17:33:00+00:00,,
507,january-mid,during,2019-01-20,power outage,1086677792010448896,NicoleSAlbers,What’s up with the power outage @TECtwwi ? It’s been more than an hour and there’s nothing on Twitter. Any ETA on restoration?,2019-01-19 17:32:29+00:00,,
508,january-mid,during,2019-01-20,power outage,1086677789401591808,KUAdirect,"Our crews are currently troubleshooting a power outage in the Buenaventura Lakes area of #Kissimmee, affecting 2,136 customers. #poweroutage ",2019-01-19 17:32:29+00:00,#Kissimmee #poweroutage,
509,january-mid,during,2019-01-20,power outage,1086677651278970881,SPIAindex,"As sustained winds & wind gusts come down, so do number of electric system outages across OK. As of 11:15am 3 major utilities in OK are reporting just under 600 consumer outages. Power crews will continue to work in sub-freezing temps to restore service #okmesonet #ThankALineman",2019-01-19 17:31:56+00:00,#okmesonet #ThankALineman,
510,january-mid,during,2019-01-20,power outage,1086677619423227906,markpoloncarz,A warning shelter has been opened at the North Buffalo Community Center for those affected by the @ParksideBuffalo power outage. ,2019-01-19 17:31:48+00:00,,
511,january-mid,during,2019-01-20,power outage,1086677615002423300,ma_za_kpe,"#100DaysOfCode Due to power outage in the district . I simply perused through the ""How Angular Works"" chapter.",2019-01-19 17:31:47+00:00,#100DaysOfCode,
512,january-mid,during,2019-01-20,power outage,1086677166438342657,WSLS_Michaels,Gusty wind + cold air = LOW wind chills Sunday and Monday. Perhaps some spotty power outages too. Opportunity for a flash freeze is highest in the mountains Sunday PM/evening. #swvawx #vawx,2019-01-19 17:30:00+00:00,#swvawx #vawx,
513,january-mid,during,2019-01-20,power outage,1086677091209355265,JointCyclone,"#WinterStormHarper is making its way across the Northeast parts of the United States, already dumping several feet of #snow to bring a drifting of snow blowing and strong winds causing widespread power outages in some areas on Sunday. ",2019-01-19 17:29:42+00:00,#WinterStormHarper #snow,
514,january-mid,during,2019-01-20,power outage,1086676900397735936,Lilliputty,Really? The same power company that faked shortages to justify outages to justify raising rates? Nah. It must be global warming. Or the Russians. Or something.,2019-01-19 17:28:57+00:00,,
515,january-mid,during,2019-01-20,power outage,1086676889106857984,wco1982,@CityTshwane power outages @Olympus. 83 Troy Rd. #thisisgettingold,2019-01-19 17:28:54+00:00,#thisisgettingold,
516,january-mid,during,2019-01-20,power outage,1086676793354940416,jeonghanchem,"yes, roje. milk teas consume a lot of electricity resulting to power outage.",2019-01-19 17:28:31+00:00,,
517,january-mid,during,2019-01-20,power outage,1086676717287235585,OlympusAHrsdnt,Reported power outage yesterday. Power came back on but just went off. Tried reporting. Gave me same number as yesterday,2019-01-19 17:28:13+00:00,,
518,january-mid,during,2019-01-20,power outage,1086676529034207232,ToddHarmeson,"This is still a developing storm that could turn very bad this evening. Citizens should make sure they have cell phones charged, batteries for flashlights and extra blankets to keep warm in the event of a power outage. #WinterStorm #Snow #BePrepared",2019-01-19 17:27:28+00:00,#WinterStorm #Snow #BePrepared,
519,january-mid,during,2019-01-20,power outage,1086676462306914304,FirstLooK_WI,"Consider adding a UPS (uninterruptible power supply) for your home computers. A UPS will help keep your hard drives from being potentially damaged during unexpected power outages, and will protect better than a surge protector. ",2019-01-19 17:27:12+00:00,,
520,january-mid,during,2019-01-20,power outage,1086676324520026112,ThePsyShyster,"Okay, my project might be a bit delayed. There seems to have been a power outage last night/this morning and I lost some of my progress. Release still should be this month, though!",2019-01-19 17:26:39+00:00,,
521,january-mid,during,2019-01-20,power outage,1086676092365271041,VoteHealth,No deal. Period. ’s got nothing. Snow/ice storms. Polar Vortex. Air traffic snarl ups. Power outages. Furloughed workers without heat or fuel. Motherf***er’s got a busted straight. He’ll fold this week.,2019-01-19 17:25:44+00:00,,
522,january-mid,during,2019-01-20,power outage,1086676061025390592,David4rds,Never saw this on the side of a Bus #insulin shortages people giving advice on how to store your stocks of insulin in case of #poweroutage's #Brexit the gift that just keeps taking away people's hope and futures.,2019-01-19 17:25:37+00:00,#insulin #poweroutage #Brexit,
523,january-mid,during,2019-01-20,power outage,1086675519872081928,storiesflowcom,"(Indianapolis Star) #Indianapolis weather: #Updates on incoming snow, driving conditions, power outages : Snow has not started falling in Central Indiana. But it may, and bone-chilling temperatures are expected to follow. .. https://www.storiesflow.com/2986541901/indianapolis-updates-weather-incoming-driving-conditions-outages",2019-01-19 17:23:28+00:00,#Indianapolis #Updates,
524,january-mid,during,2019-01-20,power outage,1086675057370415104,Iflandway,Get ready for power outages. Driving on ice; 4wd becomes a 4 wheel slide. Studs &amp; chains; everything else goes into the ditch... ,2019-01-19 17:21:37+00:00,,
525,january-mid,during,2019-01-20,power outage,1086674846120062976,HamiltonCoEOC,"Power outages are up slightly at 1,349 customers without power.",2019-01-19 17:20:47+00:00,,
526,january-mid,during,2019-01-20,power outage,1086674464740335621,Asharraa,Electricity outage is not just in Tshwane! Wake up! From Musina to Marble Hall did not have power,2019-01-19 17:19:16+00:00,,
527,january-mid,during,2019-01-20,power outage,1086673771065421824,dianedi519,I am glad. I was concerned about the ice and power outages.,2019-01-19 17:16:31+00:00,,
528,january-mid,during,2019-01-20,power outage,1086673688563535874,Molao_Sir,"There's nothing wrong using your cell4n as long it doesn't interfere with your wrk, the way I understand it here, the duo used their phones when there was power outage but resumed duty immediately it was restored. Employers must understand people are not robots, dey have life.",2019-01-19 17:16:11+00:00,,
529,january-mid,during,2019-01-20,power outage,1086673516915802112,CoxHelp,"Hi Bojogabo, there's no outage at this time, &amp; the majority of devices on your node are reporting good connectivity. I'm not able to get a signal to your modem. Unplug the power from your modem for 30 seconds &amp; then plug it back in. Let's see if we can get it back online! -Becky",2019-01-19 17:15:30+00:00,,
530,january-mid,during,2019-01-20,power outage,1086673404521037825,inewsreportnet,"MEMA ALERT: Snow, ice, rain, wind, & cold mixed around the State. Expect slick roads with moisture & freezing. We are closely coordinating with state agencies & local emergency managers, and monitoring power outages closely. http://ow.ly/P6Yl50kfPl0 Please remain vigilant #MdWx h",2019-01-19 17:15:03+00:00,#MdWx,
531,january-mid,during,2019-01-20,power outage,1086673362619981824,NishayG,@CityPowerJhb power outage in part of Lenasia south no supply for 5 hours now CPWEB2388639,2019-01-19 17:14:53+00:00,,
532,january-mid,during,2019-01-20,power outage,1086672932355665920,b6f321f9b0bb47b,"CPWEB2388708 Power outage in Northwold, please acknowledge &amp; report when techs are dispatched.",2019-01-19 17:13:11+00:00,,
533,january-mid,during,2019-01-20,power outage,1086672636250415105,MadCoINwx,"Snow IS working in from NW & should be Countywide by about 2pm. 5""+ is Still Poss. That's said, DON'T GET HUNG UP ON THE SNOW AMOUNTS. With ice on power lines, winds picking up, &amp; temps falling, power outages, blowing snow, &amp; icy roads, will be BIG problems. #MadCoWx #INwx",2019-01-19 17:12:00+00:00,#MadCoWx #INwx,
534,january-mid,during,2019-01-20,power outage,1086672459179319296,ChrisRomp,"It is, but that can also be undesired if there's a power outage and later your bedroom lights come on at max brightness at 3am. Fortunately the default behavior is now configurable per light in the Hue app. Also thoughtful design.",2019-01-19 17:11:18+00:00,,
535,january-mid,during,2019-01-20,power outage,1086672306401890304,TLSullivan," If you experience an outage during #WinterStormHarper, don't rely on neighbors to report it. Customer outage reports help @nationalgridus restore power faster to your area Report outage:800-465-1212 Gas emergency: 800-640-1595 Report downed power lines to 911 &amp; stay clear ",2019-01-19 17:10:41+00:00,#WinterStormHarper,
536,january-mid,during,2019-01-20,power outage,1086672196435673088,ImmanuelLandman,Reminder: 10-hour power outage to hit West residents | Rekord Moot ,2019-01-19 17:10:15+00:00,,
537,january-mid,during,2019-01-20,power outage,1086672091003473920,CZorcov,"#alwx Likely tornado with through Northport AL, weak tornado was likely and based on power outages",2019-01-19 17:09:50+00:00,#alwx,
538,january-mid,during,2019-01-20,power outage,1086671544624005120,GPSstandbypower,Are you with out power? Check out current outages here http://gis.centerpointenergy.com/outagetracker/?WT.ac=OC_Image_Callout http://gis.centerpointenergy.com/outagetracker/?WT.ac=OC_Image_Callout,2019-01-19 17:07:40+00:00,,
539,january-mid,during,2019-01-20,power outage,1086671502014062596,KandyTraxEnt,City wide power outage. perfect time to go back to sleep then,2019-01-19 17:07:30+00:00,,
540,january-mid,during,2019-01-20,power outage,1086671014996660225,Ken_Taylor_,Power outages during a hangover are so much worse. What am I supposed to do know? Read a book?,2019-01-19 17:05:34+00:00,,
541,january-mid,during,2019-01-20,power outage,1086670892451708929,OPEInstitute,"Got a power outage? See our 10 tips for safer winter generator usage for home, business http://ow.ly/TBoV30nmU5O",2019-01-19 17:05:04+00:00,,
542,january-mid,during,2019-01-20,power outage,1086670883014565890,ZipBridge,Vehicle Safety Tip - Keep your gas tank full in case of evacuation or power outages. A full tank will also keep the fuel line from freezing https://buff.ly/2TEq1pA #security #safety #communications #preparedness #travel @Readygov,2019-01-19 17:05:02+00:00,#security #safety #communications #preparedness #travel,
543,january-mid,during,2019-01-20,power outage,1086670767557885952,MDMEMA,"MEMA ALERT: Snow, ice, rain, wind, & cold mixed around the State. Expect slick roads with moisture & freezing. We are closely coordinating with state agencies & local emergency managers, and monitoring power outages closely. http://ow.ly/P6Yl50kfPl0 Please remain vigilant #MdWx",2019-01-19 17:04:35+00:00,#MdWx,
544,january-mid,during,2019-01-20,power outage,1086670408676491264,CityPowerJhb,We are aware of the power outage in your area. technicians will be dispatched.^JM,2019-01-19 17:03:09+00:00,,
545,january-mid,during,2019-01-20,power outage,1086670231534219265,FranklinMAfire,Please prepare for the incoming storm and the possibility of power outages. A parking ban will start at 10pm today (Saturday). The town transfer station will be closed tomorrow (Sunday). Follow our website for more information and updates: https://tinyurl.com/y7tp37wq,2019-01-19 17:02:27+00:00,,
546,january-mid,during,2019-01-20,power outage,1086670231488135169,Ash_Baylor,"The quick drop in temperatures will allow any wet roads, sidewalks, porches, etc to freeze quickly. Look at these wind chill numbers in a span of a few hours! Sunday night and Monday will be icy and bitterly cold - power outages are very possible! ",2019-01-19 17:02:27+00:00,,
547,january-mid,during,2019-01-20,power outage,1086670077376765954,UGESHNI,@CityPowerJhb any etr on the power outage in lenasia south ext 4,2019-01-19 17:01:50+00:00,,
548,january-mid,during,2019-01-20,power outage,1086669906534375428,bombshellxbritt,Good morning huge power outage in my area ,2019-01-19 17:01:09+00:00,,
549,january-mid,during,2019-01-20,power outage,1086669865929322499,johndissauer,"POWER OUTAGE: @DukeEnergy is reporting the following number of customers without as of 11:58am. Hamilton County: 1,282 Montgomery County: 725 Tipton County: 291 #INwx",2019-01-19 17:01:00+00:00,#INwx,
550,january-mid,during,2019-01-20,power outage,1086669763462524930,austinenergy,"With strong wind gusts possible today, do you know what to do if you come across a downed power line? Find out here: http://bit.ly/AEDownedLine Also, keep our Storm Center Outage map handy: http://bit.ly/ATXoutage",2019-01-19 17:00:35+00:00,,
551,january-mid,during,2019-01-20,power outage,1086669578267250689,albers75,"Splendid, the power outage has started. #stupidwinterweather",2019-01-19 16:59:51+00:00,#stupidwinterweather,
552,january-mid,during,2019-01-20,power outage,1086669524374638592,WCRDwx,"Power Outages are going to be a concern as we see more ice accumulate on power lines and tree branches, especially when the winds start gusting over 35 mph. #inwx #icestorm #winterstorm",2019-01-19 16:59:38+00:00,#inwx #icestorm #winterstorm,
553,january-mid,during,2019-01-20,power outage,1086668919065190400,wvua23,Power outages have been reported in Northport. #alwx,2019-01-19 16:57:14+00:00,#alwx,
554,january-mid,during,2019-01-20,power outage,1086668639124762625,ProteaMich,Kelland 8B power outage since just after 6pm please advise and update,2019-01-19 16:56:07+00:00,,
555,january-mid,during,2019-01-20,power outage,1086668256499453952,Tayflexx,Mentally preparing for a power outage,2019-01-19 16:54:36+00:00,,
556,january-mid,during,2019-01-20,power outage,1086668059316838401,MontclairNJGov,Notice to residents and business owners: be sure to report all power outages to PSE&amp;G. Register for My Aerts with PSE&amp;G to report outages by text message and to receive updates. https://nj.myaccount.pseg.com/myservicepublic/outagepublic,2019-01-19 16:53:49+00:00,,
557,january-mid,during,2019-01-20,power outage,1086667842425114629,NBG55,@buffalozoo any update on power outage??,2019-01-19 16:52:57+00:00,,
558,january-mid,during,2019-01-20,power outage,1086666947813695489,Dimensions_Live,BREAKING: The current power outage across Nigeria is due to collapse of the country's National Transmission Grid. The system which has been experiencing challenges collapsed completely at about 1.30pm on Saturday...Read more https://m.facebook.com/story.php?story_fbid=371801416976045&amp;id=326079978214856,2019-01-19 16:49:24+00:00,,
559,january-mid,during,2019-01-20,power outage,1086666742724788224,MarylewRI,Am I the only one doing panic laundry because of the risk of a power outage tonight? #thekitchen,2019-01-19 16:48:35+00:00,#thekitchen,
560,january-mid,during,2019-01-20,power outage,1086666438180519938,bryanwx,If you’re in Dayton and complaining about rain: Pure rain means less chance of power outages - it could’ve been all ice. You now have less awful driving this afternoon &amp; better ability to get around before conditions deteriorate later. Find the positives!,2019-01-19 16:47:22+00:00,,
561,january-mid,during,2019-01-20,power outage,1086666100346179584,Unitil, Don’t forget to charge your mobile devices ahead of tomorrow’s #snow #storm and keep our Customer Service phone numbers close by to report a #power #outage. ,2019-01-19 16:46:02+00:00,#snow #storm #power #outage,
562,january-mid,during,2019-01-20,power outage,1086665595624534016,arsenault_judy,"That's the plan by Mother nature. Snow starts tomorrow morning, turning to rain later in the day. Changeover will be freezing rain. Then Monday it gets colder & water will freeze. Getting prepared for power outages. The usual. Another mix starts on Thursday for good measure ",2019-01-19 16:44:01+00:00,,
563,january-mid,during,2019-01-20,power outage,1086665564704120833,BPUB_Tweets,We currently have a power outage in south Brownsville affecting approx 1200 customers. Crews are working to get power restored as soon as possible.,2019-01-19 16:43:54+00:00,,
564,january-mid,during,2019-01-20,power outage,1086664493009195011,CMRLSLibrary,Central Mississippi Regional Library SystemHarrisville: The Harrisville Public Library will be closer today due to a power outage. We apologize for any inconvenience this may cause. http://bit.ly/2rwQScE,2019-01-19 16:39:39+00:00,,
565,january-mid,during,2019-01-20,power outage,1086664417159323648,SeanAshWX,Snow line remains well north with accumulating ice south of that zone. Cold rain in #Indy transitions to burst of wind-whipped snow between 4PM-11PM. Concerned about power outages where ice has accumulated given 40+ mph gusts expected #INwx Image time 11:40AM,2019-01-19 16:39:20+00:00,#Indy #INwx,
566,january-mid,during,2019-01-20,power outage,1086664051156045825,failingsensES,Power outage. Isn't that how the dinosaurs escape?,2019-01-19 16:37:53+00:00,,
567,january-mid,during,2019-01-20,power outage,1086663863679021057,bamwxcom,From our friends up north this is only the beginning. I’m very worried for power outages tonight as conditions rapidly decline. #INwx #INdy https://www.facebook.com/story.php?story_fbid=2160314667322340&amp;id=225486480805178,2019-01-19 16:37:08+00:00,#INwx #INdy,
568,january-mid,during,2019-01-20,power outage,1086663783018319873,meghan_klee,Not at all! I need anything besides more ice there or there could be more power outages. Come on snow!,2019-01-19 16:36:49+00:00,,
569,january-mid,during,2019-01-20,power outage,1086663395590524929,HamiltonCoEOC,"Our @HCINCERT is reporting a power outage at 103 St and Central Ave in Carmel. County-wide, Duke Energy is reporting 1,282 people without power. ",2019-01-19 16:35:17+00:00,,
570,january-mid,during,2019-01-20,power outage,1086663327563083777,PotomacEdison,"REMINDER: If you experience an outage due to weather, don't rely on your neighbors to report it. Customer outage reports help us pinpoint damage + restore power faster. Report your outage: 888-544-4877 Stay clear of downed power lines! Report them ASAP: 888-544-4877 or 911 ",2019-01-19 16:35:01+00:00,,
571,january-mid,during,2019-01-20,power outage,1086663225519849475,MonPowerWV,"REMINDER: If you experience an outage due to weather, don't rely on your neighbors to report it. Customer outage reports help us pinpoint damage + restore power faster. Report your outage: 888-544-4877 Stay clear of downed power lines! Report them ASAP: 888-544-4877 or 911 ",2019-01-19 16:34:36+00:00,,
572,january-mid,during,2019-01-20,power outage,1086663214190989312,penn_power,"REMINDER: If you experience an outage due to weather, don't rely on your neighbors to report it. Customer outage reports help us pinpoint damage + restore power faster. Report your outage: 888-544-4877 Stay clear of downed power lines! Report them ASAP: 888-544-4877 or 911 ",2019-01-19 16:34:34+00:00,,
573,january-mid,during,2019-01-20,power outage,1086663213293469696,W_Penn_Power,"REMINDER: If you experience an outage due to weather, don't rely on your neighbors to report it. Customer outage reports help us pinpoint damage + restore power faster. Report your outage: 888-544-4877 Stay clear of downed power lines! Report them ASAP: 888-544-4877 or 911 ",2019-01-19 16:34:33+00:00,,
