,Event,Stage,Query Date,Query Term,Id,Username,Text,Date,Hashtags,Location
0,january-mid,during,2019-01-20,power outage,1086774905897713664,jameysingleton,"The wind Sunday will be nothing to mess with. These are gusts by 11 a.m. Power outages are possible. Keep in mind, it will be getting very cold as well! #vawx #rke #AEP #NRV #wncwx #ncwx",2019-01-19 23:58:23+00:00,#vawx #rke #AEP #NRV #wncwx #ncwx,
1,january-mid,during,2019-01-20,power outage,1086774433132494849,DukeEnergy,"All the latest information about outages and estimated restoration times can be found at http://spr.ly/6011EOc0z. Our crews are working hard in these icy conditions and they won’t stop until your, and everyone’s, power is back on.",2019-01-19 23:56:30+00:00,,
2,january-mid,during,2019-01-20,power outage,1086774295781654531,sgt_stan,Not the best time for a power outage @SWEPCoNews,2019-01-19 23:55:58+00:00,,
3,january-mid,during,2019-01-20,power outage,1086774292757528577,Miriam_021,Trying to do my makeup with a power outage and the last bit of sunlight left is a mf challenge,2019-01-19 23:55:57+00:00,,
4,january-mid,during,2019-01-20,power outage,1086773724639055872,MetJannaBrown,"ICE becomes an issue early Sunday morning. While sleet has its hazards, ice accretion due to freezing rain can be bad news for tree limbs & power lines. Outages become more likely the more ice builds. ",2019-01-19 23:53:41+00:00,,
5,january-mid,during,2019-01-20,power outage,1086773547635224576,shivelya,"Ice is my least favorite. Hard to drive, and always worried about power outages",2019-01-19 23:52:59+00:00,,
6,january-mid,during,2019-01-20,power outage,1086773531633950727,kmsqrd,A view from my bed when the power is out. #poweroutage #powerout #hopingitdoesntsnow #hopingitdoesntlastlong http://bit.ly/2R2JMVo,2019-01-19 23:52:55+00:00,#poweroutage #powerout #hopingitdoesntsnow #hopingitdoesntlastlong,
7,january-mid,during,2019-01-20,power outage,1086772844636393473,theREAL_Tiffany,Power outage for last 3 hours with a toddler - where is the liquor?,2019-01-19 23:50:12+00:00,,
8,january-mid,during,2019-01-20,power outage,1086772063396741121,95zduet,evesoul au where we work at target together and were assigned the graveyard shift to decorate for christmas but we go overboard and put too much lights on and theres a massive power outage across the city and the store catches on fire ,2019-01-19 23:47:05+00:00,,
9,january-mid,during,2019-01-20,power outage,1086772005456789505,kmsqrd,A view from my bed when the power is out. #poweroutage #powerout #hopingitdoesntsnow #hopingitdoesntlastlong https://www.instagram.com/p/Bs1ci00DX6H/?utm_source=ig_twitter_share&amp;igshid=1khxs1ieeavhb,2019-01-19 23:46:52+00:00,#poweroutage #powerout #hopingitdoesntsnow #hopingitdoesntlastlong,
10,january-mid,during,2019-01-20,power outage,1086771922187243520,JimMarkley5,The resulting power outage would cripple the power grid for our entire Eastern Seaboard ,2019-01-19 23:46:32+00:00,,
11,january-mid,during,2019-01-20,power outage,1086771764682620928,VickiGrafWX,"Stronger wind gusts Sunday will lead to minor coastal flooding (astronomical high tides + storm surge), also watch for scattered power outages and tree damage. @boston25",2019-01-19 23:45:54+00:00,,
12,january-mid,during,2019-01-20,power outage,1086771345856319489,laurapetry,I’d rather have snow. We have a good chance for ice now which could mean power outage. I needs my Netflix!,2019-01-19 23:44:14+00:00,,
13,january-mid,during,2019-01-20,power outage,1086770837808660481,HuffDaddy1963,@DukeEnergy your automated text system is not working here in Indiana with power outages.,2019-01-19 23:42:13+00:00,,
14,january-mid,during,2019-01-20,power outage,1086770078836764672,AllisonWeather,"Wind gusts of 45+ mph plus any falling snow will lead to white out conditions tonight. Keep in mind some trees may be weak from recent storms, which could mean spotty power outages. ",2019-01-19 23:39:12+00:00,,
15,january-mid,during,2019-01-20,power outage,1086769866361761793,ScottDimmich,"Some power outages (all Duke Energy outages) in Clermont County. Likely due to wind, not ice. ""All"" in the title bar means Duke Energy, LG&amp;E, AEP, and DP&amp;L. Will work to add other utilities in the coming weeks. Gotta use that analytics degree. #cincywx 6:32pm power outages: ",2019-01-19 23:38:22+00:00,#cincywx,
16,january-mid,during,2019-01-20,power outage,1086769587193081857,ScannerNewsSTL,More on the power outages at http://facebook.com/ScannerNewsSTL,2019-01-19 23:37:15+00:00,,
17,january-mid,during,2019-01-20,power outage,1086768974153613312,IndyOPHS,"The winter storm continues to bring precipitation to the Indianapolis area. To report a power outage or a downed power line, call @IPLPower #INwx",2019-01-19 23:34:49+00:00,#INwx,
18,january-mid,during,2019-01-20,power outage,1086768263370076160,VirginiaRowley,Boil water notice issued for the City of Winona after power outage impacts main water facility http://www.kltv.com/2019/01/19/boil-water-notice-issued-city-winona/,2019-01-19 23:31:59+00:00,,
19,january-mid,during,2019-01-20,power outage,1086767212839489536,Ridgewoodblog,STORM REMINDER : FOR POWER OUTAGES CALL PSE&amp;G http://theridgewoodblog.net/storm-reminder-for-power-outages-call-pseg/,2019-01-19 23:27:49+00:00,,
20,january-mid,during,2019-01-20,power outage,1086767189166825478,johndissauer,"POWER OUTAGE UPDATE: @DukeEnergy is reporting 1,503 customers without power in Hamilton County as of 6:20pm. #INwx",2019-01-19 23:27:43+00:00,#INwx,
21,january-mid,during,2019-01-20,power outage,1086766897134227456,johndissauer,POWER OUTAGE UPDATE: @IPLPower is reporting 536 customers without power - mainly on the northeast and east side of Indy metro. #INwx,2019-01-19 23:26:34+00:00,#INwx,
22,january-mid,during,2019-01-20,power outage,1086766726828613632,LoriTheroys,If you’re prepared for a power outage,2019-01-19 23:25:53+00:00,,
23,january-mid,during,2019-01-20,power outage,1086766670142754818,elainalouisa,"Oh goody, the flu, 12 degrees AND a power outage. Lovely.",2019-01-19 23:25:39+00:00,,
24,january-mid,during,2019-01-20,power outage,1086766518917099521,kcranstn,"Tonights @CanadasNAC show with @patrickwatson was the one I was most looking forward to this season. Instead, trapped at home on the farm with 2 weather warnings, power outage, and generator running. :(",2019-01-19 23:25:03+00:00,,
25,january-mid,during,2019-01-20,power outage,1086766429666533376,buffalozoo,"The Buffalo Zoo will be closed tomorrow, Sunday, January 20, 2019 as we recover from the winter storm and power outage. Please know our backup power systems are running and teams are onsite. ",2019-01-19 23:24:42+00:00,,
26,january-mid,during,2019-01-20,power outage,1086766400176308224,gcollier3,"Hope you're enjoying our slight dusting of snow! In the event we have power outages, here are some great reminders of how to prepare! ",2019-01-19 23:24:35+00:00,,
27,january-mid,during,2019-01-20,power outage,1086766280735105025,HarrisonRemc,There are outages in Greenville due to a tree in the line. We have crews working the outage. We appreciate your patience as we safely restore power.,2019-01-19 23:24:07+00:00,,
28,january-mid,during,2019-01-20,power outage,1086766167371534336,VickiGrafWX,"As of now, you're going to see a mix of heavy snow piled on by sleet and freezing rain. Up to 0.5"" of ice closer to Leominster -- that will lead to scattered power outages and dangerous travel. Stay safe!",2019-01-19 23:23:40+00:00,,
29,january-mid,during,2019-01-20,power outage,1086765929382334464,kozmickid,"We talked about going to a movie tomorrow, if we're able to dig out from under 12 ft. of snow. If not, we'll watch a PPV movie at home, if we've recovered from the three-state power outage and the satellites are still in their orbits.",2019-01-19 23:22:43+00:00,,
30,january-mid,during,2019-01-20,power outage,1086765912886312962,stephiegal,"Somehow the car is okay! And thank God he is too. Power outage threw us off so why chance anything else, lol?",2019-01-19 23:22:39+00:00,,
31,january-mid,during,2019-01-20,power outage,1086765762512068608,Minuteman04,"Here they can cut down trees or trim branches that are likely to cause power outages. Just have to give notice. You can appeal, but good luck with that.",2019-01-19 23:22:03+00:00,,
32,january-mid,during,2019-01-20,power outage,1086765683755622401,markallen1230,How serious is the freezing rain/power outage threat in North Central MA (Leominster area)?,2019-01-19 23:21:44+00:00,,
33,january-mid,during,2019-01-20,power outage,1086765564595458048,searbat,"@PeteNBCBoston With the shift of ice north, does that mean Merrimack Valley back in play for power outages?",2019-01-19 23:21:16+00:00,,
34,january-mid,during,2019-01-20,power outage,1086765460501204992,_beingYana,this shit worse than the power outage ,2019-01-19 23:20:51+00:00,,
35,january-mid,during,2019-01-20,power outage,1086765367668731906,markallen1230,How serious is the freezing rain/power outage threat in North Central MA (Leominster area),2019-01-19 23:20:29+00:00,,
36,january-mid,during,2019-01-20,power outage,1086765337654132736,bfd,Currently. #poweroutage ,2019-01-19 23:20:22+00:00,#poweroutage,
37,january-mid,during,2019-01-20,power outage,1086765014944501761,markallen1230,How serious is the freezing rain/power outage threat in North Central MA? (Leominster area),2019-01-19 23:19:05+00:00,,
38,january-mid,during,2019-01-20,power outage,1086764809142513664,BountifulCityUT,There is a power outage above Davis Boulevard from 300 South to Mill Street until about 6:00 p.m. ,2019-01-19 23:18:16+00:00,,
39,january-mid,during,2019-01-20,power outage,1086764727429025792,homedozing,"@seaworldresort what's going on about the power outage ! no bloody power ALL night, no communication either. Pathetic",2019-01-19 23:17:56+00:00,,
40,january-mid,during,2019-01-20,power outage,1086764651335974912,itsRaeeRaaee,waiting for this power outage ,2019-01-19 23:17:38+00:00,,
41,january-mid,during,2019-01-20,power outage,1086764529701269505,WhartonPolice,Report any power outages immediately to JCP&amp;L by calling 1-888-544-4877 (1-888-LIGHTSS). Report any down power lines to 9-1-1 and stay away from the downed lines. Be safe.,2019-01-19 23:17:09+00:00,,
42,january-mid,during,2019-01-20,power outage,1086764245642084356,HappyPlaceGang,"ROUGHING IT - Coldest day of Winter so far & our power has been out for hours! Wood stoves, candles &amp; Mimosas. Our pets snooze in front of the fire. We’re roughing it. Stay safe &amp; warm #polarvortex #poweroutage #hydro #neverleaveacandleunattended #ivegotyourlovetokeepmewarm - BDG",2019-01-19 23:16:01+00:00,#polarvortex #poweroutage #hydro #neverleaveacandleunattended #ivegotyourlovetokeepmewarm,
43,january-mid,during,2019-01-20,power outage,1086764067660943361,MemphoNewsLady,Same in our nhood. Fewer outages here in East Memphis tho than when we lived in Midtown. I lost count of the number of times we lost power the years we lived there. ,2019-01-19 23:15:19+00:00,,
44,january-mid,during,2019-01-20,power outage,1086764020110102529,burlingtonpd,For information on power outages in Burlington please visit the @EversourceMA outage map by clicking on the following link: https://outagemap.eversource.com/external/default.html If you lose power please don't call the police or fire department. Call Eversource at 800-592-2000,2019-01-19 23:15:08+00:00,,
45,january-mid,during,2019-01-20,power outage,1086763888648114176,AndoverEMC,"Last pre-storm update: The worst of the ice should stay to our north and west, but we'll still get some, so there might be some spotty isolated power outages. Roads will be messy and slick in the morning and... https://www.facebook.com/494155833942373/posts/2322375017787103/",2019-01-19 23:14:36+00:00,,
46,january-mid,during,2019-01-20,power outage,1086763641259638784,LaurenWGME,"With the chance for power outages this weekend, many Mainers will turn to generators. That can raise the risk for exposure to carbon monoxide, a deadly gas. @WGME #WeatherWarn #WeatherAuthority https://wgme.com/news/local/carbon-monoxide-detectors-a-crucial-component-of-storm-preparation",2019-01-19 23:13:37+00:00,#WeatherWarn #WeatherAuthority,
47,january-mid,during,2019-01-20,power outage,1086763473982423043,tweekcat,"Oh yay, power outage. #memwx",2019-01-19 23:12:57+00:00,#memwx,
48,january-mid,during,2019-01-20,power outage,1086763049569136642,mishaaeljohnson,istg if we have another snow storm power outage ,2019-01-19 23:11:16+00:00,,
49,january-mid,during,2019-01-20,power outage,1086763020884291585,Leney_3,Starting to snow right now... can you imagine power outages tomorrow? People would be freaking out with no tv,2019-01-19 23:11:09+00:00,,
50,january-mid,during,2019-01-20,power outage,1086762387724750848,dhaldeman69,"@KaitlinRustWAVE Please tell me you just said dont call 911 for a power outage as a joke, and that hasn't actually happened.... ",2019-01-19 23:08:38+00:00,,
51,january-mid,during,2019-01-20,power outage,1086762307445841921,brothauser,"I understand that there’s a storm coming. I even get that it’ll be snow, sleet, freezing rain, and rain. But I just got a text telling me to sign up for power outage alerts. We prep less for blizzards and hurricanes than this seems to be getting. What am I missing?",2019-01-19 23:08:19+00:00,,
52,january-mid,during,2019-01-20,power outage,1086762019666255873,TerryWBZ,"WIND: While winds will only top out between 40-50mph (Cape/Islands) and 20-40mph inland (mainly after the storm passes), this combined with icing inland could produce several power outages ",2019-01-19 23:07:11+00:00,,
53,january-mid,during,2019-01-20,power outage,1086761515548622849,AndreaFoy2016,Power Outages: 180 without power across region ,2019-01-19 23:05:11+00:00,,
54,january-mid,during,2019-01-20,power outage,1086761451547693061,7e72004,"Power has been out on the east side of Seymour Indiana since 12:57pm. The outage map says crews have been enroute since 12:57. I’m losing food, it is 63 degrees inside and falling. I cannot take my pets anywhere. Your service leaves something to be desired.",2019-01-19 23:04:55+00:00,,
55,january-mid,during,2019-01-20,power outage,1086761443981230080,TerryWBZ,ICE: this is our primary concern with this storm...those that get several hours of freezing rain on Sunday will be at risk for downed limbs and lines and numerous power outages...greatest risk NW of 495 ,2019-01-19 23:04:53+00:00,,
56,january-mid,during,2019-01-20,power outage,1086761307628584962,Clement_Liu,DID ANYONE SEE AND HEAR THE EXPLOSION AND ENSUING POWER OUTAGE IN THE PLATEAU!? that was CRAAAZEEEEEE,2019-01-19 23:04:21+00:00,,
57,january-mid,during,2019-01-20,power outage,1086761306663907328,robman50a,@coreywxelder @gtaweather1 @WxOntario1 @NPEIHydro Just had the first power outage from the storm. Everything went out for a few seconds then came back on. ,2019-01-19 23:04:21+00:00,,
58,january-mid,during,2019-01-20,power outage,1086761067173298176,7e72004,"A lot taller than the level of service. Power has been out on the east side of Seymour Indiana since 12:57pm. The outage map says crews have been enroute since 12:57. I’m losing food, it is 63 degrees inside and falling. Pets need heat.",2019-01-19 23:03:24+00:00,,
59,january-mid,during,2019-01-20,power outage,1086760359204192266,DukeEnergy,"Sorry to hear you’ve lost power from winter storm #Harper. You can text OUT to 57801 to report your outage. We know it’s hard being without power, especially in this weather. Our crews won’t stop until your, and everyone’s, power is back up and running.",2019-01-19 23:00:35+00:00,#Harper,
60,january-mid,during,2019-01-20,power outage,1086760331316248579,J_A_K_2016,"Thanks, but this begs the question- all of the millions of $the county and patrons have given the zoo and they aren't prepared for a power outage?",2019-01-19 23:00:28+00:00,,
61,january-mid,during,2019-01-20,power outage,1086760249854443521,pb_hitman,Power outage be back soon,2019-01-19 23:00:09+00:00,,
62,january-mid,during,2019-01-20,power outage,1086760213565374464,Falmouth_Police,If you lose power DO NOT CALL 911. Call @EversourceMA directly 1-800-592-2000 or http://Eversource.com. DO CALL 911 to report down wires! If someone calls 911 to report an outage it will slow down emergency calls and it will take longer to get the message to Eversource. ,2019-01-19 23:00:00+00:00,,
63,january-mid,during,2019-01-20,power outage,1086760013580955650,AndrewSmithNews,"Power outages, weather pictures, @HamiltonCoEOC has increased their travel advisory and more on the live blog. #INwx https://www.theindychannel.com/news/local-news/indianapolis/live-blog-winter-storm-warnings-issued-for-central-indiana-saturday",2019-01-19 22:59:12+00:00,#INwx,
64,january-mid,during,2019-01-20,power outage,1086759752540086273,SaratogaOES,"A State of Emergency has been declared for Saratoga County. The emergency will take effect at 7:00pm Saturday. Heavy snow, high winds, extreme cold and widespread power outages led to the emergency. This declaration will remain in effect until rescinded by a subsequent order.",2019-01-19 22:58:10+00:00,,
65,january-mid,during,2019-01-20,power outage,1086759714392862720,mikecameronwfsb,"Snow and ice forecasts suggest the possibility of scattered power outages, thanks to #WinterStormYoshi.",2019-01-19 22:58:01+00:00,#WinterStormYoshi,
66,january-mid,during,2019-01-20,power outage,1086759269708455936,NewOrleansRTA,"#RTAServiceAlert UPDATE - Due to a power outage, the Canal Streetcar line is out of service at Tonti to Cemeteries and City Park. Shuttle buses are providing service.",2019-01-19 22:56:15+00:00,#RTAServiceAlert,
67,january-mid,during,2019-01-20,power outage,1086759196870299649,MinersSportsNet,"Due to a power outage at Mingo Central High School, the Boys Varsity Basketball Game Vs. Grafton is being moved to the Williamson Field House. Tip off time was not given. #wvprepbb #locationchange",2019-01-19 22:55:58+00:00,#wvprepbb #locationchange,
68,january-mid,during,2019-01-20,power outage,1086758286395916288,31649F,Hunkering down waiting for the snow/rain/freezing rain heading our way. This will be followed by a flash freeze. Not safe to venture out. Hope we don’t get power outages. #winterincanada.,2019-01-19 22:52:21+00:00,#winterincanada,
69,january-mid,during,2019-01-20,power outage,1086758205194149888,RadioMom911FM,Mom Alert: Frankfort City Light & Power is working on the large power outage in their area.,2019-01-19 22:52:01+00:00,,
70,january-mid,during,2019-01-20,power outage,1086757989330141184,WESTON_FIRE,"Latest from the @NWSBoston going to be very messy over the next 24hrs, snow, sleet, freezing rain and rain biggest concern in our area appears be the possibility of power outages due to Trees &amp; Limbs being taken down by snow if you have a pwr outage contact @EversourceMA directly",2019-01-19 22:51:10+00:00,,
71,january-mid,during,2019-01-20,power outage,1086757914436661250,ClintonCo911,Frankfort City Light & Power is working on the large power outage in their area. ,2019-01-19 22:50:52+00:00,,
72,january-mid,during,2019-01-20,power outage,1086757665815044096,Herbert_L_Reed,"Jonesboro, AR area power outages: ",2019-01-19 22:49:53+00:00,,
73,january-mid,during,2019-01-20,power outage,1086757230945488896,SidneyDanceCo,"Unfortunately, due to the snow and the power outage at Sidney High School, the evening performance of Swan Lake has been cancelled for tonight. If you planned to attend this evening, please come to the matinee performance tomorrow at 2pm. If you had tick… http://bit.ly/298IJyg",2019-01-19 22:48:09+00:00,,
74,january-mid,during,2019-01-20,power outage,1086757023545475073,AlAqsaIntifada,"GAZA, http://PALESTINOW.COM -- The Palestinian Ministry of Health in the Gaza Strip on Saturday warned that five hospitals in the enclave are on the verge of shutting down due to power outages. Spokesman for the... ",2019-01-19 22:47:20+00:00,,
75,january-mid,during,2019-01-20,power outage,1086756883799650304,LaurelCityOEM,"A WIND ADVISORY will go into effect on 1/20 from 11am to 7pm. Winds up to 30 mph, with gusts up to 50 mph. Strong winds may blow down limbs, trees, and power lines. Scattered power outages are expected. Bring in any items outside your home that can blow around the neighborhood! ",2019-01-19 22:46:46+00:00,,
76,january-mid,during,2019-01-20,power outage,1086756741096894469,DixieCoop,"Outages continue to pop up across our service area as storms move across the state. To view all outage locations, click the link to our online outage map. Crews are working to safely restore power as quickly as possible. http://outagemap.dixie.coop",2019-01-19 22:46:12+00:00,,
77,january-mid,during,2019-01-20,power outage,1086756706498084874,LOWCARB_TOOLBOX,"I am, but does me no good if power outage",2019-01-19 22:46:04+00:00,,
78,january-mid,during,2019-01-20,power outage,1086756453661077504,NewOrleansRTA,"#RTAServiceAlert Due to a power outage, the Canal Streetcar Line is out of service at White St to Cemeteries and City Park.",2019-01-19 22:45:04+00:00,#RTAServiceAlert,
79,january-mid,during,2019-01-20,power outage,1086756434405179392,StMarysCoGov,"A Wind Advisory is in effect from 11 a.m. until 7 p.m. Sunday for St. Mary’s County. Northwest 20 to 30 mph with gusts up to 50 mph. Strong winds may blow down limbs, trees, and power lines. Scattered power outages are expected. (1)",2019-01-19 22:44:59+00:00,,
80,january-mid,during,2019-01-20,power outage,1086756310702608390,AACountyPatch,"Wind gusts may reach 50 mph, and scattered power outages are anticipated, according to the advisory. https://trib.al/GRd8ytS",2019-01-19 22:44:30+00:00,,
81,january-mid,during,2019-01-20,power outage,1086756005432709120,dougalpollux,"“will blow down limbs,trees..power lines,..highest gusts..expected to hit in the afternoon ..advisory..in effect..11am-7pm..Sunday.. Scattered power outages..expected,according to the advisory,which calls for NW winds of 20-30mph w/up to 50mph gusts” https://patch.com/maryland/belair/wind-advisory-issued-11-counties-baltimore ",2019-01-19 22:43:17+00:00,,
82,january-mid,during,2019-01-20,power outage,1086755851300495366,Ambyfu,Power outage during a snow blizzard! Yay! ,2019-01-19 22:42:40+00:00,,
83,january-mid,during,2019-01-20,power outage,1086755740151353344,SEACityLight,"Cause for the Capitol Hill area outage (believe it or not) is a canopy which has flown off a roof and landed on top of the wires. Crews are on it and will be repairing shortly to restore power to the remaining 1,126. Estimated and updated restoration time is 4:30 pm.",2019-01-19 22:42:14+00:00,,
84,january-mid,during,2019-01-20,power outage,1086755697281458176,Embroiderymann,Guy dey fool pass! The power outage be crazy,2019-01-19 22:42:03+00:00,,
85,january-mid,during,2019-01-20,power outage,1086755569493405696,uberheathen,"Earlier I was awakened from a nap by 3 explosive bangs and a flash of light outside followed by a neighborhood power outage, which I just learned was caused by... a rooftop birthday party for a dog. I'm going back to bed.",2019-01-19 22:41:33+00:00,,
86,january-mid,during,2019-01-20,power outage,1086755140827152384,CTVAtlantic,"An intense winter storm is forecast to descend on the Maritimes tomorrow, and residents are being warned to prepare for power outages. ",2019-01-19 22:39:51+00:00,,
87,january-mid,during,2019-01-20,power outage,1086754473450528768,englishbottoeic,【慣用表現：形容詞＋名詞⑤】electrical appliance「家電製品」electrical power outage「停電」federal mandate「連邦命令」financial setback「財政悪化」financial statement「財務諸表」,2019-01-19 22:37:12+00:00,,
88,january-mid,during,2019-01-20,power outage,1086754201592623106,BoobBoo,If there is one thing about @Domoticz that bugs me - it's the fact that my Z-Wave stick isn't restarted correctly and devices rediscovered after a power outage. It requires a manual fix every time,2019-01-19 22:36:07+00:00,,
89,january-mid,during,2019-01-20,power outage,1086753364048859142,MILLCITYWEATHER,Storm is trending a bit warmer. Freezing rain and ICE will be the big concern with this system. Wind on top of that could cause power outages. Lowell Police Department (Official),2019-01-19 22:32:47+00:00,,
90,january-mid,during,2019-01-20,power outage,1086753228698599424,PriyaKale,"This Leo Eclipse feels like a power outage, plunging things into darkness. Move slow, so you don't bump into sharp edges. As we move past the Eclipse, the lights are being turned on again. It will take a while to adjust to revelations. But there's a gift here waiting for you.",2019-01-19 22:32:15+00:00,,
91,january-mid,during,2019-01-20,power outage,1086752997051453442,QuickThinker1,Think thats bad? I had my ps4 go into safe mode due to power outage and it told me to connect the ds4 via cable and press the ps button. i had to go through 5 cables before it finally registered. Ds4 is a pile of shit,2019-01-19 22:31:20+00:00,,
92,january-mid,during,2019-01-20,power outage,1086752793694744578,BelAirPatch,"Wind gusts may reach 50 mph, and scattered power outages are anticipated, according to the advisory. https://trib.al/vR4XPeM",2019-01-19 22:30:31+00:00,,
93,january-mid,during,2019-01-20,power outage,1086752390416658432,MILLCITYWEATHER,Freezing rain and wind. Not a good combination. Prepare for power outages!,2019-01-19 22:28:55+00:00,,
94,january-mid,during,2019-01-20,power outage,1086752317267832832,dhabben4,Is it ironic or a coincidence that I was looking up the power outage map when we lost power? @IPLPower,2019-01-19 22:28:37+00:00,,
95,january-mid,during,2019-01-20,power outage,1086752280412676098,repeat1968,"Mother Nature provides plenty of refrigeration during lengthy winter power outages. Been there, done that, again and again and again.",2019-01-19 22:28:29+00:00,,
