,Event,Stage,Query Date,Query Term,Id,Username,Text,Date,Hashtags,Location
950,january-mid,during,2019-01-20,power outage,1086529984808787968,poweralertsbot,"Power outage reported at Kahawa Sukari, Kenya.(kahawa wendani)",2019-01-19 07:45:09+00:00,,
951,january-mid,during,2019-01-20,power outage,1086528061690920962,JVVNLCCare,"#Jaipur_city DUE TO MAINTENANCE WORK THERE IS UNPLANNED POWER OUTAGE FROM 10:32 TO 14:00 AT BHANKROTA; AVADHPURI , GIRDHARIPURA , SHAKAMBARI NAGAR , SHYAM VIHAR NEAR BY AREA. @navinarora15 @VipulSBhardwaj @NareshPalGangw2 #SaturdayMorning",2019-01-19 07:37:31+00:00,#Jaipur_city #SaturdayMorning,
952,january-mid,during,2019-01-20,power outage,1086527168031670272,denise_theuri,@KenyaPower_Care Hello. There's no power in Kahawa Sukari. Is it a scheduled power outage?,2019-01-19 07:33:58+00:00,,
953,january-mid,during,2019-01-20,power outage,1086526498121633797,WesternAdvocate,Power outage impacting nearly 1500 Bathurst customers | Photos http://bit.ly/2RZkCva,2019-01-19 07:31:18+00:00,,
954,january-mid,during,2019-01-20,power outage,1086526408736690176,blowchunx,Fucking Brexit /article 13/illness /power outages/maid sick/usa health system/you having to pay tax FUCK JUST STOP YOU LITTLE WHINING ARSE@theycallmedsp ,2019-01-19 07:30:57+00:00,,
955,january-mid,during,2019-01-20,power outage,1086526194579845120,poweralertsbot,"Power outage reported at Kahawa Sukari, Kenya.(kahawa sukari)",2019-01-19 07:30:06+00:00,,
956,january-mid,during,2019-01-20,power outage,1086525169743659009,T_freshdj,@KenyaPower_Care is there a scheduled power outage today in kahawa sukari?,2019-01-19 07:26:01+00:00,,
957,january-mid,during,2019-01-20,power outage,1086523273054208000,TyriannaC,My grandma the goat for buying my power outage lights. They really work well y’all should invest,2019-01-19 07:18:29+00:00,,
958,january-mid,during,2019-01-20,power outage,1086522954584936448,slaqqy,"jic there isnt an extension i should really like do that shit NOW, too considering its gonna get really gross in the coming days and i may run the risk of power/net outage",2019-01-19 07:17:13+00:00,,
959,january-mid,during,2019-01-20,power outage,1086522798229635072,Ausgrid,"Hello Sue, Ausgrid crews are currently investigating the cause of the outage in Warrabrook. We will restore power once it is safe to do so, at this stage the estimated restoration time is around 11.30 pm, however this is an estimate only. Thanks, Rach.",2019-01-19 07:16:36+00:00,,
960,january-mid,during,2019-01-20,power outage,1086522375275982849,tazz_oneill,@CityPowerJhb is the power outage in Modderfontein being attended to?,2019-01-19 07:14:55+00:00,,
961,january-mid,during,2019-01-20,power outage,1086521438713057280,WesternAdvocate,Power outage impacting nearly 1500 Bathurst customers ,2019-01-19 07:11:12+00:00,,
962,january-mid,during,2019-01-20,power outage,1086521395905888257,2017Ferret,Let's hope in the Perth Hills get their power back soon. Not a day for a power outage with temperatures in the forties.,2019-01-19 07:11:02+00:00,,
963,january-mid,during,2019-01-20,power outage,1086521385919361024,QueenKayee_,I don’t want to live in Natchitoches no nore.. this my 6th power outage in less than a year .. why ky bill always high if lights steady go out,2019-01-19 07:10:59+00:00,,
964,january-mid,during,2019-01-20,power outage,1086518642639077377,poweralertsbot,"Power outage reported at Kasarani, Nairobi, Kenya.(kasarani)",2019-01-19 07:00:05+00:00,,
965,january-mid,during,2019-01-20,power outage,1086518361264177152,drowzydruzy,i never finished rabbiting arctic alive lp after the freak power outage like 2 months ago. whoops,2019-01-19 06:58:58+00:00,,
966,january-mid,during,2019-01-20,power outage,1086515573989826560,ovid9,"What happens if there is a power outage and you want to get into your home? I mean, this raises so many more questions than it answers.",2019-01-19 06:47:53+00:00,,
967,january-mid,during,2019-01-20,power outage,1086515132790763521,abhien011,"@vikrantgupta73 @Ateet_Sharma @sports_tak @manoj_dimri Play has been due to Rain, wetfield, bad light, storm, lightning or Power outage but this is first time i am seeing play has been stopped due to Sun outrage #SuperSmasht20... It's historical day ",2019-01-19 06:46:08+00:00,#SuperSmasht20,
968,january-mid,during,2019-01-20,power outage,1086514861322977280,poweralertsbot,"Power outage reported at Ruiru, Kenya.(ruiru)",2019-01-19 06:45:04+00:00,,
969,january-mid,during,2019-01-20,power outage,1086514070843461632,CooperLorne,"@Franktmcveety there's no proof because its a damn lie! A power outage at -30 now, that will shorten some lives abruptly!",2019-01-19 06:41:55+00:00,,
970,january-mid,during,2019-01-20,power outage,1086512814376845312,MikeMorganKFOR,"Peak wind gusts right now, 12:30AM early Saturday! Nearly 60 MPH in Minco/Tuttle. IMPRESSIVE. There are a few OKC METRO power outages due to high winds. #OKWX #kfor4 Mike",2019-01-19 06:36:56+00:00,#OKWX #kfor4,
971,january-mid,during,2019-01-20,power outage,1086511020477161472,Geofrey86894899,@CityTshwane The reference for the power outage in Savannah Country Estate is 64 of 01/19/2019 please advise when it will be attended.,2019-01-19 06:29:48+00:00,,
972,january-mid,during,2019-01-20,power outage,1086510199253487616,HuberHammerQ,Marketanon’s theory reveals more color as American Electric Power Company Inc (AEP) Shares Sold by QUANTRES ASSET MANAGEMENT Ltd Century Link [power outages]. Energy. #Tesla https://www.watchlistnews.com/american-electric-power-company-inc-aep-shares-sold-by-quantres-asset-management-ltd/2754918.html,2019-01-19 06:26:32+00:00,#Tesla,
973,january-mid,during,2019-01-20,power outage,1086508983412838400,fursid,@KElectricPk power outage in Gulshan block 11. Contract account number is 0400003368236,2019-01-19 06:21:42+00:00,,
974,january-mid,during,2019-01-20,power outage,1086508663102005250,perthfeeds,More than 3000 Perth households without power #perth: Perth Hills households could be without power until this evening after unplanned outages.... https://perthfeeds.com/article/more-than-3000-perth-households-without-power,2019-01-19 06:20:26+00:00,#perth,
975,january-mid,during,2019-01-20,power outage,1086508628037853186,Robertsemams,@BEDCpower The constant power outage here at Hospital road without any explanation is a step in the wrong direction. #lightupnigeria isn't just a hashtag. Its possible.,2019-01-19 06:20:17+00:00,#lightupnigeria,
976,january-mid,during,2019-01-20,power outage,1086508471204364289,wateraaronfire,why should I be worried about power outages when I’ve got enough dumb bitch energy to power a whole city block,2019-01-19 06:19:40+00:00,,
977,january-mid,during,2019-01-20,power outage,1086508370775949312,gingercatgames,A&E’s ‘Live PD’ Knocked Off Air After NY Power Outage https://sg.style.yahoo.com/e-live-pd-knocked-off-001209615.html #LivePD,2019-01-19 06:19:16+00:00,#LivePD,
978,january-mid,during,2019-01-20,power outage,1086507971042004992,CelesteeLdc,Idk what’s more scary....The wind blowing on my window or the fact that we are going to have a power outage.,2019-01-19 06:17:41+00:00,,
979,january-mid,during,2019-01-20,power outage,1086507955111907329,WilliamHousty,Umbas power outage lol,2019-01-19 06:17:37+00:00,,
980,january-mid,during,2019-01-20,power outage,1086507114292563969,bi_bi_birdie42,I’m tired of these mothafuckin power outages on this mothafuckin regular basis. @natchitoches,2019-01-19 06:14:17+00:00,,
981,january-mid,during,2019-01-20,power outage,1086506846599274498,josephboutilier,"Dinner of champions. Been a crazy week scrambling to conform a giant effects-heavy Redcode 6k feature for colour grading before a screening next week. Power outages, computer failures, sleepless nights and all, so worth it! W/ @cravery and @Empress_Ave",2019-01-19 06:13:13+00:00,,
982,january-mid,during,2019-01-20,power outage,1086506803863666699,evey_weisblat,lol kenyon scheduled a power outage,2019-01-19 06:13:03+00:00,,
983,january-mid,during,2019-01-20,power outage,1086506792933384192,JohnTitor33621,"On January 21, 2019 there was an ice storm in #NewYorkCity #Pennsylvania &amp; #Ohio that caused 3 million people to be without power. This #PowerOutage lasted 3 days. #JohnTitor #Predictions",2019-01-19 06:13:00+00:00,#NewYorkCity #Pennsylvania #Ohio #PowerOutage #JohnTitor #Predictions,
984,january-mid,during,2019-01-20,power outage,1086506264102952960,Jen_C_,Same here! I take care of my parents &amp; mom’s on oxygen so lengthy power outages are a nightmare!,2019-01-19 06:10:54+00:00,,
985,january-mid,during,2019-01-20,power outage,1086506172763516928,AG4ZL,Information on the power outage planned for Granite Falls. The power outage has been postponed and at this time there is no information on when they may plan to do this again. Again the power outage plan for this morning is been postponed.,2019-01-19 06:10:32+00:00,,
986,january-mid,during,2019-01-20,power outage,1086505215489003520,baubineau,Nearly 30 hours but power is finally restored to the neighborhood! #poweroutage #electricity,2019-01-19 06:06:44+00:00,#poweroutage #electricity,
987,january-mid,during,2019-01-20,power outage,1086503890059739136,ShanJeniah,"Off to the grocery store to be sure we're ready for storm and storm related potential power outages. We don't need a lot, but we need a few things, so getting that done in the wee hours.",2019-01-19 06:01:28+00:00,,
988,january-mid,during,2019-01-20,power outage,1086503778268954629,korayuh,I love me a good power outage at work and at home!!!,2019-01-19 06:01:01+00:00,,
989,january-mid,during,2019-01-20,power outage,1086503539801837568,poweralertsbot,"Power outage reported at Dagoretti Rd, Kenya.(dagoretti)",2019-01-19 06:00:04+00:00,,
990,january-mid,during,2019-01-20,power outage,1086503345643286528,Saima1Noman1,"#K_Electric never disappoints customers. We expect the worst from them and they always exceed our expectations. #Power_outages, feeder_trips technical_faults over-billing volatge_fluctuation and surges. You name it, they do it.",2019-01-19 05:59:18+00:00,#K_Electric #Power_outages,
991,january-mid,during,2019-01-20,power outage,1086503240563339265,ChrisThomasson7,"We actually had some really good highlights tonight, but not that you would know thanks to the power outage down the street knocking us off air and taking out our audio. Here is a clean version of the video! ",2019-01-19 05:58:53+00:00,,
992,january-mid,during,2019-01-20,power outage,1086502208391254016,Cohrs_Light,"It’s not even cold here, yet we have no power. #poweroutage @AEPTexas says 3:30AM before they get us back online. ",2019-01-19 05:54:47+00:00,#poweroutage,
993,january-mid,during,2019-01-20,power outage,1086501646518177792,mousmatt,We complain of power outage in salami areas of mafoluku we have call on okota they haven’t attend to it going on o two weeks now,2019-01-19 05:52:33+00:00,,
994,january-mid,during,2019-01-20,power outage,1086501571884572672,boston_informer,"Freezing Rain, Power Outages A Big Concern With Weekend Snowstorm Hitting Boston Area https://boston-informer.com/359400/freezing-rain-power-outages-a-big-concern-with-weekend-snowstorm-hitting-boston-area-3/",2019-01-19 05:52:15+00:00,,
995,january-mid,during,2019-01-20,power outage,1086500651264339968,BernardSabiti,"Welcome to Twitter finally. How come you don't pay attention to people in Goma division especially those parts still developing? Frequent water and power outages? Areas like Nabusugwe, Papati, etc. Arent these in your jurisdiction?",2019-01-19 05:48:36+00:00,,
996,january-mid,during,2019-01-20,power outage,1086500073222139904,therealhoff_,Power outage in Cannington. Welcome to neighbourhood Hoff!,2019-01-19 05:46:18+00:00,,
997,january-mid,during,2019-01-20,power outage,1086500068092448768,HarveyWCVB,"Power outage potential...in Worcester and Middlesex Counties it's due to freezing rain potential Sunday morning and midday. Over The South Coast and The Cape, it's due to high winds #wcvb",2019-01-19 05:46:17+00:00,#wcvb,
998,january-mid,during,2019-01-20,power outage,1086499784414978048,scott_olson,"Is @JCP_L prepared for the worst ahead of this storm? I would rather NOT need to find out. The brutally cold temps predicted for Sunday night through Tuesday will be bad enough, the LAST thing we need is a protracted power outage. Fingers crossed. https://www.prnewswire.com/news-releases/firstenergy-utilities-secure-additional-resources-in-advance-of-winter-storm-harper-300781144.html",2019-01-19 05:45:09+00:00,,
999,january-mid,during,2019-01-20,power outage,1086499721101877248,HowlToronto,"We have no plans to cancel, barring something like a massive power outage or something!",2019-01-19 05:44:54+00:00,,
1000,january-mid,during,2019-01-20,power outage,1086499671273586688,konsberd,@EversourceMA power outage in waltham ma,2019-01-19 05:44:42+00:00,,
1001,january-mid,during,2019-01-20,power outage,1086499335318196224,andyateacrayon,yeah probably the perfect weekend for it really. I'm just hoping no power outages because then I have to live that life.,2019-01-19 05:43:22+00:00,,
1002,january-mid,during,2019-01-20,power outage,1086499185229262853,NekoJeeynx,Yup. Met during a power outage. He was God given after everything I went thru with my ex,2019-01-19 05:42:46+00:00,,
1003,january-mid,during,2019-01-20,power outage,1086498949152862208,AdeelrKhan,@KElectricPk please raise a complaint of power outage for account 400030049045.,2019-01-19 05:41:50+00:00,,
1004,january-mid,during,2019-01-20,power outage,1086497959326507008,CaldwellJournal,Duke Energy has postponed the planned power outage for tonight in Granite Falls...no word on why and when they plan to do so in the future.,2019-01-19 05:37:54+00:00,,
1005,january-mid,during,2019-01-20,power outage,1086496737471184896,Saima1Noman1,"#Samba_Bank has built a slide on the footpath in fron of #Billys_Towers #Rashid Minhas_Road. This is almost invisible when there is a power outage. I know of at least 4 accidents due to this slide in which people were injured, one sustained an ankle fracture.",2019-01-19 05:33:03+00:00,#Samba_Bank #Billys_Towers #Rashid,
1006,january-mid,during,2019-01-20,power outage,1086496517525913606,moggchi,【power outage】: 停電,2019-01-19 05:32:10+00:00,,
1007,january-mid,during,2019-01-20,power outage,1086496477873143809,G00nSquadHD,POWER OUTAGE!: http://youtu.be/03HmXlLegLc?a via @YouTube,2019-01-19 05:32:01+00:00,,
1008,january-mid,during,2019-01-20,power outage,1086496424924233733,PacificPower_OR,"Power is restored to those affected by the outage in Klamath Falls at 9:21pm. If your power is still out, please reset your main breaker. If you are still experiencing an outage please call 1-877-508-5088 it can also be reported at http://pacificpower.net/or-map or text OUT to 722797",2019-01-19 05:31:48+00:00,,
1009,january-mid,during,2019-01-20,power outage,1086495776358969345,Drunk_Chemist,It would have been nice of Piedmont Electric Coop to tell us there was a planned power outage tonight. ,2019-01-19 05:29:13+00:00,,
1010,january-mid,during,2019-01-20,power outage,1086494514297036801,MAlbeshari,Power outage #Daly_City,2019-01-19 05:24:12+00:00,#Daly_City,
1011,january-mid,during,2019-01-20,power outage,1086493368425816066,notcorrectastro,mj: power outages are homophobic jinjin: elaborate mj: I'm gay and they're inconveniencing me,2019-01-19 05:19:39+00:00,,
1012,january-mid,during,2019-01-20,power outage,1086493313891516417,nitrodanielle,Supposed to get a little of everything here. Making breakfast for dinner tonite and a pot of beef stew for tomorrow. Back up in place for power outage just in case.,2019-01-19 05:19:26+00:00,,
1013,january-mid,during,2019-01-20,power outage,1086492887133704192,ChrisPoynter3,The power outage in #carrboro is a planned outage for maintenance. #darkness,2019-01-19 05:17:45+00:00,#carrboro #darkness,
1014,january-mid,during,2019-01-20,power outage,1086492808775647233,eeesawk,What y'all finna do when you have a power outage ,2019-01-19 05:17:26+00:00,,
1015,january-mid,during,2019-01-20,power outage,1086492214316986368,poweralertsbot,"Power outage reported at Kisumu, Kenya.(kisumu)",2019-01-19 05:15:04+00:00,,
1016,january-mid,during,2019-01-20,power outage,1086491527000608768,Starburstbubble,@CityPowerJhb still nothing. 2 hours later. Any ETR on power outage in highlands north?,2019-01-19 05:12:20+00:00,,
1017,january-mid,during,2019-01-20,power outage,1086491479768412161,OCReddit,Power outage in Aliso Viejo http://bit.ly/2QXmKzi #orangecounty,2019-01-19 05:12:09+00:00,#orangecounty,
1018,january-mid,during,2019-01-20,power outage,1086491171336187904,LiTTLEKiNG11s,snow blizzard caused a power outage at the movie theater.... ,2019-01-19 05:10:55+00:00,,
1019,january-mid,during,2019-01-20,power outage,1086490977378828288,lewicki0420,What a great time to have a power outage when the current temp is at 38degC ,2019-01-19 05:10:09+00:00,,
1020,january-mid,during,2019-01-20,power outage,1086489807457521664,MaggieRoseUX,"Beyond outages, downed power lines have also been implicated in the devastating California wildfires over the past couple seasons, and now PG&amp;E is facing bankruptcy in the aftermath of liability.",2019-01-19 05:05:30+00:00,,
1021,january-mid,during,2019-01-20,power outage,1086489685906448384,miawgordon,A few power outages already on Vancouver Island #bcstorm,2019-01-19 05:05:01+00:00,#bcstorm,
1022,january-mid,during,2019-01-20,power outage,1086488483089178624,RBroner,"Don’t worry when bad weather strikes. With special insurance to cover food spoilage due to off-premises power outages, you can feel confident during the worst weather. #smallbusinessinsurance #restaurantinsurance",2019-01-19 05:00:15+00:00,#smallbusinessinsurance #restaurantinsurance,
1023,january-mid,during,2019-01-20,power outage,1086488466354044928,poweralertsbot,"Power outage reported at Buruburu, Mumias Road, Nairobi, Kenya.(buruburu)",2019-01-19 05:00:11+00:00,,
1024,january-mid,during,2019-01-20,power outage,1086488030804934657,misterjonesmtl,"We wondered about the pasta situation Had a power outage in Montreal but back on, locked and loaded for hapo.",2019-01-19 04:58:27+00:00,,
1025,january-mid,during,2019-01-20,power outage,1086487630420852736,254_fibo,@KenyaPower_Care We have power outage. Acc no 01450479975,2019-01-19 04:56:51+00:00,,
1026,january-mid,during,2019-01-20,power outage,1086487550909394944,FreakUmLiQHOE,"It’s bound to be some power outages with this big ass storm that’s posed to come , i got all my wireless shit on the charger lol",2019-01-19 04:56:32+00:00,,
1027,january-mid,during,2019-01-20,power outage,1086487370420113409,melfly1,@NWSLittleRock @stevegrantKY3 @kytv @RonHearstKY3 @ktloradio @BBnewsroom @brandonbeckky3 @ryanvaughan y’all don’t forget the 10th anniversary of “the big one” Ice storm is coming up January 27. 19 days of power outages for @NorthARElectric #ARwx,2019-01-19 04:55:49+00:00,#ARwx,
1028,january-mid,during,2019-01-20,power outage,1086486401330368513,jaredcruzaedo,A power outage affected more than 800 people on the 4400 block of SPID from Everhart to Weber Drive. ,2019-01-19 04:51:58+00:00,,
1029,january-mid,during,2019-01-20,power outage,1086486372888862720,kiii3sports,"We are set back a bit due to the power outage! Highlights of: - A-P at Odem boys basketball - West Oso at Sinton girls &amp; boys basketball Plus! our preview on Santa Gertrudis, the reigning 3A State Softball Champions will be up on our website shortly.",2019-01-19 04:51:51+00:00,,
1030,january-mid,during,2019-01-20,power outage,1086486123537485825,SamanthaLira15,Baby man in bed; power outage and snow. #fun #teenmom #teenmomincollege,2019-01-19 04:50:52+00:00,#fun #teenmom #teenmomincollege,
1031,january-mid,during,2019-01-20,power outage,1086485631994216448,SoManySusans,Same here in BC. All above ground power lines and lots of trees. Big wind = power outage. Every time. Windstorm again tonight.,2019-01-19 04:48:55+00:00,,
1032,january-mid,during,2019-01-20,power outage,1086484934167011328,LaurenReyes8,Second night in the new house and got to experience a power outage. Not bad laying in bed with Levi and Nippy with the oil lamp on.,2019-01-19 04:46:08+00:00,,
1033,january-mid,during,2019-01-20,power outage,1086484687764242433,kiii3news,A power outage affected more than 800 people on the 4400 block of SPID from Everhart to Weber Drive. https://www.kiiitv.com/article/news/equipment-failure-at-holly-substation-causes-power-outage/503-e72aa18e-6da3-4c0c-892c-0a0c3b379545,2019-01-19 04:45:10+00:00,,
1034,january-mid,during,2019-01-20,power outage,1086484476451061766,SPIAindex,"Less than 400 electric utility customers w/o power as of 10:35pm. Outage numbers could increase as strong northerly winds pick up steam. Sustained Winds now in the 35 to 45 mph range, with gusts in the 50 to 59 mph range, primarily in western OK at present. ",2019-01-19 04:44:19+00:00,,
1035,january-mid,during,2019-01-20,power outage,1086484288495906816,PacificPower_WA,"We are aware of a power outage in Naches, WA affecting 1039 customers. The estimated time of restoration is approximately 1:00 am. Please visit http://pacificpower.net/wa-map for continuous updates. Thank you for your patience.",2019-01-19 04:43:34+00:00,,
1036,january-mid,during,2019-01-20,power outage,1086484130911514624,popesensei,"Niggas had a power outage, didn’t even finish the movie",2019-01-19 04:42:57+00:00,,
1037,january-mid,during,2019-01-20,power outage,1086483637502124035,tlsphotography1,Enough ice to be concerned with power outages??,2019-01-19 04:40:59+00:00,,
1038,january-mid,during,2019-01-20,power outage,1086483472846270465,IncidentAlert22,"Power Outage: 15:03: (87 premises) - Tatura-murchison Road, Dhurringile - Restoration: 18:30 19-01-2019 Cause: Under investigation See https://www.powercor.com.au/power-outages #vicPower",2019-01-19 04:40:20+00:00,#vicPower,
1039,january-mid,during,2019-01-20,power outage,1086483471487295488,IncidentAlert22,"Power Outage: 15:03: (477 premises) - Tatura-murchison Road, Dhurringile - Restoration: 18:30 19-01-2019 Cause: Under investigation See https://www.powercor.com.au/power-outages #vicPower",2019-01-19 04:40:20+00:00,#vicPower,
1040,january-mid,during,2019-01-20,power outage,1086482324722610176,RSideRiotFGC,"Alright. Power outages, food, and a little delay but we're in there! SC6 is first! ",2019-01-19 04:35:46+00:00,,
1041,january-mid,during,2019-01-20,power outage,1086482247635664897,cbezio,Storm has moved more north with concerns of prolong period of freezing rain and sleet with concerns of power outages and trees down. A major ice storm could be heading our way. https://www.facebook.com/1060405306/posts/10215083612937969/,2019-01-19 04:35:28+00:00,,
1042,january-mid,during,2019-01-20,power outage,1086481454509551616,oldmommatajuri,That's why I love my farm. Last night just the family cooking nearly got me. I had to stay in closed room at front of house. Power outages here are shorter but at home daughter said we're only getting 6 hrs of power and so I can't go home without a tank.,2019-01-19 04:32:19+00:00,,
1043,january-mid,during,2019-01-20,power outage,1086481180369788929,wbz,"Freezing Rain, Power Outages A Big Concern With Weekend Snowstorm Hitting Boston Area https://boston.cbslocal.com/2019/01/18/boston-snow-how-much-weekend-weather-forecast-storm-wbz-tv-terry-eliasen/",2019-01-19 04:31:13+00:00,,
1044,january-mid,during,2019-01-20,power outage,1086480891105419265,poweralertsbot,"Power outage reported at Kasarani Mwiki Rd, Nairobi, Kenya.(mwiki kasarani)",2019-01-19 04:30:04+00:00,,
1045,january-mid,during,2019-01-20,power outage,1086480796343549953,21WFMJ,Wellsville offering heating center in the event of a power outage http://www.wfmj.com/story/39817894/wellsville-offering-heating-center-in-the-event-of-a-power-outage,2019-01-19 04:29:42+00:00,,
1046,january-mid,during,2019-01-20,power outage,1086480439336931329,ScottFordTVGuy,STORM IMPACTS: Heavy Snow for tomorrow night in #Cincinnati. Power outages a possibility. @JohnGumm,2019-01-19 04:28:17+00:00,#Cincinnati,
1047,january-mid,during,2019-01-20,power outage,1086480387445084166,Nanatasis,We had a power outage due to the extreme cold last night! Felt like the end haha Seriously though we need a winter lodge in the back of the house for emergency ,2019-01-19 04:28:04+00:00,,
1048,january-mid,during,2019-01-20,power outage,1086480005490765824,viktoormtl,Warning: Major Power Outages Are Happening Across Montreal ,2019-01-19 04:26:33+00:00,,
1049,january-mid,during,2019-01-20,power outage,1086479895390228480,JasminaKelemen,"When I got hired by Bloomberg in 2011 and was doing a first few wks of training in ccs, a puffer fish died because of a weekend power outage. I seem to remember it happening twice but I’m not sure.",2019-01-19 04:26:07+00:00,,
1050,january-mid,during,2019-01-20,power outage,1086479628011589633,IncidentAlert22,"Power Outage: 15:03: (120 premises) - River Road, Murchison North - Restoration: 17:30 19-01-2019 Cause: Under investigation See https://www.powercor.com.au/power-outages #vicPower",2019-01-19 04:25:03+00:00,#vicPower,
1051,january-mid,during,2019-01-20,power outage,1086479545195204609,everythingdohr1,Emergency Power outage in Effect starting at 5am Jan 19th in these areas posted https://www.facebook.com/corey.b.142/posts/10161233102925612,2019-01-19 04:24:44+00:00,,
1052,january-mid,during,2019-01-20,power outage,1086479290051383296,KairoTheJackal,"All packed, dealt with a 3 hour power outage tonight, and now I’m ready to hit the road in the morning! #FC2019",2019-01-19 04:23:43+00:00,#FC2019,
