,Event,Stage,Query Date,Query Term,Id,Username,Text,Date,Hashtags,Location
1498,january-mid,during,2019-01-20,power outage,1086352937234898952,MattNBCBoston,"I should also note: entirely possible we warm the atmospheric column just enough in some areas to flip to freezing rain rather than sleet, greatly driving up power outage threat. I don’t think that’ll be widespread, but some pockets Central/NE CT to MA/Nrn RI border may get it.",2019-01-18 20:01:38+00:00,,
1499,january-mid,during,2019-01-20,power outage,1086352652953444353,WCEMAOhio,Freezing rain is expected to begin early tomorrow morning (1/19/19). Ice accumulation from freezing rain can cause damage to trees and power lines and create icy conditions on roads or walkways. Use caution if outdoors and prepare your home for possible power outages. ,2019-01-18 20:00:30+00:00,,
1500,january-mid,during,2019-01-20,power outage,1086352650260701184,WPXIScott,Power outages possible in the areas that get heavier snow this weekend. #wpxistorm,2019-01-18 20:00:29+00:00,#wpxistorm,
1501,january-mid,during,2019-01-20,power outage,1086352535819091969,RealGoods,"Attention @PGE4Me customers: Worried about the upcoming bankruptcy and uncertain future of rate hikes and grid outages? We have options for you to back up, supplement, or replace your PG&amp;E power entirely. - https://mailchi.mp/realgoods/2019-01-18-pge-options",2019-01-18 20:00:02+00:00,,
1502,january-mid,during,2019-01-20,power outage,1086352240720445441,IPLPower,"IPL Spokesperson Claire Rice briefs the media on IPL's storm response plan for Winter Storm Harper. IPL customers should be weather aware and prepared for a mix of snow, ice, and severe winds, which could cause power outages. Crews are on standby prepared to respond. #StormSafety",2019-01-18 19:58:52+00:00,#StormSafety,
1503,january-mid,during,2019-01-20,power outage,1086351968690454534,AshleyKramlich,"WINTER STORM WARNING for Carroll and N. Baltimore Counties from 1 PM Saturday - 6 AM Sunday. 1-3"" of snow and sleet expected along with 1/4"" of ice. The ice will likely cause power outages and tree damage. #MDWX",2019-01-18 19:57:47+00:00,#MDWX,
1504,january-mid,during,2019-01-20,power outage,1086351683683315713,MattNBCBoston,"Power outages will occur with this storm owing to gusty wind to 45 mph (mostly northeast) and higher at the coast. As for weight off snow coupled with wind, that may be a narrow zone in Central/Southern NH because sleet mix cuts “clinging” of snow",2019-01-18 19:56:39+00:00,,
1505,january-mid,during,2019-01-20,power outage,1086351628540747777,Bridgewater_Twp,Please prepare for the possibility of extended power outages due to icy conditions. Local utility companies are prepared and ask that residents call the hotline to report outages. The number can be found on the Township website. https://www.redcross.org/get-help/how-to-prepare-for-emergencies/types-of-emergencies/power-outage.html,2019-01-18 19:56:26+00:00,,
1506,january-mid,during,2019-01-20,power outage,1086351602691330050,JortSports,"That’s the worst, everyone without a blower probably hadn’t cleaned up the 8 yet. The wind is what bigs me cause it leads to more power outages.",2019-01-18 19:56:20+00:00,,
1507,january-mid,during,2019-01-20,power outage,1086351390899953666,ccvolfireems,Temperatures are expected to plummet on Sunday. Any lingering moisture could rapidly freeze on roadways. Strong winds from Sunday afternoon into Monday may cause localized wind damage and power outages. Bitterly cold air will move in Sunday night/Monday. Wind chills -4 degrees ,2019-01-18 19:55:29+00:00,,
1508,january-mid,during,2019-01-20,power outage,1086351173324541952,johnmcdonald108,"With winter storm warnings through the weekend National Grid staff and line crews are on standby should outages occur. To report a power outage or downed power line, customers should call National Grid at 1-800-867-5222... https://www.nationalgridus.com/Upstate-NY-Home/Default",2019-01-18 19:54:37+00:00,,
1509,january-mid,during,2019-01-20,power outage,1086350963818950656,kat_jones77,@RMP_Utah any eta on the Mill Creek power outage?,2019-01-18 19:53:47+00:00,,
1510,january-mid,during,2019-01-20,power outage,1086350837205602304,bealestreetpoet,nothing says Kenyon like a midday power outage,2019-01-18 19:53:17+00:00,,
1511,january-mid,during,2019-01-20,power outage,1086350718020341760,CDPU,"We couldn't resist sharing this one. Please report any Columbus power outages to 311 or 645-8276, squirrel related or not. (AEP customers of course report to AEP.) ",2019-01-18 19:52:49+00:00,,
1512,january-mid,during,2019-01-20,power outage,1086350683090178049,HumeraKhawaja,Significant weekend snow storm for Lehigh Valley could bring power outages ,2019-01-18 19:52:40+00:00,,
1513,january-mid,during,2019-01-20,power outage,1086350567700484097,WilRockCreates,"Was supposed to see it Wednesday, but as Cali is being hit with a lot of rain, my weather app scared me away from the theater with the threat of a power outage... Seeing it tomorrow though... Probably. I just HATE going to the theaters I don't have to.",2019-01-18 19:52:13+00:00,,
1514,january-mid,during,2019-01-20,power outage,1086350049687293952,PrincetonNJ_OEM,"Are YOU Storm Ready? IF YOUR POWER GOES OUT! you need to text or call: Text OUT to 4PSEG (47734), report it below, or call us 1-800-436-PSEG (7734). and you can monitor the PSE&amp;G outage map https://outagecenter.pseg.com/external/default.html",2019-01-18 19:50:09+00:00,,
1515,january-mid,during,2019-01-20,power outage,1086350045283262466,ESwitch,The KJD17 series is a heavy duty industrial pushbutton switch where the electromagnet provides automatic safety protection against power outages and restarts. http://ow.ly/e2yi30nmWzL,2019-01-18 19:50:08+00:00,,
1516,january-mid,during,2019-01-20,power outage,1086349934767554560,Dannytheweather,How much snow and ice is expected for Poughkeepsie and will they be widespread power outage in the Hudson valley #WinterStormHarper,2019-01-18 19:49:42+00:00,#WinterStormHarper,
1517,january-mid,during,2019-01-20,power outage,1086349823324901376,UrPublicAdjustr,"Be prepared for poss power outages, stay warm &amp; safe. ",2019-01-18 19:49:15+00:00,,
1518,january-mid,during,2019-01-20,power outage,1086349154064977920,HXChris87,@CityPowerJhb please advise as to power outage in Elton Hills. Ref #CPWEB2388335,2019-01-18 19:46:36+00:00,,
1519,january-mid,during,2019-01-20,power outage,1086349153549070336,FredZi_1,"Dear Mr. President @CyrilRamaphosa ... Here in @RustenburgLM we have power outages almost every day, for up to 2-4 hours at a time. Does that matter to you at all?",2019-01-18 19:46:36+00:00,,
1520,january-mid,during,2019-01-20,power outage,1086349112155561984,WeatherManCam14,Freezing rain has the potential to be a SERIOUS issue Sunday as the rain/snow line pushes north. The ice accretion can cause downed tree limbs resulting in the possibility of power outages.,2019-01-18 19:46:26+00:00,,
1521,january-mid,during,2019-01-20,power outage,1086349035726950400,mrsmarytaylor,"MEMA just announced that everyone should be prepared for power outages this weekend. ""Ice accumulation during #MAsnow storm on Sunday will bring power outages.""",2019-01-18 19:46:08+00:00,#MAsnow,
1522,january-mid,during,2019-01-20,power outage,1086348925555171329,SpamSpam,"Northern Baltimore County & Carroll County, Saturday 1 PM through Sunday 6 AM: ""One quarter of an inch of ice along with total snow and sleet accumulations of 1 to 3 inches expected. Power outages and tree damage are likely due to the ice. Travel could be nearly impossible."" ",2019-01-18 19:45:41+00:00,,
1523,january-mid,during,2019-01-20,power outage,1086348768461680640,LibertyUtil_NH,A WINTER STORM is forecast Saturday eve through Sunday with significant accumulations. Additional crews are ready to repair power outages. Program our emergency number into your phone 1-855-349-9455 or reach us online at http://www.libertyutilities.com. Stay warm and be safe!,2019-01-18 19:45:04+00:00,,
1524,january-mid,during,2019-01-20,power outage,1086348751235502080,DPLToday,"We're expecting a little of everything this weekend... snow, wind, rain, and ice, which could result in power outages. DP&amp;L is fully staffed and ready to respond. Are you? Bookmark our #OutageCenter and make sure you have an emergency plan in place: http://dpandl.com/outage #daywx",2019-01-18 19:45:00+00:00,#OutageCenter #daywx,
1525,january-mid,during,2019-01-20,power outage,1086348721502195712,BadmusSumayyah,"@AkinwunmiAmbode @CPCNig @IkejaElectric @NEMSA_GOVNG @NERCNG Good evening,please kindly help us out of this situation.We have not been supplied electricity since October last year due to faulty transformer,it has been taken away and the issue of power outage has not been resolved",2019-01-18 19:44:53+00:00,,
1526,january-mid,during,2019-01-20,power outage,1086348595266244609,Schoaaib,@KElectricPk power outage in PECHS block 6.. details in DM..,2019-01-18 19:44:23+00:00,,
1527,january-mid,during,2019-01-20,power outage,1086347426133364740,WESTON_FIRE,"WINTER STORM WATCH still a lot of uncertainty on snow totals but here is the latest from the @NWSBoston overall it’s going to be a mess so get ready, the biggest impact could possibly be the ice which could cause widespread power outages we’re going to share more from @MassEMA",2019-01-18 19:39:44+00:00,,
1528,january-mid,during,2019-01-20,power outage,1086347254263205888,d0ux_,i scream and theres a mass power outage,2019-01-18 19:39:03+00:00,,
1529,january-mid,during,2019-01-20,power outage,1086347160755552256,ABCBurglarAlarm,"Stay safe this weekend everyone! The biggest worry is downed tree limbs, power outages and travel disruptions in the western portions of Maryland. Did you know we offer LTE and GSM... ",2019-01-18 19:38:41+00:00,,
1530,january-mid,during,2019-01-20,power outage,1086346403146719233,heberutahpower,#poweroutage in Interlaken. Crews are working.,2019-01-18 19:35:40+00:00,#poweroutage,
1531,january-mid,during,2019-01-20,power outage,1086345996177735681,OCNCGOV,"Depending on where you live, possible Piedmont Electric power outage tonight for maintenance. ",2019-01-18 19:34:03+00:00,,
1532,january-mid,during,2019-01-20,power outage,1086345915781341185,SCE,"Hi Amanda, we're sorry we missed your message and to learn you were without power. In the future, you can report your outage and sign up to get text, email or voicemail updates as they happen on our site http://sce.com/outage. Thank you",2019-01-18 19:33:44+00:00,,
1533,january-mid,during,2019-01-20,power outage,1086345658968231936,cornwalloem,"#BeInformed http://ready.cornwallny.gov Power Outage? - Please utilize Central Hudson tools for reporting a power outage and checking restoration estimates. - 9-1-1 is for EMERGENCIES such as fallen power lines,... https://www.facebook.com/342812812551636/posts/1199817410184501/",2019-01-18 19:32:43+00:00,#BeInformed,
1534,january-mid,during,2019-01-20,power outage,1086345148102070272,townofoakville,"If not properly maintained, trees can create power outages or hazardous situations by touching or falling on hydro lines. Learn more about tree pruning around hydro lines: https://bddy.me/2W4RVfU",2019-01-18 19:30:41+00:00,,
1535,january-mid,during,2019-01-20,power outage,1086345045446402049,TownofAmherstNS,"A winter storm warning has been issued for Jan. 20-21. Amherst residents may face power outages, travel delays and road closures. Citizens should: prepare a 72-hour emergency kit, have potable water, charge cellphones and ensure generators are fueled and operating properly. ",2019-01-18 19:30:16+00:00,,
1536,january-mid,during,2019-01-20,power outage,1086345009350221825,poweralertsbot,"Power outage reported at Embakasi, Nairobi, Kenya.(embakasi)",2019-01-18 19:30:08+00:00,,
1537,january-mid,during,2019-01-20,power outage,1086344848687484928,RuggedOutdoors,"Look out for a lot more snow, ice, and potential power outages this weekend if you live in the eastern half of the states! Be safe! https://weather.com/storms/winter/news/2019-01-15-winter-storm-harper-snow-forecast-plains-midwest-northeast",2019-01-18 19:29:29+00:00,,
1538,january-mid,during,2019-01-20,power outage,1086344775198855169,besttime2buyit,"Sweet deal on this 4 Pack of Portable LED Camping Lanterns/Flashlights + 12 AA Batteries - only $18.39, normally $29.99. #Etekcity #lantern #flashlight #batteries #camping #outdoors #emergency #poweroutage #survivalkit #amazondeals #amazon #amazonprime https://amzn.to/2FDhf7A",2019-01-18 19:29:12+00:00,#Etekcity #lantern #flashlight #batteries #camping #outdoors #emergency #poweroutage #survivalkit #amazondeals #amazon #amazonprime,
1539,january-mid,during,2019-01-20,power outage,1086344708614434816,MontTwp,"PREPARE FOR THE STORM! Get the information you need on emergency alerts, power outages, snow removal, and more by visiting http://www.montgomerytwp.org.",2019-01-18 19:28:56+00:00,,
1540,january-mid,during,2019-01-20,power outage,1086343926267723776,Poyzun11,"Well, our power just ripped due to an area outage. Hopefully it’s back up before stream tonight. Hope your guys Friday is going swell!",2019-01-18 19:25:49+00:00,,
1541,january-mid,during,2019-01-20,power outage,1086343867543244800,MassEMA,"Ice accumulation during #MAsnow storm on Sunday will bring power outages. If your medical equipment uses electricity, talk to health care providers, utility company &amp; your personal support network for options. Power outage safety &amp; preparedness tips: http://bit.ly/2j5qs8X",2019-01-18 19:25:35+00:00,#MAsnow,
1542,january-mid,during,2019-01-20,power outage,1086343744792809472,OrangeChuck,"I think its normal to be prepared as roads may be bad for a couple days but when you worry about others in your care, it often brings more anxiety than normal especially if it leads to power outages which can impact oxygen machines, comfort devices or appliances you rely on.",2019-01-18 19:25:06+00:00,,
1543,january-mid,during,2019-01-20,power outage,1086343229375737857,WLBPD,"@firstenergycorp Corp. Customers who are without power are encouraged to call 1-888-LIGHTSS (1-888-544-4877) to report their outage or click the “Report Outage” link on http://www.firstenergycorp.com. In the event of severe weather, customers should immediately report downed wires.",2019-01-18 19:23:03+00:00,,
1544,january-mid,during,2019-01-20,power outage,1086342852488163328,MassEMA,"Ice accumulation during #MAsnow storm on Sunday will bring power outages. Check generators , keep electronics charged, locate flashlights &amp; radio and extra batteries . Power outage safety &amp; preparedness tips: http://bit.ly/2j5qs8X",2019-01-18 19:21:33+00:00,#MAsnow,
1545,january-mid,during,2019-01-20,power outage,1086342498073620480,bchydro,"Just in time for #WinnieThePoohDay, many parts of B.C. can expect a blustery day today. Make sure you're prepared in the event of a power outage: http://ow.ly/vu6330nmNXq",2019-01-18 19:20:09+00:00,#WinnieThePoohDay,
1546,january-mid,during,2019-01-20,power outage,1086342433070211073,SSVECAZ,"@SSVECAZ celebrates the arrival of a new mobile substation! The unit, constructed by @deltastarinc1 will reduce the time it takes to restore power during an outage at any of the Cooperative’s 32 substations. #SSVEC #ownedbythoseweserve #rememberyoureamember",2019-01-18 19:19:53+00:00,#SSVEC #ownedbythoseweserve #rememberyoureamember,
1547,january-mid,during,2019-01-20,power outage,1086342377193787393,DonPauly7,@insideFPL power outage in 30028 Pembroke Pines please fix,2019-01-18 19:19:40+00:00,,
1548,january-mid,during,2019-01-20,power outage,1086342030844923904,candlehouseshop,Us in the Northeast this weekend so do not forget the candles! You'll need them if there's a power outage or to make your extended stay indoors pleasant. We will be open until 6 PM &amp; Saturday will open at 10 AM until 6 PM weather permitting. Stay Safe &amp; Warm! The Candle Lady ,2019-01-18 19:18:18+00:00,,
1549,january-mid,during,2019-01-20,power outage,1086341886154035200,LibertyUtil_CA,Update: Power has been restored from Homewood Mt. Resort north. Crews are continuing to work the outage south of Homewood.,2019-01-18 19:17:43+00:00,,
1550,january-mid,during,2019-01-20,power outage,1086341253434916865,SNEWeather,This is my biggest concern. Power outages from ice in SNE followed by these temps. #mawx #ctwx #riwx,2019-01-18 19:15:12+00:00,#mawx #ctwx #riwx,
1551,january-mid,during,2019-01-20,power outage,1086341032235679745,NeptuneOEM,"#WinterWeather Update 1-2in of snow are expected in the Neptune area Saturday-Sunday morning, along with periods of rain and sleet. Roadway flooding is possible, along with power outages and icy roads Sunday and Monday. Full #NeptuneWeather forecast: https://www.facebook.com/neptuneoem/posts/2188851141151240?__xts__[0]=68.ARC4NMFwMQyYMKK_CNHv8l5JhCpSvzf-cvBgAydxjt3cpNbUcYx-7me8kYHv0XVQ1d0CVfFL2MyCYcH9CZVk7ias0sSIhWRmIUBqAlzMe66J1pKtMtXLYojB1cFCM5t7x8NF5I3wIf6KhEfHVcOS48SDLQjhXGokadCLKTd8CkX6IWrncPnB7bLixbMO5SllONzpbKuGdPw9VgYa4EZnNfp0e49spCENX9bJNWhl-xNhAQ_b6alsr-baNZa5rA92VJwELd8m6qyHupPID0XCtXZbaO1pqSQF09-YqSm37gJ1a17fr6CYQlz5v0d2RG3k8p-kSzdiAcLan8q4cXfQaQXacPGROeTZ3aOG2IavR3k9UCveGRW6arvW&amp;__tn__=-R",2019-01-18 19:14:19+00:00,#WinterWeather #NeptuneWeather,
1552,january-mid,during,2019-01-20,power outage,1086341015114604544,CNPpower,The Weather Network- Winter Storm Warning Please be advised of the winter storm warning issued by TWN. Remember to always stay clear of downed power lines. Power outages or concerns should be reported by calling 1-844-501-9473 (WIRE). http://ow.ly/NNtN30nmUW3,2019-01-18 19:14:15+00:00,,
1553,january-mid,during,2019-01-20,power outage,1086340549517336576,AdoboRelTV,"Hey hey! My name's Rel. Likes: video games, food, tattoos, all types of music, and new friends! Dislikes: A certain mermaid, coconut, playing victim, power outages. Roblox and Chill? Twitch: http://Twitch.tv/adoborel Discord: https://discord.gg/K76QrJB IG: https://instagram.com/adoborel",2019-01-18 19:12:24+00:00,,
1554,january-mid,during,2019-01-20,power outage,1086340445729447936,EdValleeWx,"Wind chills valid 7am Monday. Any folks impacted by power outages due to snow, ice, or wind will need to take proper precautions and prepare for unbearable wind chills between -10 and -30°F! ",2019-01-18 19:12:00+00:00,,
1555,january-mid,during,2019-01-20,power outage,1086340425613377536,SanMateoPride,The Pride Center is currently closed due to a power outage. Stay tuned for updates.,2019-01-18 19:11:55+00:00,,
1556,january-mid,during,2019-01-20,power outage,1086340383192350721,daylightng,Anger as power outage hits Lagos international airport http://daylight.ng/anger-as-power-outage-hits-lagos-international-airport/,2019-01-18 19:11:45+00:00,,
1557,january-mid,during,2019-01-20,power outage,1086340339949096967,KnoxKUB,"Hey, Austin. We have crews en route to restore power in south Knoxville. Currently there are 1600+ customers out. You can check the outage map at http://KUB.org for updates, or give us a call if you have any questions. Thanks!",2019-01-18 19:11:34+00:00,,
1558,january-mid,during,2019-01-20,power outage,1086340199184023552,westernequipmnt,Power outages can happen anytime but many occur during severe weather. As we head into stormy weather season it's the perfect time to review emergency preparedness. Ensure your emergency kit is fully stocked. Find out more in this video from @TorontoHydro: http://ow.ly/VecX30n7kmz,2019-01-18 19:11:01+00:00,,
1559,january-mid,during,2019-01-20,power outage,1086339993616990209,battisctv,"If you live on the east coast, by now you know that big winter storm with wind, rain, ice and snow is heading toward us. I'm in all weekend and will be covering developments, power outages, etc. Grab yer' mitts. @CTVNews",2019-01-18 19:10:12+00:00,,
1560,january-mid,during,2019-01-20,power outage,1086339861093732352,PerspectaWX,***For the DC metro region...snow or a wintry mix likely arrives tomorrow afternoon…ice/rain tomorrow night…brutal cold later Sunday into Monday…power outages are a threat*** https://www.perspectaweather.com/blog/2019/1/18/200-pm-snow-or-a-wintry-mix-likely-arrives-tomorrow-afternoonicerain-tomorrow-nightbrutal-cold-later-sunday-into-mondaypower-outages-are-a-threat,2019-01-18 19:09:40+00:00,,
1561,january-mid,during,2019-01-20,power outage,1086339762586296320,catco65,The Capt ....are we expecting a power outage ? ....Me : why have one candle when you can have 19 including reflections #FeetUpFriday ,2019-01-18 19:09:17+00:00,#FeetUpFriday,
1562,january-mid,during,2019-01-20,power outage,1086339438085529600,BalzacSportz,"At this incredible 3 level apartment I shared with 3 other recent grads in Hancock Park. I could hear all the glasses http://shattering.in our bar downstairs , but very little damage. Just remember looking out over LA from the 3rd floor, totally black because of power outage",2019-01-18 19:07:59+00:00,,
1563,january-mid,during,2019-01-20,power outage,1086339317692272644,MrFouds,"@CityPowerJhb Power out in Bosmont area, is this part of planned power outage.",2019-01-18 19:07:31+00:00,,
1564,january-mid,during,2019-01-20,power outage,1086339183659175936,paulrpotts,"Add to that the fact that the President very well may decide to hold disaster area declarations hostage as well, and FEMA might be out to lunch, or have its funding held up. This could get ugly. Really ugly, as in major power outages and below-zero temperatures in major cities.",2019-01-18 19:06:59+00:00,,
1565,january-mid,during,2019-01-20,power outage,1086338892746371073,OverheadDoorBwk,"A batter backup system for your garage door, usually the largest moving object in your home, is always a good idea especially here in south Georgia with frequent thunderstorms and power outages. ",2019-01-18 19:05:49+00:00,,
1566,january-mid,during,2019-01-20,power outage,1086338875625271296,UMBC_SmokeFree,Who up and can’t tweet during the power outage,2019-01-18 19:05:45+00:00,,
1567,january-mid,during,2019-01-20,power outage,1086338779563073536,GerardJebaily,This storm will be a bit different. The snow will not pile on trees as much. but some scattered power outages are possible as strong winds could bring down some weakened tree limbs from the last storm. ,2019-01-18 19:05:22+00:00,,
1568,january-mid,during,2019-01-20,power outage,1086338463354494976,his_kittyn,I hear that about the weather. The snow gets to heavy on our power lines and we can have power outages for days. Winter in the woods is so much fun and exciting. At least with a wood burner we never go without heat and a possible cooking area.,2019-01-18 19:04:07+00:00,,
1569,january-mid,during,2019-01-20,power outage,1086338279669223424,ClatterThunder,Prepare for power outages this looks messy will you be on this weekend?,2019-01-18 19:03:23+00:00,,
1570,january-mid,during,2019-01-20,power outage,1086338187159654400,AlleganyHlthMD,Winter Storm Warning Until 6 a.m. Sunday! The forecast for our area is more than 1/4 inch of ice and 2 to 4 inches of snow/sleet between 10 a.m. Saturday and 6 a.m. Sunday. Power outages and tree damage likely. Travel will hazardous. Exercise extreme caution.,2019-01-18 19:03:01+00:00,,
1571,january-mid,during,2019-01-20,power outage,1086338146101452800,EmeraldPUD, OUTAGE UPDATE: Approximately 750 customers are without power in the Cottage Grove area. Crews are enroute. There is no estimated time for power to be restored. The outage is believed to be caused by a downed tree or limb.,2019-01-18 19:02:51+00:00,,
1572,january-mid,during,2019-01-20,power outage,1086338102715707392,MediaTaiwanese,"Please remember, our donations to CSIS came from tax payers money in Taiwan. When general public displayed outage of government’s abuse of power. Bonnie chose to attack media. Does CSIS believes in freedom of press?",2019-01-18 19:02:41+00:00,,
1573,january-mid,during,2019-01-20,power outage,1086337970783821829,bongajacobs,This power outage thing must stop,2019-01-18 19:02:10+00:00,,
1574,january-mid,during,2019-01-20,power outage,1086337793205383168,911Restoration,"When it comes to taking care of your commercial property, facility, or building, waiting until a disaster (like a power outage leading to data loss) strikes is usually too late. With this in mind, things like... ",2019-01-18 19:01:27+00:00,,
1575,january-mid,during,2019-01-20,power outage,1086337290824286211,Derek18999255,Please no power outages.. The patriots are on,2019-01-18 18:59:27+00:00,,
1576,january-mid,during,2019-01-20,power outage,1086336557592793089,KingsLibraries,Sunday 20/01 08.30-13.00 - printing unavailable at Guy's campus due to planned power outage and generator testing. Other campuses are unaffected and printing will be back after 13.00. Our apologies for any inconvenience this may cause.,2019-01-18 18:56:33+00:00,,
1577,january-mid,during,2019-01-20,power outage,1086336538257039361,VibinWoosh,"San Francisco Chronicle: Nasty storm battering Bay Area leads to 6 deaths, flooding, power outages. https://www.sfchronicle.com/bayarea/article/Nasty-storm-battering-Bay-Area-leads-to-5-deaths-13541167.php via @GoogleNews",2019-01-18 18:56:28+00:00,,
1578,january-mid,during,2019-01-20,power outage,1086336509853270017,costellosace,Costello's Ace Hardware has everything that you need in case of any power outages. Make sure you are prepared with extra flashlights and batteries! #WinterStormHarper,2019-01-18 18:56:21+00:00,#WinterStormHarper,
1579,january-mid,during,2019-01-20,power outage,1086335766412869634,UMBC_OFAS,"Due to an ongoing campus-wide power outage, UMBC will be closing at 2:00PM on Friday, January 18th. ",2019-01-18 18:53:24+00:00,,
1580,january-mid,during,2019-01-20,power outage,1086335065817268230,alatedbookblog,That's crazy. Did we have a freak power outage around the same time or something? ,2019-01-18 18:50:37+00:00,,
