,Event,Stage,Query Date,Query Term,Id,Username,Text,Date,Hashtags,Location
476,january-end,before,2019-01-30,power outage,1090240508654481408,Seadrag79454119,@CityPowerJhb please may we have an update to power outage in Bramley,2019-01-29 13:29:27+00:00,,
477,january-end,before,2019-01-30,power outage,1090239601917083648,molkenthine,Make sure you know what steps to take to stay safe in the event of a winter power outage. ,2019-01-29 13:25:51+00:00,,
478,january-end,before,2019-01-30,power outage,1090239592584880129,ChaoticHellcat,all hell nah brother. driving in a area with no lights bc of power outage is scary asf,2019-01-29 13:25:49+00:00,,
479,january-end,before,2019-01-30,power outage,1090239312078225408,iqbalxaidi,"@KElectricPk Power outage in whole Gulishan, Clifton &amp; Defence &amp; don’t know where else too? Is HT cable tripped again or what? Pl elaborate as why such huge area has plunged into darkness? ",2019-01-29 13:24:42+00:00,,
480,january-end,before,2019-01-30,power outage,1090238300462428160,NevKabueh,@KenyaPower_Care we are experiencing a power outage in Kenol town Muranga acc no.14234509108. Kindly assist.,2019-01-29 13:20:41+00:00,,
481,january-end,before,2019-01-30,power outage,1090237822202793987,Ozone_com_ng,https://www.ozone.com.ng/product/3kw-must-power-inverter-charger/ We deliver and install for you. Excellent service guaranteed! New arrival. Have a Christmas without power outage.… https://www.instagram.com/p/BZxSluTFYMx/?utm_source=ig_twitter_share&amp;igshid=1l0qttgjhv2w,2019-01-29 13:18:47+00:00,,
482,january-end,before,2019-01-30,power outage,1090236531330170880,CynthiaKagezi,"In najeera it has become the norm never to have power during the day...even yesterday we had no power during the day,so every other day there’s a different reason as to why there is an outage....ani atuloga ",2019-01-29 13:13:39+00:00,,
483,january-end,before,2019-01-30,power outage,1090236420826947584,IncidentAlert22,Power Outage: 12:10AM: (58 premises) - Violet Town (58) Restoration: 06:00AM 30/01 See https://www.outagetracker.com.au #vicPower,2019-01-29 13:13:12+00:00,#vicPower,
484,january-end,before,2019-01-30,power outage,1090236290828779522,KenyaPower_Care,"If you are experiencing a power outage,please provide your a/c number for assistance.^BT",2019-01-29 13:12:42+00:00,,
485,january-end,before,2019-01-30,power outage,1090236053083119616,Ccc_jdvvnl,mam due to 11 kv off power outage in ur area our team is working to fix it asap...,2019-01-29 13:11:45+00:00,,
486,january-end,before,2019-01-30,power outage,1090234788202627072,daron_moondog,There's a power outage in Cambridge right now so the websites are down.,2019-01-29 13:06:43+00:00,,
487,january-end,before,2019-01-30,power outage,1090234619700658177,RevolutionsCen,#empowerment #poweroutage #BREAKING Encyclopedia with a difference site:DoU know women will rule the world in future http://bit.ly/Ra4gc7,2019-01-29 13:06:03+00:00,#empowerment #poweroutage #BREAKING,
488,january-end,before,2019-01-30,power outage,1090234475815075842,LakeZurichFD,The Ela Community Center can be used as a warming center Tuesday - Thursday this week. The hours of operation will be from 8:30 am to 7:30 pm and can be extended if needed. We will be monitoring power outages but please be sure to notify ComEd... http://elatownship.org/seniors,2019-01-29 13:05:29+00:00,,
489,january-end,before,2019-01-30,power outage,1090233799668105216,RueInsurance,"Be prepared for power outages with these basic safety tips on what to do before, during and after a power outage https://hubs.ly/H0ghM1Q0 https://hubs.ly/H0ghM1R0 by @readygov",2019-01-29 13:02:48+00:00,,
490,january-end,before,2019-01-30,power outage,1090233664192106497,town_bfalls,"Newfoundland Power is planning a power outage for tomorrow, January 30, 2019, from 6:00 am - 7:00 am. Residents living on Newtown Road, Turners Road, Junction Road, and Hampton's Hill may experience low pressure and/or water discolouration for a short period thereafter.",2019-01-29 13:02:15+00:00,,
491,january-end,before,2019-01-30,power outage,1090233147072090114,nordusk_led,"Featured with a rechargeable battery and an automatic emergency lighting switch, #Nordusk #LightBank offers illumination for 4 to 5 hours during power outages. #SwitchtoLED #BestLED #EmergencyLighting",2019-01-29 13:00:12+00:00,#Nordusk #LightBank #SwitchtoLED #BestLED #EmergencyLighting,
492,january-end,before,2019-01-30,power outage,1090232950690643970,PeterRMare,"The extreme cold temperatures experienced by a large part of the United States this month have highlighted the vulnerability of power systems equipment in such extreme weather. This week’s snowstorm led to power outages in the Northeast, ",2019-01-29 12:59:25+00:00,,
493,january-end,before,2019-01-30,power outage,1090232824312012800,danielbastos,Adventures In Power Outage Hacking https://news.google.com/./articles/CBMiQ2h0dHBzOi8vaGFja2FkYXkuY29tLzIwMTkvMDEvMjkvYWR2ZW50dXJlcy1pbi1wb3dlci1vdXRhZ2UtaGFja2luZy_SAQA?hl=en-US&amp;gl=US&amp;ceid=US%3Aen #CyberSecurity #dataprivacy #RansomwareProtection #Hacker #Ransomware #Malware #phishing #tech,2019-01-29 12:58:55+00:00,#CyberSecurity #dataprivacy #RansomwareProtection #Hacker #Ransomware #Malware #phishing #tech,
494,january-end,before,2019-01-30,power outage,1090232500490772480,Kyyhky7,Power outage at work 8| Yay summer,2019-01-29 12:57:38+00:00,,
495,january-end,before,2019-01-30,power outage,1090231727027556354,DavidWard126,#Randparkridge power outage - reports that some areas are back on,2019-01-29 12:54:33+00:00,,
496,january-end,before,2019-01-30,power outage,1090230853182074880,GenpowerSA,Shopping for a generator to use at home? Takea detailed list of appliances that you want to run on generator-power in the event of a power outage. #tiptuesday,2019-01-29 12:51:05+00:00,#tiptuesday,
497,january-end,before,2019-01-30,power outage,1090230529494999040,Nat_Davey,All Darlngunaya & Bungardi Community in the dark tonight. But horizon power checking it out So Fingers crossed for a quick and easy fix or will need a generator for essentials. @HorizonPower_WA #poweroutage #nowater,2019-01-29 12:49:48+00:00,#poweroutage #nowater,
498,january-end,before,2019-01-30,power outage,1090230223428349952,journalist_kb,PTV Fun Fact of the Day: 10-20% of US power outages are caused by squirrels.,2019-01-29 12:48:35+00:00,,
499,january-end,before,2019-01-30,power outage,1090229933538979840,Barron_Nel,#Adventures In #Power #Outage #Hacking https://goo.gl/fb/TDPK7a #security,2019-01-29 12:47:26+00:00,#Adventures #Power #Outage #Hacking #security,
500,january-end,before,2019-01-30,power outage,1090229900630544385,OBXHospital,"Due to a power outage, Outer Banks Ear, Nose &amp; Throat and The Outer Banks Hospital Urgent Care Center in Kitty Hawk will have a delayed opening. Once power is restored, we will let you know. We apologize for any inconvenience. Our Urgent Care in Nags Head will be open as normal.",2019-01-29 12:47:18+00:00,,
501,january-end,before,2019-01-30,power outage,1090227480680632320,PeterRMare,power grid will be at all time draw for home heating. This is an indicator of the Grand Solar Minimum intensifying. Good Luck and make preparations for power outages in this historic cold. https://www.youtube.com/watch?v=4qjsuuhvhI8&amp;feature=em-uploademail,2019-01-29 12:37:41+00:00,,
502,january-end,before,2019-01-30,power outage,1090227471973314560,vargas_7,Can we get an update from #CityofBrockton on this power outage?,2019-01-29 12:37:39+00:00,#CityofBrockton,
503,january-end,before,2019-01-30,power outage,1090226808908406784,Brockton_EMA,"This is information with respect to a Power outage Company: National Grid Town: BROCKTON Streets**: CRESCENT ST, QUINCY ST, PORTLAND ST, HALL ST, ROCKWELL AVE, HOPE ST, LOOKOFF ST, QUINCY AVE, LIBBY ST, CENTRE... https://www.facebook.com/247222682120443/posts/1133745796801456/",2019-01-29 12:35:01+00:00,,
504,january-end,before,2019-01-30,power outage,1090226596584271873,Brockton_EMA,"This is information with respect to a Power outage Company: National Grid Town: BROCKTON Streets**: CENTRE ST, EDWARD ST, BATES RD, LEWISTON ST, ALGER ST, GUILD RD, GALEN ST, AMES RD, HOWLAND ST, CRESTFIELD DR... https://www.facebook.com/247222682120443/posts/1133745323468170/",2019-01-29 12:34:10+00:00,,
505,january-end,before,2019-01-30,power outage,1090226396675407872,Brockton_EMA,"This is information with respect to a Power outage Company: National Grid Town: BROCKTON Streets**: THATCHER ST, PINE ST, ADDISON AVE, GEORGE ST, NICKERSON ST, OAKLAND ST, SPRAGUE AVE, LAFOYE ST, KAME ST,... https://www.facebook.com/247222682120443/posts/1133744356801600/",2019-01-29 12:33:23+00:00,,
506,january-end,before,2019-01-30,power outage,1090225995355959296,WBFO,POWER OUTAGE: @nationalgridus reports 224 customers without power in Town of @TownofTonawanda in the Ensminger/Sawyer/Kenmore Ave area. Est. restoration time 9am.,2019-01-29 12:31:47+00:00,,
507,january-end,before,2019-01-30,power outage,1090225559710384128,HidaysKinderFun,Please be safe driving families! My husband called and there’s a power outage due to someone sliding off road and hitting utility pole by corner depot.,2019-01-29 12:30:03+00:00,,
508,january-end,before,2019-01-30,power outage,1090223882592796672,Brockton_Fire,Power Outages being reported on the East side of the city. Surges throughout the city. BFD answering multiple calls at this time. @MayorBillCarp @Brockton_EMA @BrocktonHousing @BrocktonPolice,2019-01-29 12:23:23+00:00,,
509,january-end,before,2019-01-30,power outage,1090222574573940737,Qalvins,"@KenyaPower @KenyaPower_Care kindly solve the power outage in kisii town, Gekomu church area. It is 24hrs now without power. We are losing business at a high rate.",2019-01-29 12:18:11+00:00,,
510,january-end,before,2019-01-30,power outage,1090221932463693824,TK_Ukunda,@KenyaPower_Care power outage since 9 o’clock in morning #Ukunda along Ramisi Road and NO published information #kenyapower ????????????,2019-01-29 12:15:38+00:00,#Ukunda #kenyapower,
511,january-end,before,2019-01-30,power outage,1090221677617782784,pennino_joseph, Up for an early workout only to have the power go out halfway through #poweroutage #generator #orangetheory – at Orangetheory Fitness,2019-01-29 12:14:37+00:00,#poweroutage #generator #orangetheory,
512,january-end,before,2019-01-30,power outage,1090221282463870976,joandjames,"There will soon be no need for ""baseload"" at all. Look at the recent power station outages in Aus, you'll see that the smaller units and batteries covered them.",2019-01-29 12:13:03+00:00,,
513,january-end,before,2019-01-30,power outage,1090221169041702913,Qalvins,"@KenyaPower_Care kindly solve the power outage in kisii town, Gekomu church area. It is 24hrs now without power. We are losing business at a high rate.",2019-01-29 12:12:36+00:00,,
514,january-end,before,2019-01-30,power outage,1090221031585918976,rstroess,Craig Kelly slams Victorian govt for power outages | Sky News Australia ,2019-01-29 12:12:03+00:00,,
515,january-end,before,2019-01-30,power outage,1090220935880368128,CarolynDeason,"Blame it on severely cold weather. Blame it on the End Times. Blame it on terrorists attacks. Blame it on whatever. The point is, PREPARE for complete, could be extended time, power outages! https://www.youtube.com/watch?v=VPmiqr6q_DU&amp;feature=share",2019-01-29 12:11:41+00:00,,
516,january-end,before,2019-01-30,power outage,1090220545126400005,RodgersChad,Odd power outages occurring through Greencastle this morning,2019-01-29 12:10:07+00:00,,
517,january-end,before,2019-01-30,power outage,1090220445931061248,vargas_7,Whats is going on in Brockton with all these power outages? Are we becoming Praia or what? Lol,2019-01-29 12:09:44+00:00,,
518,january-end,before,2019-01-30,power outage,1090220432031170561,okajoe1,"@KenyaPower_Care power outage for the 3rd consecutive day at Zebra, utawala. What is not happening? Metre no. 14253341680",2019-01-29 12:09:40+00:00,,
519,january-end,before,2019-01-30,power outage,1090219535913897984,DavidWard126,#randparkridge power outage - I have been informed that a contractor has damaged a cable - waiting for CP confirmation - will advise,2019-01-29 12:06:07+00:00,#randparkridge,
520,january-end,before,2019-01-30,power outage,1090218909679136768,aedcelectricity,"#PSA Power outage in Katampe, Dawaki and environs is due to a Line fault affecting the 33KV Dawaki Feeder serving the affected areas. Our team is currently working to clear the fault and restore supply ASAP. We are sorry for the inconvenience. Kindly bear with us.",2019-01-29 12:03:38+00:00,#PSA,
521,january-end,before,2019-01-30,power outage,1090218674395348992,Sky_PIbot,Home Land On Power Grid Supply @17:32 &amp; Outage =&gt; 3:07:57,2019-01-29 12:02:41+00:00,,
522,january-end,before,2019-01-30,power outage,1090217996709183488,LuizSimoesSE,"#Schneider Electric Modernization Solutions are cost effective, reduce #outages duration and expand the life of your #Switchgear. #iot #lifeison #electrical #ecostruxure #power #safety #ArcFlash #PredictiveMaintenance #IEEE",2019-01-29 12:00:00+00:00,#Schneider #outages #Switchgear #iot #lifeison #electrical #ecostruxure #power #safety #ArcFlash #PredictiveMaintenance #IEEE,
523,january-end,before,2019-01-30,power outage,1090217720459730944,SecureERP,Power outages are a leading cause of business downtime for #SMBs! Check out the infographic: http://datto-content.amp.vg/web/bo4ynf9xmdz8e,2019-01-29 11:58:54+00:00,#SMBs,
524,january-end,before,2019-01-30,power outage,1090217522257977344,mjaggy,@KenyaPower_Care power outage since today morning on Mtr No: 04211784592. Kindly assist.,2019-01-29 11:58:07+00:00,,
525,january-end,before,2019-01-30,power outage,1090217150864809984,NQuest63,Unless you get another power outage? :P,2019-01-29 11:56:38+00:00,,
526,january-end,before,2019-01-30,power outage,1090217077561090048,Scandalous,It seems that if it could happen it really was going to happen on this trip. Two days of power outages. One was too many. The second was a bit more painful because the spare power bricks are of course both dead now...,2019-01-29 11:56:21+00:00,,
527,january-end,before,2019-01-30,power outage,1090216346837762048,HagerKeyari,My undereducated fear concerning Ethiopia's advent into starting a stock exchange is infrastructure and cyber security. What could happen if there was an interuption in the network or power outages? Hacking? Can our economy handle it?#Ethiopia,2019-01-29 11:53:26+00:00,#Ethiopia,
528,january-end,before,2019-01-30,power outage,1090215965445550080,HarterKev,"First day back after vacation... get up 3:55 a.m. to start my normal routine. Drive in and pull up to the gate at 5:45 just to get sent home due to a power outage. So I’ll be working from the home office today, if you need me. Life is good!",2019-01-29 11:51:56+00:00,,
529,january-end,before,2019-01-30,power outage,1090215944453087233,MkbbcsBeg,"@KElectricPk Rare power outage being reported in DHA PHVI, from ~415pm this afternoon. FYI",2019-01-29 11:51:51+00:00,,
530,january-end,before,2019-01-30,power outage,1090215500490121216,TreeElemen,"Due to the power outage at The Davis Thayer School, The Elemen-Tree House will be open for full day care. Drop ins welcome ",2019-01-29 11:50:05+00:00,,
531,january-end,before,2019-01-30,power outage,1090215311310290944,ArcticGeneral,@CityPowerJhb CPWEB2394452 logged for power outage in Lenasia South. This is since 8am this morning,2019-01-29 11:49:20+00:00,,
532,january-end,before,2019-01-30,power outage,1090214881142415360,Real_Chill_,"My coworkers ain’t nothing. Lol! Texted them last night about the power outage, and didn’t get the FIRST response. Any other night, y’all text until dawn! ",2019-01-29 11:47:37+00:00,,
533,january-end,before,2019-01-30,power outage,1090214877598121989,GantoranGames,"@TasNetworks power outage issues in Punchbowl, Launceston. Any information on this?",2019-01-29 11:47:36+00:00,,
534,january-end,before,2019-01-30,power outage,1090214648534712320,Spyro__ZA,"Looks like there will be no stream today, yesterdays power outage ended up corrupting my ps4 so got a lot of technical issues to sort out",2019-01-29 11:46:42+00:00,,
535,january-end,before,2019-01-30,power outage,1090213810252718080,KenyaPower_Care,The area is off on planned outage for maintenance. Power will be restored at 5 PM ^EF,2019-01-29 11:43:22+00:00,,
536,january-end,before,2019-01-30,power outage,1090213770943700992,KenyaPower_Care,The area is off on planned outage for maintenance. Power will be restored at 5 PM ^EF,2019-01-29 11:43:12+00:00,,
537,january-end,before,2019-01-30,power outage,1090213627364286464,KenyaPower_Care,The area is off on planned outage for maintenance. Power will be restored at 5 PM ^EF,2019-01-29 11:42:38+00:00,,
538,january-end,before,2019-01-30,power outage,1090213460749766658,razzberri1973,@SJENERGY Power outage west side or is it just me?,2019-01-29 11:41:58+00:00,,
539,january-end,before,2019-01-30,power outage,1090213433814016000,OpenSocietyEA,Governments across the region ought to set requirements that prohibit distribution companies from cutting power supply to health facilities. This will ensure that no power outage occurs in hospitals. This will save innocent lives~ @PrimahKwagala. Read more-https://bit.ly/2sV8FsA,2019-01-29 11:41:52+00:00,,
540,january-end,before,2019-01-30,power outage,1090213222408323073,Toadlette_,"Sorry for the abrupt end to stream, had a random power outage. Thanks for the support as usual team! &lt;3",2019-01-29 11:41:02+00:00,,
541,january-end,before,2019-01-30,power outage,1090212412383477760,Oscardelapug,@SJENERGY power outage west?? No lights on Dever #ERT,2019-01-29 11:37:48+00:00,#ERT,
542,january-end,before,2019-01-30,power outage,1090212079900995584,ellie_withrow,"Just in case that anyone was worried about my sister, and I that after almost a week of power outage in our area. it's great to have our heat, and TV back on, and to be back online again. Never ever had... https://www.facebook.com/elva.cathleen.withrow/posts/10205548574469178",2019-01-29 11:36:29+00:00,,
543,january-end,before,2019-01-30,power outage,1090211391326310400,abukhamsa1,So Malindi is not listed yet power outage since 7 in the morning.,2019-01-29 11:33:45+00:00,,
544,january-end,before,2019-01-30,power outage,1090210810654347264,Brad_MacPhee,"@SJENERGY power outage on Bayview Drive, west. Fyi. Twice this morning",2019-01-29 11:31:27+00:00,,
545,january-end,before,2019-01-30,power outage,1090210788365750272,BronyW,"Eskom just called to ask if I’m still experiencing a power outage from last night. If so, can I re-report it. You can’t make this shit up. ",2019-01-29 11:31:21+00:00,,
546,january-end,before,2019-01-30,power outage,1090210585483116545,julieaskew50,HEAVY snow is set to hit Greater Manchester and could cause transport chaos and power outages https://www.manchestereveningnews.co.uk/news/greater-manchester-news/heavy-snow-set-hit-greater-15744076,2019-01-29 11:30:33+00:00,,
547,january-end,before,2019-01-30,power outage,1090209796962304000,remykgl,I’v had more power outages in Jan 2019 than in the whole year of 2018. @reg_rwanda #rwot,2019-01-29 11:27:25+00:00,#rwot,
548,january-end,before,2019-01-30,power outage,1090207810812563457,HomerElectric,HEA is responding to several outages in the Nikiski area due mostly to snow loading on the power lines. Update on all the outages: Looks like 82 consumers out of power on Halbouty - power has been restored. 95... https://www.facebook.com/280646461987607/posts/2200844463301121/,2019-01-29 11:19:31+00:00,,
549,january-end,before,2019-01-30,power outage,1090207242589224960,YedcPlc,Power Outage: Loss of supply from Yola TCN @11:54 am to enable them carryout load transfer due to hotspot on 330kv busbar.,2019-01-29 11:17:16+00:00,,
550,january-end,before,2019-01-30,power outage,1090206879031144448,Technol53581657,"Adventures In Power Outage Hacking The best type of power outage is no power outage, but they will inevitably happen. When they do, a hacker with a house full of stuff and a head full of ideas is often the person of the hour. Or the day, or perhaps the week, should the outa…",2019-01-29 11:15:49+00:00,,
551,january-end,before,2019-01-30,power outage,1090205451927670784,MideaNigeria,"See the face you wear after buying Midea HS 268C chest freezer and it is lasting for up to 120hours afterr power outage. Call now for your own oo Tosin on 0812289 2556, 08023663628 OR Shop Online Order on Jumia &gt; http://ow.ly/4zgX30nqGFU #MideaElectronics #HomeAppliances",2019-01-29 11:10:09+00:00,#MideaElectronics #HomeAppliances,
552,january-end,before,2019-01-30,power outage,1090204808726736896,natfkdhazelnuts,Got a LED lantern in case of power outages. Actually I had to wait for 4 months; they'd been out of stock.,2019-01-29 11:07:36+00:00,,
553,january-end,before,2019-01-30,power outage,1090203316880007168,pwrusertech,"Woke up from food coma, power outage is over. Edited my vlog. Time for #a7iii",2019-01-29 11:01:40+00:00,#a7iii,
554,january-end,before,2019-01-30,power outage,1090202988084248586,keysyu__,"after she opened our gift she said ""i became a shawol when i was really young, since i was 9. and after 8 years, i finally can see how beautiful the colour of SHINee is. i wont be afraid of any power outages anymore, i will say 'with the power of @SHINee 's light, scram you!',""",2019-01-29 11:00:22+00:00,,
555,january-end,before,2019-01-30,power outage,1090202378656206848,ksrxx,Your not fully a Jamaican if u never experience power outage and water lock off.,2019-01-29 10:57:56+00:00,,
556,january-end,before,2019-01-30,power outage,1090202298171772929,kenyan_digest,Residents of Moyale town crying foul over what they term a perennial power outage - https://kenyan-digest.com/residents-of-moyale-town-crying-foul-over-what-they-term-a-perennial-power-outage/,2019-01-29 10:57:37+00:00,,
557,january-end,before,2019-01-30,power outage,1090202187202842624,EyemanPat,Couldn’t agree more. Heat followers have already missed 3 games FTA not to mention no refund for the scheduled power outage at the Gabba. Brisbane has been deserted by CA and CH 7,2019-01-29 10:57:11+00:00,,
558,january-end,before,2019-01-30,power outage,1090202072392318976,NyokabiLucy,Hi @KenyaPower_Care Power outage 54400927411. Please restore,2019-01-29 10:56:43+00:00,,
559,january-end,before,2019-01-30,power outage,1090200992300392448,SAORVIEW,"Hi, the outage in South Kerry yesterday was caused by an ESB fault that affected the transmitter at Kilkeaveragh. Power was restored to the Kilkeaveragh transmitter yesterday at circa 16:00 yesterday so viewers should have signal. Please DM with contact info.",2019-01-29 10:52:26+00:00,,
560,january-end,before,2019-01-30,power outage,1090200401863995392,davidictw1,@CityofCT Is there a power outage at the Tableview myCiTi Kiosks?,2019-01-29 10:50:05+00:00,,
561,january-end,before,2019-01-30,power outage,1090199152254959616,poweralertsbot,"Power outage reported at Juja, Kenya.(juja)",2019-01-29 10:45:07+00:00,,
562,january-end,before,2019-01-30,power outage,1090198730475622400,Minerva452010,"Elderly pensioners at risk of heat stress if their power goes out, causing airconditioners and fridges to stop. When Winter comes around, elderly pensioners will once again suffer freezing due to more power outages. Wake up Victorian Government, renewables are a disaster.",2019-01-29 10:43:26+00:00,,
563,january-end,before,2019-01-30,power outage,1090198255248396288,Minerva452010,"Yes Rita, dire situation across Victoria with increased power outages due to years of Labor obsession with pushing renewables and pulling down reliable and cheap coal fired power stations. Yet the Left Victorian Government continues to make excuses for the power outages !",2019-01-29 10:41:33+00:00,,
564,january-end,before,2019-01-30,power outage,1090197720952958977,iotexpertit,Adventures In Power Outage Hacking http://www.iotexpert.it/2019/01/29/adventures-in-power-outage-hacking/,2019-01-29 10:39:26+00:00,,
565,january-end,before,2019-01-30,power outage,1090196919182340096,AAlhorria,Power outage hits Sudan http://alhourriah.org/english/article/58968,2019-01-29 10:36:15+00:00,,
566,january-end,before,2019-01-30,power outage,1090196867831468032,NipperboutLtd,"Due to an unscheduled power outage, Please contact Nipperbout on 07976430598",2019-01-29 10:36:02+00:00,,
567,january-end,before,2019-01-30,power outage,1090196382948814848,Nat_Davey,"Reported power outage Now feeling a bit challenged with No power, No water, No WiFi and doesn’t look hopeful for it to come back on today. #Iamhopeful #horizonpower #poweroutage",2019-01-29 10:34:07+00:00,#Iamhopeful #horizonpower #poweroutage,
568,january-end,before,2019-01-30,power outage,1090196132775579648,Haurchefent,scared power outage and I didn't save :(,2019-01-29 10:33:07+00:00,,
569,january-end,before,2019-01-30,power outage,1090195553584103424,KenyaPower_Care,The area is off on planned outage for maintenance. Power will be restored at 5 PM ^EF,2019-01-29 10:30:49+00:00,,
570,january-end,before,2019-01-30,power outage,1090195290928369664,XanthyaHanekom,@Eskom_SA . Power outage in Nieu bethesda. Eastern cape. Pls advise urgently.,2019-01-29 10:29:46+00:00,,
571,january-end,before,2019-01-30,power outage,1090194965773410305,EspVe1,"3 days after storm, BC Hydro warns of prolonged power outages",2019-01-29 10:28:29+00:00,,
572,january-end,before,2019-01-30,power outage,1090194841768738818,aedcelectricity,"Hello Zafar, If you have been experiencing power outage for over 24 hours, this indicates that your area is affected.",2019-01-29 10:27:59+00:00,,
573,january-end,before,2019-01-30,power outage,1090194206935654400,KenyaPower_Care,The area is off on planned outage for maintenance. Power will be restored at 5 PM ^EF,2019-01-29 10:25:28+00:00,,
