,Event,Stage,Query Date,Query Term,Id,Username,Text,Date,Hashtags,Location
1448,january-end,before,2019-01-30,power outage,1089807943539650560,ChandlerPolice,"#TrafficAlert - We are working an accident at Prescott/McQueen, which has caused a power outage in the area.",2019-01-28 08:50:36+00:00,#TrafficAlert,
1449,january-end,before,2019-01-30,power outage,1089807735279968256,bonkiru,sai crash? rarely. sai freezes? every once in a while FUCKING POWER OUTAGE? ITS A GODDAMN REGULAR SIR,2019-01-28 08:49:46+00:00,,
1450,january-end,before,2019-01-30,power outage,1089807373789614081,udderrunner,"100mm angle steel either side if wooden power poles &amp; welding them together...the cheapest option...when the programme should have been...40 YEARS they have been cutting this corner, instead of #Infrastructure Upgrading to Underground Reticulation... Budgets ! How many outages",2019-01-28 08:48:20+00:00,#Infrastructure,
1451,january-end,before,2019-01-30,power outage,1089807334933778432,nhltoews19,I also feel like there’s going to be a power outage,2019-01-28 08:48:10+00:00,,
1452,january-end,before,2019-01-30,power outage,1089807099733905408,ellenscult,"Hey, @NIElectricity what's with the 20 second power outage at 22:40 (Sat 26/1/19) ( BT41 2LB)? And then power blips at 3:23am. Not cool, peeps, not at all. #PowerCut",2019-01-28 08:47:14+00:00,#PowerCut,
1453,january-end,before,2019-01-30,power outage,1089806942648692736,bonkiru,"yeah, blackout. power outage, ppower down, lighs off it's the greatest thing ever happened to mankind isn't it. after 2 hours of spamming sketches, all gone in an instant. man, I sure love blackouts, it's a very lovely lovely thing!",2019-01-28 08:46:37+00:00,,
1454,january-end,before,2019-01-30,power outage,1089806568919490561,energyinfrapos1,"Power outage for #Metro work in #Mumbai, consumers get electricity from alternate source http://energyinfrapost.com/power-outage-metro-work-mumbai-consumers-get-electricity-alternate-source/ @MinOfPower @MumMetro #electricity",2019-01-28 08:45:08+00:00,#Metro #Mumbai #electricity,
1455,january-end,before,2019-01-30,power outage,1089805364974047232,curryian5,@CityPowerJhb please can you update us on the time to repair the power outage in Northcliff area?,2019-01-28 08:40:21+00:00,,
1456,january-end,before,2019-01-30,power outage,1089804053335416835,ETMLTD,Power outages and potentially unsafe conditions can be avoided. Contact us today. #power #electricity http://ow.ly/j5ba30no3Gk,2019-01-28 08:35:08+00:00,#power #electricity,
1457,january-end,before,2019-01-30,power outage,1089803706730717184,KhuluPhasiwe,"Hi Herman, we encourage all customers to report power outages to 08600 37566 if they are Eskom customers. Municipal customers also need to do call their local suppliers.",2019-01-28 08:33:45+00:00,,
1458,january-end,before,2019-01-30,power outage,1089803361640243200,d_tamale,"@UmemeLtd kindly fix the power in nyamitanga at the main mosque,nyamitanga secondary area, we lost it yesterday at 2:00pm...till now we are out of work. @KagutaMuseveni poweroutage again..banangee",2019-01-28 08:32:23+00:00,,
1459,january-end,before,2019-01-30,power outage,1089802810521239552,poweralertsbot,"Power outage reported at Athi River, Kenya.(athi river)",2019-01-28 08:30:12+00:00,,
1460,january-end,before,2019-01-30,power outage,1089800637313941504,ElectricIreland,"Hi David, thanks for your tweet. The company to contact in the case of a power outage is @ESBNetworks (1850 372 999, open 24/7). They also have a Powercheck app that provides real-time updates: https://www.esb.ie/esb-networks/powercheck/ We hope this helps. Thanks, Aoife",2019-01-28 08:21:34+00:00,,
1461,january-end,before,2019-01-30,power outage,1089800258505400320,ServiceinfoAUen,SOLVED - Power outages in 5123 https://serviceinfo.au.dk/Home/Message/531 09:20,2019-01-28 08:20:03+00:00,,
1462,january-end,before,2019-01-30,power outage,1089799782447624192,ServiceinfoAUen,Power outages in 5123 https://serviceinfo.au.dk/Home/Message/531 09:18,2019-01-28 08:18:10+00:00,,
1463,january-end,before,2019-01-30,power outage,1089799644589240320,ServiceinfoAUen,Power outages in 5123 https://serviceinfo.au.dk/Home/Message/531 09:17,2019-01-28 08:17:37+00:00,,
1464,january-end,before,2019-01-30,power outage,1089798585095520257,ServiceinfoAUen,Power outages in 5123 https://serviceinfo.au.dk/Home/Message/531 09:13,2019-01-28 08:13:24+00:00,,
1465,january-end,before,2019-01-30,power outage,1089798353179893760,jozi117,Power Outage Update in @Parkhurst_JHB - @CityPowerJhb are on site. It is not a quick fix as most of the cables in 4th Ave fm 10th to 7th St.,2019-01-28 08:12:29+00:00,,
1466,january-end,before,2019-01-30,power outage,1089798304765038592,dan_putar,@KenyaPower_Care Nairobi Muthaiga. Acc Nr 104826383 power outage since 10am today! Please follow-up and advise!,2019-01-28 08:12:17+00:00,,
1467,january-end,before,2019-01-30,power outage,1089798033573859328,HwnElectric,10p Aliamanu/Foster Village update: Power restored to a majority of customers. ~40 customers to remain out until crews replace downed pole. Work to continue tonight and tomorrow morning. Outage caused by earlier motor vehicle accident. Mahalo for your patience. #OahuOutage,2019-01-28 08:11:13+00:00,#OahuOutage,
1468,january-end,before,2019-01-30,power outage,1089796565961723904,Worley_ECR,"Simply the BESS! Find out how the successful installation of battery energy storage systems (BESS) means communities in Eugene, Oregon, have fresh drinking water during long-term power outages https://www.worleyparsons.com/our-work/eweb-power",2019-01-28 08:05:23+00:00,,
1469,january-end,before,2019-01-30,power outage,1089795973411471360,kenkoen,"This is actually frightening. It is human nature to adapt, and to get used to things, to accept. We are already accilmatised to anarchic levels of crime, taxis, power outages, ++ All these enquiries and exposures without prosecution will bring us to eventually accept dictatorship",2019-01-28 08:03:02+00:00,,
1470,january-end,before,2019-01-30,power outage,1089795382618447872,SchoolShrink,"Power outage at my place. Pitch dark, finally downloaded Tell me a Lie. Awesome, just great. Loved the Alan Colmes references. Who was Long John?",2019-01-28 08:00:41+00:00,,
1471,january-end,before,2019-01-30,power outage,1089795276003594240,Jaguarlade,The reason for Randfontein's power outages - Randfontein Herald ,2019-01-28 08:00:15+00:00,,
1472,january-end,before,2019-01-30,power outage,1089793230713933825,usaghawaii,AMR POWER OUTAGE - a vehicle hit a utility pole earlier today causing damage to Aliamanu Military Reservation’s power system.,2019-01-28 07:52:08+00:00,,
1473,january-end,before,2019-01-30,power outage,1089792238966706176,curryian5,@CityPowerJhb please can you give an update on the power outage in the Northcliff area. Thanks,2019-01-28 07:48:11+00:00,,
1474,january-end,before,2019-01-30,power outage,1089790206167855104,Nancy_C,"You say 1,640 are without power, but your outage map says 1,641. Which is it, Hawaiian Electric? What’s the big cover-up?? (But seriously thank you for your quick action. And big mahalo to your workers in the field for coming out tonight! #OahuOutage @HwnElectric",2019-01-28 07:40:07+00:00,#OahuOutage,
1475,january-end,before,2019-01-30,power outage,1089789767003168768,RusselJoss,@CityPowerJhb hi please advise regarding power outage in Fairvale Glenhazel area. Thanks,2019-01-28 07:38:22+00:00,,
1476,january-end,before,2019-01-30,power outage,1089789726758973440,bebarce,"Power Outage is big on choosing your way and making the decisions that feel right to you. You don't always have to smash a villain when words might work. Heroes know there are more than one to solve a conflict. Take that into your adventures, whether battling villains or dragons. ",2019-01-28 07:38:12+00:00,,
1477,january-end,before,2019-01-30,power outage,1089786693727604736,aloha_royce,"fuuck this power outage, im trynna play some xbox rn ",2019-01-28 07:26:09+00:00,,
1478,january-end,before,2019-01-30,power outage,1089786560940265472,OhhSuzannah,"Had a power outage earlier today. Haven’t been able to get our Apple computer to turn on since then. Thanks, AEP. ",2019-01-28 07:25:38+00:00,,
1479,january-end,before,2019-01-30,power outage,1089783910794489856,poweralertsbot,"Power outage reported at Thika, Kenya.(thika)",2019-01-28 07:15:06+00:00,,
1480,january-end,before,2019-01-30,power outage,1089782965079396352,TasNetworks,Granville harbour outage update. We have begun restoration work. A TasNetworks representative attended the Zeehan community meeting today and shared an update on restoration times. It is estimated that power will be restored on Wednesday. Thanks for your patience.,2019-01-28 07:11:20+00:00,,
1481,january-end,before,2019-01-30,power outage,1089782571955863552,thephuketnews,"Areas to be affected by the power outage, from 9am to 4:30pm this Wednesday, are along Srisoonthorn Rd, from Supalai Hills housing estate to Soi Cherngtalay 1 (opposite Wat Cherng Talay. #Phuket",2019-01-28 07:09:46+00:00,#Phuket,
1482,january-end,before,2019-01-30,power outage,1089782163384487936,masilo_solly,Address the root cause of the power outages in the area for a lasting solution. Schools are affected,2019-01-28 07:08:09+00:00,,
1483,january-end,before,2019-01-30,power outage,1089781628010782720,hashfyre,Hey @NammaBESCOM there's daily power outage for an hour or more in the Domlur / Kodihalli / HAL Stage II area. How are we all ok with this?,2019-01-28 07:06:01+00:00,,
1484,january-end,before,2019-01-30,power outage,1089781550743412736,Breakfastrk,"Good morning! How was your weekend? Great win for Kerry, power outages and nights out! What did you get up to? https://www.facebook.com/kerrys.fullbreakfast/videos/286928971996249/",2019-01-28 07:05:43+00:00,,
1485,january-end,before,2019-01-30,power outage,1089780791343747072,eThekwiniM,"Good day, Our apologies, are you still experiencing power outage? ^mm",2019-01-28 07:02:42+00:00,,
1486,january-end,before,2019-01-30,power outage,1089780589253873664,dkoellerwx,"HIGH WIND WARNING now in effect for all of eastern Nebraska and portions of western Iowa, including the Omaha metro, Lincoln & Nebraska City. Wind gusts of 40 to 60mph are expected this morning as an Arctic front moves through. Scattered power outages and limb damage is possible. ",2019-01-28 07:01:54+00:00,,
1487,january-end,before,2019-01-30,power outage,1089780315047055360,thebadgamingboy,I liked a @YouTube video http://youtu.be/jARPnmoeHhs?a Chuggaaconroy - Power Outage,2019-01-28 07:00:48+00:00,,
1488,january-end,before,2019-01-30,power outage,1089780303906918400,visayanelectric,"(1 of 1) REMINDER: Scheduled power outage tom, Jan. 29, 2019. Time: 10:00 A.M. to 4:00 P.M. (6hrs) Purpose: To facilitate relocation of guy wire. Areas affected: Portion of Mandaue City (Cubacub &amp; Canduman) along Aurelio Alivio, V. Vega &amp; H. Abellana Sts.",2019-01-28 07:00:46+00:00,,
1489,january-end,before,2019-01-30,power outage,1089780011375230976,HannahisBey1,I literally had my coworker drive me home cuz none of my family were answering their phones and I straight up thought they were dEAD only to find out issa power outage eye-,2019-01-28 06:59:36+00:00,,
1490,january-end,before,2019-01-30,power outage,1089779815186452480,clemente_julie,Bitch the whole neighborhood got a power outage and when i turned on my flashlight the first i saw was a damn flying cockroach,2019-01-28 06:58:49+00:00,,
1491,january-end,before,2019-01-30,power outage,1089779802561753089,samsticka,A good reason to keep a landline phone; They aren't affected by power outages. You can still use them. #landlinephonesforever,2019-01-28 06:58:46+00:00,#landlinephonesforever,
1492,january-end,before,2019-01-30,power outage,1089779508058705920,Primevia,Greens leader tells Aussies to ‘toughen up’ in power outage during extreme heat https://startsat60.com/discover/news/greens-leader-richard-di-natale-aussies-toughen-up-victoria-heatwave?pr=f563818d51eeff4bd8ae0d70d3f19141aa2a47dad767e7a4f8d22c39c4a40cc3&amp;utm_campaign=website&amp;utm_source=sendgrid.com&amp;utm_medium=email&amp;fbclid=IwAR0M5wvHvqpNj8fO0TNeexooCUH9PPC4xa5V6pb2ymV4C76YnYGPWYs1n8k,2019-01-28 06:57:36+00:00,,
1493,january-end,before,2019-01-30,power outage,1089779200330997762,alectranews,If you are without power please call 1-877-963-6900 to report your outage ^pa,2019-01-28 06:56:23+00:00,,
1494,january-end,before,2019-01-30,power outage,1089779071511392256,wqad,"More than 1,500 impacted by power outages in Sterling-Rock Falls http://bit.ly/2Ujb63G",2019-01-28 06:55:52+00:00,,
1495,january-end,before,2019-01-30,power outage,1089777871336263680,chrystanna_,What I get for trying to do hw? A freakin power outage pls,2019-01-28 06:51:06+00:00,,
1496,january-end,before,2019-01-30,power outage,1089777862821859328,RSurvivalist,10 Winter Survival Power Outage Tips and Hacks https://goo.gl/fb/j6jAs2,2019-01-28 06:51:04+00:00,,
1497,january-end,before,2019-01-30,power outage,1089777501906317312,Exeter_EMA,Exeter peeps: Happening now. Power outage along 102 corridor. Call @nationalgridus ASAP with your address. @NatGridSafety @TedKresse,2019-01-28 06:49:38+00:00,,
1498,january-end,before,2019-01-30,power outage,1089777363141808128,egimeggo,power outage. it is dark,2019-01-28 06:49:05+00:00,,
1499,january-end,before,2019-01-30,power outage,1089777318229229569,Gregoriancant,The power outages in the #RentLive show apparently aren't far from the truth. Wiring in aging NYC apartments is still reportedly bad. No doubt several fuses blown tonight just watching this on a 82-inch 4K TV in an old brownstone.,2019-01-28 06:48:54+00:00,#RentLive,
1500,january-end,before,2019-01-30,power outage,1089774487011155968,QuantumHawk666,Mortality increases due to heatwaves. Mortality increases due to power outages. She's an ignorant monster wasting tax ,2019-01-28 06:37:39+00:00,,
1501,january-end,before,2019-01-30,power outage,1089773890321162240,Old_Skool_Biker,@CityTshwane Any news or updates on the #poweroutage in Rooihuiskraal?,2019-01-28 06:35:17+00:00,#poweroutage,
1502,january-end,before,2019-01-30,power outage,1089773500967972864,Austin39140404,It's just like the wind storm in December and the power outage affected Burquitlam Station and Lougheed Town Centre Station ,2019-01-28 06:33:44+00:00,,
1503,january-end,before,2019-01-30,power outage,1089773097065041920,mikeschussler,Those who do pay are also likely to become less as services become unaffordable. House sales cannot be completed as outstanding rates complicate sales. Infrastrutue is not fixed or upgraded. Payers get more fustrated by power outages &amp; water shortages 7/10,2019-01-28 06:32:08+00:00,,
1504,january-end,before,2019-01-30,power outage,1089772380111753217,MamaazariaK,@KenyaPower_Care power outages in a few houses in Komarock Sector One Mbuyu Court. Kindly address this asap.,2019-01-28 06:29:17+00:00,,
1505,january-end,before,2019-01-30,power outage,1089772353762951168,simon_colwell,"By the way, would outages such as the weekend's ie due to power station failure, be included in those distributor stats or do they wind up in separate stats ?",2019-01-28 06:29:10+00:00,,
1506,january-end,before,2019-01-30,power outage,1089771965232033794,frijolitajones,why does edison keep doing these power outages at night.... when we.... actually need... electricity....,2019-01-28 06:27:38+00:00,,
1507,january-end,before,2019-01-30,power outage,1089768832774950913,poweralertsbot,"Power outage reported at Utawala Complex, Eastern Bypass, Nairobi, Kenya.(utawala utawala)",2019-01-28 06:15:11+00:00,,
1508,january-end,before,2019-01-30,power outage,1089768817616658432,poweralertsbot,"Power outage reported at Langata Rd, Nairobi, Kenya.(langata road)",2019-01-28 06:15:07+00:00,,
1509,january-end,before,2019-01-30,power outage,1089768641137205248,george_mun,Power outage: Wilderness Heights https://www.georgeherald.com/News/Article/General/power-outage-wilderness-heights-201901231023,2019-01-28 06:14:25+00:00,,
1510,january-end,before,2019-01-30,power outage,1089767929141432320,ElekoreSystems,"Power outage for Metro work in Mumbai, consumers get electricity from alternate source",2019-01-28 06:11:35+00:00,,
1511,january-end,before,2019-01-30,power outage,1089766433897164800,hbailliestrong,What’s the perfect time for a power outage? Dinner time #vector #powercut #hernebay #auckland,2019-01-28 06:05:39+00:00,#vector #powercut #hernebay #auckland,
1512,january-end,before,2019-01-30,power outage,1089766090752884736,a_cupofJoeee,Maybe there will be a power outage at my job &amp; I won’t have to go in ... #WishfulThinking,2019-01-28 06:04:17+00:00,#WishfulThinking,
1513,january-end,before,2019-01-30,power outage,1089765065526530050,poweralertsbot,"Power outage reported at Ruiru, Kenya.(ruiru)",2019-01-28 06:00:13+00:00,,
1514,january-end,before,2019-01-30,power outage,1089764633844609024,Saima1Noman1,"#K_Electric never disappoints customers. We expect the worst from them and they always exceed our expectations. #Power_outages, feeder_trips technical_faults over-billing volatge_fluctuation and surges. You name it, they do it.",2019-01-28 05:58:30+00:00,#K_Electric #Power_outages,
1515,january-end,before,2019-01-30,power outage,1089764170503983104,PeterJev,"@Kadunaelectric the useless manager you appointed in Kafanchan should be sacked with immediate effect. Before he came, I was praising the power supply here on twitter. Only this morning, between 6:30 - 6:54 We had 7 power outages. If him no wan give light make him chop am oshi!",2019-01-28 05:56:39+00:00,,
1516,january-end,before,2019-01-30,power outage,1089763713962323968,JanetMackinnon7,"Love modern technology. Vector has an outages map and there is a black fluffy cloud over our area which translates I guess into, you have stuff all power at the moment.",2019-01-28 05:54:50+00:00,,
1517,january-end,before,2019-01-30,power outage,1089762503486259201,Mhadz42607702,"@bchydro power outage in henderson avenue, coquitlam. How long will the electricity issue resolve?",2019-01-28 05:50:02+00:00,,
1518,january-end,before,2019-01-30,power outage,1089762455612469248,CKNW,"Power outage affecting 1267 customers in Coquitlam (East of Cariboo Road, South of Como Lake Avenue, West of Schoolhouse Street, North of Capilano Way). Currently under investigation. https://bit.ly/2elUe8r",2019-01-28 05:49:50+00:00,,
1519,january-end,before,2019-01-30,power outage,1089762038253899776,KarleyElaine,Power outage due to a care fire on the highway is the most terrifying thing. I hate pitch black darkness. It’s so fucking scary.,2019-01-28 05:48:11+00:00,,
1520,january-end,before,2019-01-30,power outage,1089761986689286144,denomu,"@UmemeLtd Plse stabilize the power at Busabala transformer located at the Primary school near Busabala stage for taxis. Now day 5 of outage yet yaka meters are on. This has been on since last yr with no permanent soln. Only promises of ""we are working on solving the prob..""",2019-01-28 05:47:59+00:00,,
1521,january-end,before,2019-01-30,power outage,1089761039351042048,ThacurmanYT,BC Hydro says there is a large power outage in Coquitlam. It showed all of Braid station in red without power.,2019-01-28 05:44:13+00:00,,
1522,january-end,before,2019-01-30,power outage,1089759208499789824,RobbinSimmons7,Lots of power outages with all the severe weather &amp; a #tornado touched down in #Hialeah,2019-01-28 05:36:56+00:00,#tornado #Hialeah,
1523,january-end,before,2019-01-30,power outage,1089759180972470272,benhur6186,Shoreline power outage sucks! ,2019-01-28 05:36:50+00:00,,
1524,january-end,before,2019-01-30,power outage,1089758645930229760,JVVNLCCare,"#Jaipur_city THERE IS PLANNED POWER OUTAGE FROM 10:00 TO 16:00 AT PANCHWATTI; JAWAHAR NAGAR SEC NO , 4 , MONILACK MARG , VIKLANG SAMITI , R S I B NEAR BY AREA #Maintenance #poweroutage #MondayMorning @navinarora15 @NareshPalGangw2 @VipulSBhardwaj",2019-01-28 05:34:42+00:00,#Jaipur_city #Maintenance #poweroutage #MondayMorning,
1525,january-end,before,2019-01-30,power outage,1089758297886986240,Saima1Noman1,"#Samba_Bank has built a slide on the footpath in fron of #Billys_Towers #Rashid Minhas_Road. This is almost invisible when there is a power outage. I know of at least 4 accidents due to this slide in which people were injured, one sustained an ankle fracture.",2019-01-28 05:33:19+00:00,#Samba_Bank #Billys_Towers #Rashid,
1526,january-end,before,2019-01-30,power outage,1089758243688071169,ReadOakley,You needy hoes only thinkin about how you gonna charge your phone during this power outage..me too tho.,2019-01-28 05:33:06+00:00,,
1527,january-end,before,2019-01-30,power outage,1089758024464396288,JVVNLCCare,"#Jaipur_city THERE IS PLANNED POWER OUTAGE FROM 10:00 TO 17:00 AT SANGANER; SPARSH HOSPITAL , KHATRI NAGAR , KRISHNA NAGAR , AASHIND NAGAR , OXFORD SCHOOL , SHIKARPURA GAV NEAR BY AREA #poweroutage #Maintenance @navinarora15 @NareshPalGangw2 @VipulSBhardwaj #MondayMorning",2019-01-28 05:32:14+00:00,#Jaipur_city #poweroutage #Maintenance #MondayMorning,
1528,january-end,before,2019-01-30,power outage,1089757488155709440,poweralertsbot,"Power outage reported at Kahawa Sukari, Kenya.(kahawa wendani)",2019-01-28 05:30:06+00:00,,
1529,january-end,before,2019-01-30,power outage,1089757443771383809,JVVNLCCare,"#Jaipur_city THERE IS PLANNED POWER OUTAGE FROM 10:00 TO 17:00 AT NIRMAN NAGAR; SHYAM NAGAR , DEVI NAGAR , LAXMAN PATH , RAM PATH , HOTEL RIJENT , HOTEL SHIV NEAR BY AREA #Maintenance #poweroutage @navinarora15 @NareshPalGangw2 @VipulSBhardwaj",2019-01-28 05:29:55+00:00,#Jaipur_city #Maintenance #poweroutage,
1530,january-end,before,2019-01-30,power outage,1089757272979300352,karlawakefield,@bchydro 3 power outages in one day. Any chance the problem will be fixed soon? #power #coquitlam,2019-01-28 05:29:15+00:00,#power #coquitlam,
1531,january-end,before,2019-01-30,power outage,1089757158588133376,scharlyner,@bchydro power outage at Sunset Ave Coquitlam?,2019-01-28 05:28:47+00:00,,
1532,january-end,before,2019-01-30,power outage,1089756586367696897,alechamsports,I had 2 and one was because of a power outage where everyone just bolted before it could come back on,2019-01-28 05:26:31+00:00,,
1533,january-end,before,2019-01-30,power outage,1089756582009724928,JVVNLCCare,"#Jaipur_city THERE IS PLANNED POWER OUTAGE FROM 10:00 TO 17:00 AT NALA POWER HOUSE; KAILASH NAGAR , KUMAWAT COLONY , PREM NAGAR, OM SHIV COLONY, PARIVAHAN NAGAR, JAI BHAWANI COLONY, JHARKHAND MOD , CHINKARA COLONY , GANESH NAGAR , SUSHEELPURA GULABI NAGAR , RATNAPURI NEAR BY AREA",2019-01-28 05:26:30+00:00,#Jaipur_city,
1534,january-end,before,2019-01-30,power outage,1089755515381415936,ItsRaxi3,"In the event of an power outage, Poi makes a good lighting solution! ",2019-01-28 05:22:16+00:00,,
1535,january-end,before,2019-01-30,power outage,1089753534139006976,Leonelflay,Power outage and I'm assume a huge accident :/,2019-01-28 05:14:23+00:00,,
1536,january-end,before,2019-01-30,power outage,1089753224557453313,KwameGilbert,"#renewables By powering essential lifesaving equipment in remote &amp; mobile clinics, &amp; by sustaining hospitals during natural disasters &amp; other power outages, solar energy is saving lives around the world http://bit.ly/2qvEJCb #Renewables4Healthcare",2019-01-28 05:13:10+00:00,#renewables #Renewables4Healthcare,
1537,january-end,before,2019-01-30,power outage,1089753142563082240,1ChainRyderRuss,I was searching for it but I never found it Like an Oreo up in a power outage,2019-01-28 05:12:50+00:00,,
1538,january-end,before,2019-01-30,power outage,1089753004167888896,BarnettGage,"Ideal scenario: Class cancelled tomorrow due to power outage, then snowpocalypse to cancel Tuesday and Wednesday.",2019-01-28 05:12:17+00:00,,
1539,january-end,before,2019-01-30,power outage,1089752428570800128,IRENA,"By powering essential lifesaving equipment in remote & mobile clinics, & by sustaining hospitals during natural disasters & other power outages, solar energy is saving lives around the world http://bit.ly/2qvEJCb #Renewables4Healthcare",2019-01-28 05:10:00+00:00,#Renewables4Healthcare,
1540,january-end,before,2019-01-30,power outage,1089751728772255744,DakotaEC,"Dakota Energy is currently experiencing power blinks due to extreme wind speeds. If you experience an outage, please call 1-800-353-8591. https://www.facebook.com/story.php?story_fbid=1356522274490244&amp;id=137458783063272",2019-01-28 05:07:13+00:00,,
1541,january-end,before,2019-01-30,power outage,1089751692848123904,MyMountainTown,Earlier power outage in Park County for 952 @IREAColorado customers now restored https://mymountaintown.com/forum/46-scanner-emergency-info-weather-forecasts/332720-irea-power-outage-in-park-county-january-27#355599,2019-01-28 05:07:04+00:00,,
1542,january-end,before,2019-01-30,power outage,1089751446478835712,GenpowerSA,Tips on how to survive a power outage: ,2019-01-28 05:06:06+00:00,,
1543,january-end,before,2019-01-30,power outage,1089751147810717696,FreeSpe96276977,"Adam is adamant we should be plunged into darkness. Bandt is a bandit, stealing our prosperity. #poweroutage #Greens",2019-01-28 05:04:54+00:00,#poweroutage #Greens,
1544,january-end,before,2019-01-30,power outage,1089750606825312256,thaReal_Dj_M1,Whitetail resort power outage Jan 25 2019: http://youtu.be/wwBLwffMa6U?a via @YouTube,2019-01-28 05:02:45+00:00,,
1545,january-end,before,2019-01-30,power outage,1089750331724943366,ItsRaxi3,It was a good idea I didn't stream today. My area just sent through it's 4th power outage today.,2019-01-28 05:01:40+00:00,,
