,Event,Stage,Query Date,Query Term,Id,Username,Text,Date,Hashtags,Location
972,january-end,before,2019-01-30,power outage,1090000113886547968,BurlingtonHydro,"To report a power outage, call our trouble line at 1-877-310-4937. If you are looking for updates on an outage in your neighborhood, go to our outage map at: http://outagemaps.burlingtonhydro.com/OutageMap/OutageMap.html",2019-01-28 21:34:13+00:00,,
973,january-end,before,2019-01-30,power outage,1089999881140342789,DomZenga,"Ravens/9ers had two brothers, a power outage, longest return td in SB, a comeback and an intentional safety....",2019-01-28 21:33:17+00:00,,
974,january-end,before,2019-01-30,power outage,1089999738013958144,tjluoma,"A two-second power outage certainly is a good way to quickly identify worn-out U.P.S. batteries. It also screws up the clock on the oven. Other than that, it isn't good for much.",2019-01-28 21:32:43+00:00,,
975,january-end,before,2019-01-30,power outage,1089998795960655873,johnpittma,@MarcWeinbergWX can we expect to see trees down and power outages with these winds?,2019-01-28 21:28:58+00:00,,
976,january-end,before,2019-01-30,power outage,1089998173051981825,RentCompass,Be prepared for power outages. Essential Items for a Household Emergency Kit ,2019-01-28 21:26:30+00:00,,
977,january-end,before,2019-01-30,power outage,1089997723367923712,accnews,"Due to a mechanical issue resulting from the power outage, all night classes for January 28 in the Science Building S have been cancelled.",2019-01-28 21:24:43+00:00,,
978,january-end,before,2019-01-30,power outage,1089996997262786567,CHawkk,"Gusty winds cause brief power outage affecting about 2,000 Lawrence customers ",2019-01-28 21:21:49+00:00,,
979,january-end,before,2019-01-30,power outage,1089996812528902144,oursoutheastern,"Tonight’s MLK Memorial March and Program will be held as scheduled at 6 pm, starting at the Pennington Center and ending at University Center Room 133. All other South Campus activities are cancelled due to power outage. ",2019-01-28 21:21:05+00:00,,
980,january-end,before,2019-01-30,power outage,1089996541413208064,MythjaeComics,"CHICAGO FRIENDS: please make sure you have candles and matches, flashlights with working batteries, spare blankets, and a few meals worth of food that doesn't need to be refrigerated or cooked in case of power outages!",2019-01-28 21:20:01+00:00,,
981,january-end,before,2019-01-30,power outage,1089996538464456704,PUD3,"There's a power outage along Cloquallum Road from Wivell Road and Badger Lane to the Lost Lake area. The outage includes Gallagher Road and nearby roadways. 158 customers are affected. For the latest information, check PUD 3's online map: ",2019-01-28 21:20:00+00:00,,
982,january-end,before,2019-01-30,power outage,1089996364182970368,SCE,"Hi there, we're sorry to hear that your power is out. Please visit http://www.sce.com/outage and report your outage address to get text, email or voicemail updates as they happen. Thanks.",2019-01-28 21:19:19+00:00,,
983,january-end,before,2019-01-30,power outage,1089996332624998401,WinnetkaPolice,"Hi @johnfkurtz - sorry to hear about your power last night. Remember, this page is not monitored 24/7, so call our Water and Electric department to report outages at 847-501-2531. Thanks!",2019-01-28 21:19:11+00:00,,
984,january-end,before,2019-01-30,power outage,1089996115607502850,WinnetkaPolice,"Sorry to hear about your power outage and we're glad it came back quickly. Remember, this page is not monitored 24/7, so if that happens again, contact the Water &amp; Electric department at 847-501-2531 to report an outage. Thanks!",2019-01-28 21:18:19+00:00,,
985,january-end,before,2019-01-30,power outage,1089995855476736000,losergod_,I was at work at Cate Street and an eighteen wheeler took out a light pole so that’s why there was a power outage in Downtown Hammond a few weeks ago. sorry to be a party pooper ,2019-01-28 21:17:17+00:00,,
986,january-end,before,2019-01-30,power outage,1089995783926153216,KXCVKRNW,Power outages due to damaging high winds http://www.kxcv.org/news/2019/01/power-outages-due-to-damaging-high-winds.htm#.XE9xSWaK8e4.twitter via @KXCVKRNW,2019-01-28 21:17:00+00:00,,
987,january-end,before,2019-01-30,power outage,1089995668595400705,SGVCityWatch,Power Outage Reported in Diamond Bar http://www.sgvcitywatch.com/diamond-bar/power-outage-reported-in-diamond-bar,2019-01-28 21:16:33+00:00,,
988,january-end,before,2019-01-30,power outage,1089995106726207488,PixelbyPixelStu,I wonder if this has anything to do with the power outage??? Sorry Dev Day was cut short but there is always tomorrow! See y'all Tuesday! #marblesonstream #weather #snow #delayed #poweroutage #Alwaysanotherday,2019-01-28 21:14:19+00:00,#marblesonstream #weather #snow #delayed #poweroutage #Alwaysanotherday,
989,january-end,before,2019-01-30,power outage,1089993305578921984,Brotund,yeah the reality is 10x as lame. First time I heard it they were pigging gas lines for a power plant outage and my mind went places.,2019-01-28 21:07:09+00:00,,
990,january-end,before,2019-01-30,power outage,1089992763452448768,SkyNewsAust,.@CraigKellyMP has blamed the Victorian government's reliance on renewable energy for power outages which left hundreds of thousands of people without electricity last week. https://bit.ly/2MJmFih,2019-01-28 21:05:00+00:00,,
991,january-end,before,2019-01-30,power outage,1089992759497408516,HomeProsRadio,Protect your home from power outages. The Home Pros tell you how... ,2019-01-28 21:04:59+00:00,,
992,january-end,before,2019-01-30,power outage,1089992578110353408,AndrewChouDB,POWER OUTAGE: Widespread power outage in area near Grand Avenue and Longview Drive intersection. Nearby homes and intersection traffic lights affect. Please travel with caution. Edison working to identify cause and restore power. ,2019-01-28 21:04:16+00:00,,
993,january-end,before,2019-01-30,power outage,1089992547768983553,RobertVorlon1,"A salesman was stranded in a small town due to a power outage. He wired his boss: ""I don't know when I'll be able to get out of here. It might take weeks."" The head man immediately replied, ""As of today, you start your two weeks vacation.""...Myron Cohen ""vinter"" (winter)",2019-01-28 21:04:09+00:00,,
994,january-end,before,2019-01-30,power outage,1089992263609053185,BridgeMAXX_ISP,"We are currently experiencing an outage due to a power issue. Customers on our Kassens, Chambers and Jackson sites in union county are affected by this.",2019-01-28 21:03:01+00:00,,
995,january-end,before,2019-01-30,power outage,1089991795109490691,HabershamEMC,"When temperatures drop and winter storms hit, snow and ice can lead to downed power lines. During a power outage, HEMC crews will work as quickly and as safely as possible to restore your power. Find important Power Line Safety at http://www.habershamemc.com/content/safety",2019-01-28 21:01:09+00:00,,
996,january-end,before,2019-01-30,power outage,1089991628192911360,KinstonPublServ,We are experiencing a power outage at Emerson &amp; Cambridge due to a vehicle accident involving a utility pole &amp; downed lines. Customers are expected to be without power for approx 3 hrs. Please call our Customer Service Center at 252-939-3282 for more info or to report your outage,2019-01-28 21:00:29+00:00,,
997,january-end,before,2019-01-30,power outage,1089991564699582464,napcpro,The worst heatwave ever recorded in southern Australia could force extended power outages across the region. Is this what's coming as climate change gets worse? https://buff.ly/2S9qYbK,2019-01-28 21:00:14+00:00,,
998,january-end,before,2019-01-30,power outage,1089991289033183232,JMartinn_9,All the 90’s kids went outside during the power outage ,2019-01-28 20:59:09+00:00,,
999,january-end,before,2019-01-30,power outage,1089991172188266496,Dalek_Trump,IN ROCHESTER WE HAD MULTIPLE POWER OUTAGES! I THINK YOU JUST DREW THE SHORT STRAW,2019-01-28 20:58:41+00:00,,
1000,january-end,before,2019-01-30,power outage,1089991003354869760,MLGW,"#MLGW troubleshooters are determining repairs needed to restore power in the Germantown area this afternoon. Please call MLGW's Electric Outage Hotline 544-6500 to report outages. Remember, you cannot report outages via social media. ",2019-01-28 20:58:00+00:00,#MLGW,
1001,january-end,before,2019-01-30,power outage,1089989929227104256,DiamondBarCity,POWER OUTAGE: Widespread power outage in area near Grand Avenue and Longview Drive intersection. Nearby homes and intersection traffic lights affect. Please travel with caution. Edison working to identify cause and restore power.,2019-01-28 20:53:44+00:00,,
1002,january-end,before,2019-01-30,power outage,1089989772691558403,PackKnives,"This PYK episode is in memory of the beloved @cheffati: Our intro/outro for Fati Party Boat Wars recap Eddie’s draft debacle Power outage conspiracy?! Is a dumpling a potsticker is a gyoza? Subscribe, tell your pals at the dinner table: ",2019-01-28 20:53:07+00:00,,
1003,january-end,before,2019-01-30,power outage,1089989403936604160,karin_lunsford,@DiamondBarCity not commenting on the power outage to 2093 homes right now?,2019-01-28 20:51:39+00:00,,
1004,january-end,before,2019-01-30,power outage,1089988230030725120,hamlet_court,Dramatic power outage in #HamletCourtRoad #Westcliff affected numerous businesses including major employer @ENS_Recruitment. @UKPowerNetworks must support the business community and fix the dodgy cable @SouthendBC,2019-01-28 20:46:59+00:00,#HamletCourtRoad #Westcliff,
1005,january-end,before,2019-01-30,power outage,1089987908331700224,SCE,"Hi there, we're sorry we missed your message and to learn you were without power. In the future, you can report your outage and sign up to get text, email or voicemail updates as they happen on our site http://sce.com/outage. Thank you.",2019-01-28 20:45:42+00:00,,
1006,january-end,before,2019-01-30,power outage,1089987741713158145,kisoroair,"Three students and a police officer died in southeastern Democratic Republic of Congo during weekend clashes at a protest over water and power outages, according to an updated death toll by the... https://kisorofm.com/2019/four-dead-in-student-protests-in-drc-presidency/",2019-01-28 20:45:03+00:00,,
1007,january-end,before,2019-01-30,power outage,1089987503061389312,wfiwradio,Customers in the Cisne area reporting a power outage as over 400 are affected. This is according to the power outage map on Ameren's website. https://outagemap.ameren.com/ https://outagemap.ameren.com/,2019-01-28 20:44:06+00:00,,
1008,january-end,before,2019-01-30,power outage,1089987498028220417,UmemeLtd,Sorry for the power outage John. Kindly inbox us you location details for clarification. HA,2019-01-28 20:44:05+00:00,,
1009,january-end,before,2019-01-30,power outage,1089986615341129728,MasonBordelon,Clutch power outage cancelled class ,2019-01-28 20:40:34+00:00,,
1010,january-end,before,2019-01-30,power outage,1089983962527744006,FOX8NOLA,Southeastern South campus closed due to power outage ,2019-01-28 20:30:02+00:00,,
1011,january-end,before,2019-01-30,power outage,1089983957851127809,AEPenergy,"You have questions, we have answers! From power outages to accessing your online account, you can find information on a variety of topics on our small business FAQ page. http://ms.spr.ly/6019T8J0U",2019-01-28 20:30:01+00:00,,
1012,january-end,before,2019-01-30,power outage,1089983007002382338,BrightonAmb,"Do you, a loved one, a neighbor, or a friend depend on electricity? On a Ventilator an Oxygen Concentrator or has a VAD? If we know, we can and will check on you during severe weather, power outages, or anything like that. Please, message our page and let us know. #brightonny",2019-01-28 20:26:14+00:00,#brightonny,
1013,january-end,before,2019-01-30,power outage,1089982810654474242,KETV,Strong wind gusts cause early morning power outages http://bit.ly/2UifgJc,2019-01-28 20:25:27+00:00,,
1014,january-end,before,2019-01-30,power outage,1089982566994771969,DerekStoughton,"Southeastern Louisiana University is closed for the remainder of the day, due to a power outage across campus and in Hammond. We will continue to monitor the situation, as well as the winter weather coming in tonight and let everyone know the status of classes tomorrow.",2019-01-28 20:24:29+00:00,,
1015,january-end,before,2019-01-30,power outage,1089982262509297664,goldenjung9497,"And again Minho controls lightning/electricity, he likes overloading circuit boards and causing power outages or just shocks people who piss him off (but not lethally, he knows what amount of electricity is deadly and what's survivable)",2019-01-28 20:23:16+00:00,,
1016,january-end,before,2019-01-30,power outage,1089981975174266885,vincentoliver76,@OPPDCares Any updates in the power outages? If it is not going to be restored by tonight the public should know so arrangements can be made to keep warm aka hotel or family or shelter. @lvgddgrlh,2019-01-28 20:22:08+00:00,,
1017,january-end,before,2019-01-30,power outage,1089981801769172992,_beewil,Hammond and the power outages gotta chill.,2019-01-28 20:21:27+00:00,,
1018,january-end,before,2019-01-30,power outage,1089981222321704960,NoofieN,Must be a power outage to drag that many away from the x box. This was commonplace in the 60's n 70's,2019-01-28 20:19:08+00:00,,
1019,january-end,before,2019-01-30,power outage,1089981190994624512,A_Melikishvili,"1/5 Superbly detailed report by @RTavisupleba on catastrophic state of power supply in #Georgia's breakaway region of #Abkhazia. Low voltage, constant electricity outages, explosions at power stations and on high-voltage power lines - all of this has become routine there.",2019-01-28 20:19:01+00:00,#Georgia #Abkhazia,
1020,january-end,before,2019-01-30,power outage,1089980789092163584,kateblackwel,Literally no one: Hammond: *power outages weekly*,2019-01-28 20:17:25+00:00,,
1021,january-end,before,2019-01-30,power outage,1089980471101063168,raysivley,Just had a power outage 2512 Hwy 20 west..... ,2019-01-28 20:16:09+00:00,,
1022,january-end,before,2019-01-30,power outage,1089980359222136845,TrislerE23,"Sitting here waiting like the pics gonna load, but then realizing we had a power outage ",2019-01-28 20:15:43+00:00,,
1023,january-end,before,2019-01-30,power outage,1089979463864066053,oshawapower,"Hi, power outages do not normally affect cell phone tower operations/service or landlines. If you have an outage and would like to report it, you can call us, message us on social media, or email us. You can also check our outage map for outage status. ",2019-01-28 20:12:09+00:00,,
1024,january-end,before,2019-01-30,power outage,1089978930914836480,famsarmer,we love a curry power outage,2019-01-28 20:10:02+00:00,,
1025,january-end,before,2019-01-30,power outage,1089978689792679942,DelibertoJacob,Update: Definitely not mad about the recent power outages in Hammond. ,2019-01-28 20:09:05+00:00,,
1026,january-end,before,2019-01-30,power outage,1089978658431950853,trucommsltd,HEAVY snow is set to hit Greater Manchester and could cause transport chaos and power outages https://www.manchestereveningnews.co.uk/news/greater-manchester-news/heavy-snow-set-hit-greater-15744076,2019-01-28 20:08:57+00:00,,
1027,january-end,before,2019-01-30,power outage,1089978655806246913,kaitrucommsltd,HEAVY snow is set to hit Greater Manchester and could cause transport chaos and power outages https://www.manchestereveningnews.co.uk/news/greater-manchester-news/heavy-snow-set-hit-greater-15744076,2019-01-28 20:08:57+00:00,,
1028,january-end,before,2019-01-30,power outage,1089978563548327938,sfiwy,Looking at outfits for #RatedRnB3 like we not having a whole power outage rn ,2019-01-28 20:08:35+00:00,#RatedRnB3,
1029,january-end,before,2019-01-30,power outage,1089978166825734144,CarGenerator1,"Power outs happen. For those who haven’t kept their fridge running during a power outage with #CarGenerator we’ve created a little cheat sheet to help you keep your food fresh longer, plan meals accordingly, and save some money. #frugal #foodsafety",2019-01-28 20:07:00+00:00,#CarGenerator #frugal #foodsafety,
1030,january-end,before,2019-01-30,power outage,1089977690898149376,WKBN,East Liverpool to open warming centers in case of power outages http://dlvr.it/QxgnmY,2019-01-28 20:05:06+00:00,,
1031,january-end,before,2019-01-30,power outage,1089977007285268480,TimandTomNFL,"Unless there is a power outage, this is happening!!",2019-01-28 20:02:23+00:00,,
1032,january-end,before,2019-01-30,power outage,1089976848489025536,BreathingDelhi,RT @kierans777: Happy new year to the unhinged Murdoch rags. Still figuring out how to blame power outages on #RenewableEnergy @simonahac #…,2019-01-28 20:01:46+00:00,#RenewableEnergy,
1033,january-end,before,2019-01-30,power outage,1089976724945858560,medicinehatcity,*PLEASE BE ADVISED* For approximately the next 4 weeks (weather dependent) City #medhat Electric Utility are trimming trees in the Crestwood area of the city and in Dunmore @CypressCounty Trees are trimmed on a regular basis to prevent fallen branches from causing power outages. ,2019-01-28 20:01:16+00:00,#medhat,
1034,january-end,before,2019-01-30,power outage,1089976546704719872,JohnCroman,Yes.. Kansas ice storms could be wicked at times.. widespread power outages and trees trashed.. not to mention skating rink highways,2019-01-28 20:00:34+00:00,,
1035,january-end,before,2019-01-30,power outage,1089976527712935937,MiddleEastMnt,Power outage hits #Sudan,2019-01-28 20:00:29+00:00,#Sudan,
1036,january-end,before,2019-01-30,power outage,1089976422532349953,tecyyc,"At The Electrical Connection, we understand that without electricity life will not be the same so during a power outage we always help our clients so that they remain safe and sane. To learn about what not to do during a power outage, read this article. https://goo.gl/Yo94tn",2019-01-28 20:00:04+00:00,,
1037,january-end,before,2019-01-30,power outage,1089976401569161217,buttwadd,if there’s gonna b a power outage at work can it b before i go in so i don’t waste my time. i already waste enough time on men as it is. don’t need more time wasted. thx,2019-01-28 19:59:59+00:00,,
1038,january-end,before,2019-01-30,power outage,1089976099239530497,ladiladi777,Game was abandon cos of power outage.....lol,2019-01-28 19:58:47+00:00,,
1039,january-end,before,2019-01-30,power outage,1089975629125173250,SCE,"Hi Robert, we're sorry we missed your message and to learn you were without power. In the future, you can report your outage and sign up to get text, email or voicemail updates as they happen on our site http://sce.com/outage. Thank you.",2019-01-28 19:56:55+00:00,,
1040,january-end,before,2019-01-30,power outage,1089975400598568966,itstylerlife,this power outage was cool until the dorms lost power too,2019-01-28 19:56:00+00:00,,
1041,january-end,before,2019-01-30,power outage,1089975172814290947,HassenDebwan,"Before the Saudi grant to Yemen It has recorded 153 deaths cases from June 2016 to June 2018 as a result of power outages especially in the hot areas. Those cases were mostly children ,the elderly and those have suffered from chronic diseases Renal failure #السعودية_تنير_اليمن",2019-01-28 19:55:06+00:00,,
1042,january-end,before,2019-01-30,power outage,1089974869972971520,LJWorld,"Power is now restored, @WestarEnergy says. The outage was caused by gusty winds: ",2019-01-28 19:53:54+00:00,,
1043,january-end,before,2019-01-30,power outage,1089974656789028865,TheeJordanYoung,How tf u have a power outage on a college campus only southeastern,2019-01-28 19:53:03+00:00,,
1044,january-end,before,2019-01-30,power outage,1089974117644800002,GwinnettCitizen,"Georgia Power encourages safety, preparedness as winter weather approaches Company offers tips and outage resources for customers ATLANTA – Jan. 28, 2019– As North and Central Georgia brace for the arrival of winter weather over the next 36... http://www.georgiapower.com/storm",2019-01-28 19:50:55+00:00,,
1045,january-end,before,2019-01-30,power outage,1089974070458892289,MatoroIgnika,And for the first time every. I have had classes cancelled due to a power outage. lol,2019-01-28 19:50:43+00:00,,
1046,january-end,before,2019-01-30,power outage,1089973708620480512,hkreutzer98,"Power outage hammond wide, classes cancelled ",2019-01-28 19:49:17+00:00,,
1047,january-end,before,2019-01-30,power outage,1089972798263574530,bcsboe,"Also, please check on your neighbors and the elderly if power outages should occur.",2019-01-28 19:45:40+00:00,,
1048,january-end,before,2019-01-30,power outage,1089971652329459712,andreholmes83,"@CityPowerJhb Dear Andre, your City Power call ref is CPWEB2394159 please assist with wilropark power outage",2019-01-28 19:41:07+00:00,,
1049,january-end,before,2019-01-30,power outage,1089971639855603714,pearlgarden861,What about power outages?,2019-01-28 19:41:04+00:00,,
1050,january-end,before,2019-01-30,power outage,1089971521559425025,deryn_faith24,First full week of classes and of course we have a power outage... Happy Monday Yall!,2019-01-28 19:40:36+00:00,,
1051,january-end,before,2019-01-30,power outage,1089971362276540417,GaybrielleMarie,"Alright this power outage starting to blow me now, my phone dying ",2019-01-28 19:39:58+00:00,,
1052,january-end,before,2019-01-30,power outage,1089971170865164289,WhosFibbing,Looks like Germany will be in for some serious power outages in the next few years!!!!,2019-01-28 19:39:12+00:00,,
1053,january-end,before,2019-01-30,power outage,1089970440636903426,mommyoftwoMandA,"@CityPowerJhb power outage in Roodekrans, Paranomus Crescent. How long will it be out for",2019-01-28 19:36:18+00:00,,
1054,january-end,before,2019-01-30,power outage,1089970131906703363,OPEInstitute,"31 states are under advisories and alerts for snow, wind—and some of the coldest temperatures in decades. Be prepared for snow and power outages - make sure you know how to use your outdoor power equipment correctly. Tips at http://ow.ly/ShDM30ntPcj",2019-01-28 19:35:04+00:00,,
1055,january-end,before,2019-01-30,power outage,1089969673804935168,HawaiiNewsNow,Crews continue making repairs to utility pole that caused widespread power outage in Foster Village http://bit.ly/2HCEQHq #HNN,2019-01-28 19:33:15+00:00,#HNN,
1056,january-end,before,2019-01-30,power outage,1089969532830171136,LJWorld,"About 2,000 Westar customers in Lawrence, including some schools, were affected by a power outage early this afternoon: https://ljw.bz/2sPQX9J",2019-01-28 19:32:41+00:00,,
1057,january-end,before,2019-01-30,power outage,1089969137680637952,NJPW_Canada,I only just noticed about 20 minutes ago there was anew BTE.. and I am at work.. really hoping for some sort of power outage or other craziness happens so I can go home and watch this,2019-01-28 19:31:07+00:00,,
1058,january-end,before,2019-01-30,power outage,1089968704790642689,PNMtalk,#Deming outage update: Power has been restored to all customers. The outage was caused by a bird. Thank you for your patience.,2019-01-28 19:29:24+00:00,#Deming,
1059,january-end,before,2019-01-30,power outage,1089967728528711686,JenniferWaymire,Lots of places on a power outage right now. https://www.facebook.com/100000485202518/posts/2974968875862590/,2019-01-28 19:25:31+00:00,,
1060,january-end,before,2019-01-30,power outage,1089966535010004992,JoelWing2,Now that Baghdad is mostly secure its residents are enjoying night life and other aspects but dealing with probs like never ending traffic power outages lack of jobs https://www.latimes.com/world/middleeast/la-fg-iraq-baghdad-revival-20190127-story.html,2019-01-28 19:20:47+00:00,,
1061,january-end,before,2019-01-30,power outage,1089966287575543810,MDMEMA,"MEMA Alert: Potential hazardous winter weather this week. Rain/snow mix during Tuesday afternoon changing to accumulating snow which may affect the evening's commute. Then: frigid temperatures Wednesday-Thursday, with strong wind gusts & potential power outages. #MdWx #MdPrepares",2019-01-28 19:19:48+00:00,#MdWx #MdPrepares,
1062,january-end,before,2019-01-30,power outage,1089965486216044546,AmyMacKinnon,Lately I’ve been thinking about the state of US power grids and that massive power outage that hit the northeast in 2003. ,2019-01-28 19:16:37+00:00,,
1063,january-end,before,2019-01-30,power outage,1089965286051196928,edu4drr,#Havana: rare #tornado rips through Cuban capital leaving three dead and causing power outages. #TornadoEnLaHabana,2019-01-28 19:15:49+00:00,#Havana #tornado #TornadoEnLaHabana,
1064,january-end,before,2019-01-30,power outage,1089965182644899842,WEHTWTVWlocal,"10 years ago, the 2009 ice storm caused power outages, fallen trees, and hundreds of millions of dollars in damage ",2019-01-28 19:15:24+00:00,,
1065,january-end,before,2019-01-30,power outage,1089965166249365504,Whitehouse1864,Extreme Temperature Weather Preparation - Warming Centers provided if there is a power outage. Please call 911 for information and read further info here: https://mailchi.mp/whitehouseoh/extreme-temperature-weather-preparation,2019-01-28 19:15:20+00:00,,
1066,january-end,before,2019-01-30,power outage,1089964780738306048,tyratbanks,Selu need to get it together first dorms flooding now a power outage !! ,2019-01-28 19:13:48+00:00,,
1067,january-end,before,2019-01-30,power outage,1089964309470474242,WinkSupport,I just have a few questions for you. 1. How far is the Wink Hub from your router and any WiFi extenders? 2. What is the make and model of your router? 3. Has anything changed? Or were there any power outages? 4. What is the email address for Wink? Let us know,2019-01-28 19:11:56+00:00,,
