,Event,Stage,Query Date,Query Term,Id,Username,Text,Date,Hashtags,Location
1008,july-end,before,2019-06-30,power outage,1144735582813339650,PetraGuasti,"Cordon Sanitaire: after AfD reservation was rejected or canceled in numerous hotels in Germany, the RR party booked in neighboring Poland. Now @RadissonBlu in #Szczecin has a 'power outage' and canceled too. @kai_arzheimer @LBustikova",2019-06-28 22:33:25+00:00,#Szczecin,
1009,july-end,before,2019-06-30,power outage,1144735290021388288,CityofRedDeer,We are hearing reports of a power outage affecting parts of Normandeau. This is unrelated to the scheduled outage for maintenance work. We are working to restore power as soon as possible. http://www.reddeer.ca/city-services/electric-light-and-power/if--your-power-is-out/,2019-06-28 22:32:15+00:00,,
1010,july-end,before,2019-06-30,power outage,1144735210187239426,HicksBioHealth,Fuel backup was caused by power outage at Bayway Refinery in Linden | http://NJ.com http://unitiontuition.com/MfAyYbc1,2019-06-28 22:31:56+00:00,,
1011,july-end,before,2019-06-30,power outage,1144734688503914497,brunkem61,"Power outage in Parkhurst, @CityPowerJhb not answering their phones ",2019-06-28 22:29:52+00:00,,
1012,july-end,before,2019-06-30,power outage,1144733911727165440,MirdBird,We love having power outages at work. ,2019-06-28 22:26:47+00:00,,
1013,july-end,before,2019-06-30,power outage,1144733624421498880,morgyyyg,Power is out &amp; Entergy’s outage viewer is not in service and I just got a text saying my power will be restored tomorrow at 2pm. My laptop is dead and my phone is at 7% on a random portable charger I found from football season. So ~like~ who’s tryna happy hour?,2019-06-28 22:25:38+00:00,,
1014,july-end,before,2019-06-30,power outage,1144732778409234432,iembot_lsx,"At 4:46 PM CDT, 2 NE Wildwood [St. Louis Co, MO] PUBLIC reports TSTM WND DMG. CORRECTS PREVIOUS TSTM WND DMG REPORT FROM 2 NE WILDWOOD. REPORTED AT CLAYTON RD AND 109: POWER OUTAGES REPORTED DUE TO DOWNED LINES. https://mesonet.agron.iastate.edu/lsr/#LSX/201906282146/201906282146",2019-06-28 22:22:17+00:00,,
1015,july-end,before,2019-06-30,power outage,1144732514226987008,SPECIALK3663,Power outage http://klone-fb.vapp-servers.com/klonefb/story?object=article&amp;lang=en&amp;id=Q_DNS2019_PART_1_04&amp;title=Power+outage&amp;image=%2F%2Fvizorfb-a.akamaihd.net%2Fklonefb-res%2Fmissions%2Fq_dns_2019_part_1_4.png&amp;description=The+backup+generator+started+humming+quietly%2C+yet+the+festive+lights+didn%27t+turn+on.&amp;post_type=quest,2019-06-28 22:21:14+00:00,,
1016,july-end,before,2019-06-30,power outage,1144731542096240640,acarboni,Super dope power outage. Back online in a min,2019-06-28 22:17:22+00:00,,
1017,july-end,before,2019-06-30,power outage,1144731524165771264,WLAFNEWS,"... WLAF power outage update: As of 6 pm Friday, only 45 LUB customers remain without power.",2019-06-28 22:17:18+00:00,,
1018,july-end,before,2019-06-30,power outage,1144730889936691201,JohnLembo1878,"Haha! Taking my 6-year-old. He handles the 1 p.m. starts better than 4:10. Leave me a T at will call. :-) BTW - been to four games this year and have experienced two power outages at the Trop. That being said, it gets a bad rap. Not a bad place to see a game.",2019-06-28 22:14:46+00:00,,
1019,july-end,before,2019-06-30,power outage,1144730427308965888,iembot_lsx,"At 5:12 PM CDT, 2 NE Wildwood [St. Louis Co, MO] PUBLIC reports TSTM WND DMG. REPORTED AT CLAYTON RD AND 109: POWER OUTAGES REPORTED DUE TO DOWNED LINES. https://mesonet.agron.iastate.edu/lsr/#LSX/201906282212/201906282212",2019-06-28 22:12:56+00:00,,
1020,july-end,before,2019-06-30,power outage,1144730348586242050,DicksonElectric,OUTAGE UPDATE: (And it's not great news. ) The estimated time to replace the pole that was hit by a car on PETTY RD. + make the necessary repairs to our equipment will be 4-5 hours. We know it's hot and will work as quickly and safely as possible to get to get power restored. ,2019-06-28 22:12:37+00:00,,
1021,july-end,before,2019-06-30,power outage,1144730270542761984,JayxJJxx,Issa power outage cashapp me or buy some nudes to make me feel better ,2019-06-28 22:12:19+00:00,,
1022,july-end,before,2019-06-30,power outage,1144730035091382273,It_BeLike_That,Mannn it’s too hot for this power outage,2019-06-28 22:11:23+00:00,,
1023,july-end,before,2019-06-30,power outage,1144730015495524352,PrincessArylin,There's nothing like a power outage due to sudden extreme weather to kill your good mood... Especially when streaming. ,2019-06-28 22:11:18+00:00,,
1024,july-end,before,2019-06-30,power outage,1144729756514050049,NewsClads,"Power outages, road closures as severe weather hits capital area https://newsclads.com/power-outages-road-closures-as-severe-weather-hits-capital-area/",2019-06-28 22:10:16+00:00,,
1025,july-end,before,2019-06-30,power outage,1144729372072599552,chrisfrink,@Entergy Quality: power's out AND so is your outage viewer. Keep up the good work,2019-06-28 22:08:45+00:00,,
1026,july-end,before,2019-06-30,power outage,1144729279655305216,Flabbergast2017,Not true. There were residents that had damaged from trees. It was in that article. And yes there's also the daycare that affected parents being able to go to work and there were power outages. He said nothing about it.,2019-06-28 22:08:22+00:00,,
1027,july-end,before,2019-06-30,power outage,1144729235820621824,NooniestShannon,"@DTE_Energy power outage at my location in Augusta Twp MI, and it’s not showing up as an area affected with an outage.",2019-06-28 22:08:12+00:00,,
1028,july-end,before,2019-06-30,power outage,1144728921935683585,King_WeiserTV,"Thanks for hanging out everyone power outage, unfortunately gonna call it there. See me Monday for more Skyrim!",2019-06-28 22:06:57+00:00,,
1029,july-end,before,2019-06-30,power outage,1144728705077600259,KTVN,NV Energy is reporting a power outage in Douglas County that is affecting over 200 customers. http://bit.ly/2XB7eR4,2019-06-28 22:06:05+00:00,,
1030,july-end,before,2019-06-30,power outage,1144728031401054210,EntergyLA,"Severe weather is making its way through the south east region of Louisiana this afternoon packing intense lightning, strong winds and heavy rainfall. We have sporadic outages across our service territory. Do you know how to keep in touch with us if your power is out? ",2019-06-28 22:03:25+00:00,,
1031,july-end,before,2019-06-30,power outage,1144727677183680514,Amica,Dangerous #lightning and power outages can accompany #summer storms. Here are some safety tips from our Amica #StormCenter: http://spr.ly/6014ES6Se. #lightningsafety,2019-06-28 22:02:00+00:00,#lightning #summer #StormCenter #lightningsafety,
1032,july-end,before,2019-06-30,power outage,1144727332009185280,medicinehatcity,"City #medhat Electric Utility reminds residents not to pile debris or snow - nor to landscape around any utility power boxes located on your property. In an emergency power outage, crews must be able to locate and access the unit as quickly as possible if required. ",2019-06-28 22:00:38+00:00,#medhat,
1033,july-end,before,2019-06-30,power outage,1144726574253662209,TnOrthopedics,Our Sevierville Quick Care Ortho location is closed for the rest of the evening due to power outages! **The Parkwest location is still open until 8pm.,2019-06-28 21:57:37+00:00,,
1034,july-end,before,2019-06-30,power outage,1144726507388067840,Abzz_6,I’ve lost 3 games in #Madden today due to power outages. 2 of my opponents messaged me calling me a scrub and a quitter. I wait...for my redemption. #DTE ,2019-06-28 21:57:22+00:00,#Madden #DTE,
1035,july-end,before,2019-06-30,power outage,1144725789880934400,cbcDougDirks,"Fierce thunderstorm Thursday night floods parts of Calgary, dumps up to 70 mm of rain, triggers power outages in several neighbourhoods | CBC News https://www.cbc.ca/news/canada/calgary/flash-floods-are-shutting-down-a-number-of-intersections-in-calgary-1.5193566?__vfz=medium%3Dsharebar @CBCHomestretch @nenshi",2019-06-28 21:54:30+00:00,,
1036,july-end,before,2019-06-30,power outage,1144725606602616832,NickieNicole22,...annnnd power outage,2019-06-28 21:53:47+00:00,,
1037,july-end,before,2019-06-30,power outage,1144725515791667205,joseayalaxc,my jobs calling me in bc there’s a power outage what that got to do w me ,2019-06-28 21:53:25+00:00,,
1038,july-end,before,2019-06-30,power outage,1144725201608937472,DanielleUliano,Already lost power at my place - gusty winds &amp; lightning have caused thousands of power outages this evening! ,2019-06-28 21:52:10+00:00,,
1039,july-end,before,2019-06-30,power outage,1144725174106972160,InnovativeWx,"06/28/5pm - This was the view from inside and outside the office about this time yesterday. Widespread 50-60 mph winds, power outages and trees down. This evening looks much better with only an isolated storm chance this time. Saturday looks dry and mild, storms late Sun. ",2019-06-28 21:52:04+00:00,,
1040,july-end,before,2019-06-30,power outage,1144724866207244288,HotSacve,Stream went under do to power outage. All good now. Starting the stream up again in about 30 mins,2019-06-28 21:50:50+00:00,,
1041,july-end,before,2019-06-30,power outage,1144724725198966785,ChadSabadie,Thousands of Power Outages this afternoon: https://www.brproud.com/weather/thousands-without-power-following-friday-storms/ #lawx @KSBTRWeatherNOW @DanielleUliano,2019-06-28 21:50:17+00:00,#lawx,
1042,july-end,before,2019-06-30,power outage,1144724412186234881,case_closed_abq,Downed Power Poles cause Power Outages. 6/26/19 @1530 hrs https://caseclosed.world/t/downed-power-poles-cause-power-outages-6-26-19-1530-hrs/676?u=jenny1,2019-06-28 21:49:02+00:00,,
1043,july-end,before,2019-06-30,power outage,1144724309316919296,hastingsutil,"power outage on South B street, So Ceder Rhode Island Has been restored.",2019-06-28 21:48:37+00:00,,
1044,july-end,before,2019-06-30,power outage,1144723575577952257,J_Green_505,Lost power about 15 min ago. Part of widespread outage after a powerful thunderstorm wind gust front came through the area. ,2019-06-28 21:45:43+00:00,,
1045,july-end,before,2019-06-30,power outage,1144722926970818561,jaonaforever,2nd Power Outage at work. ,2019-06-28 21:43:08+00:00,,
1046,july-end,before,2019-06-30,power outage,1144722656949866497,This_Is_KevinM,"Mina I’m glad we had a power outage... because wow, what a joke",2019-06-28 21:42:03+00:00,,
1047,july-end,before,2019-06-30,power outage,1144722198994870272,sherryweeks,How to Stay Safe in a Power Outage https://rismedia.com/ace-branded/Content-Library/92268/Q1ZjK2NCZmZieTM1VW0vbHEzc3didz09/Twitter,2019-06-28 21:40:14+00:00,,
1048,july-end,before,2019-06-30,power outage,1144721817900331008,10TampaBay,LIGHTS OUT: Storms rolling across Tampa Bay are knocking out power. Check your outage map here https://on.wtsp.com/2XcsdtO,2019-06-28 21:38:43+00:00,,
1049,july-end,before,2019-06-30,power outage,1144721591013707776,JonasWoelk,@4JStudios My online minecraft server on ps4 gets corrupted everytime I have a power outage. Is there anyway to recover the lost data or fix it in the future?,2019-06-28 21:37:49+00:00,,
1050,july-end,before,2019-06-30,power outage,1144721165103054848,newsroomgy,"“The power grid system is antiquated, resulting in regular power outage, forcing companies, I’m sure many of yours, to install their own power generation systems to cope with the blackouts,” the Ambassador said. Other challenges… https://newsroom.gy/2019/06/28/blackouts-corruption-high-taxes-cloud-business-climate-here-us-ambassador/",2019-06-28 21:36:08+00:00,,
1051,july-end,before,2019-06-30,power outage,1144720973356326913,earlekimel,Just like Thursday — when I worked through several mini power outages at the office and found out after-the-fact that it was a fairly significant storm.,2019-06-28 21:35:22+00:00,,
1052,july-end,before,2019-06-30,power outage,1144720772214263808,SailTheWhale,Had a power outage coming back soon,2019-06-28 21:34:34+00:00,,
1053,july-end,before,2019-06-30,power outage,1144719854798286849,MissLeo_87,Who letting me stay the night at they house. You got to have AC. It’s a power outage in my neighborhood ,2019-06-28 21:30:55+00:00,,
1054,july-end,before,2019-06-30,power outage,1144718307456667648,hastingsutil,"Hastings Utilities has a power outage on South B street, So Ceder Rhode Island Crews Been Dispatched.",2019-06-28 21:24:46+00:00,,
1055,july-end,before,2019-06-30,power outage,1144717912177041408,alectranews,UPDATE #outage in #Markham affecting approx 99 homes and businesses. Crews continue working to restore power. New ETR 9:00p.m - 11:00 pm . For more info visit http://ow.ly/Ltnq50uLXjv #pwrout ^pa,2019-06-28 21:23:12+00:00,#outage #Markham #pwrout,
1056,july-end,before,2019-06-30,power outage,1144717464829407232,SW66CU,"Due to a power outage in the area, our Midland branch is currently closed. Due to the time of day it is unlikely we will reopen today. Barring unforeseen issues we should reopen Monday at 8:30am.",2019-06-28 21:21:26+00:00,,
1057,july-end,before,2019-06-30,power outage,1144717328719863808,iembot_mrx,"At 5:00 PM EDT, 1 W Lenoir City [Loudon Co, TN] EMERGENCY MNGR reports TSTM WND DMG. TREES DOWN, BENT GARAGE DOORS, AND POWER OUTAGES NEAR LENOIR CITY. https://mesonet.agron.iastate.edu/lsr/#MRX/201906282100/201906282100",2019-06-28 21:20:53+00:00,,
1058,july-end,before,2019-06-30,power outage,1144717233421258755,mynaijanews2,"Air Crash Averted In Kenya: 15 Planes Put On Hold In Air As Airport Suffers Power Outage - https://mynaija.news/2019/06/28/air-crash-averted-in-kenya-15-planes-put-on-hold-in-air-as-airport-suffers-power-outage/ General, Sahara",2019-06-28 21:20:30+00:00,,
1059,july-end,before,2019-06-30,power outage,1144717146477383680,quippingalong,"Ah, New Mexico, The Land of Enchantment The land of frequent power outages too. Right now no power in NE quadrant for over 5200 customers for another hour and a half. Happens at least 4 times every summer.",2019-06-28 21:20:10+00:00,,
1060,july-end,before,2019-06-30,power outage,1144716559673225216,RecordCourierNV,@nvenergy reports a power outage in Minden affecting 156 Douglas County customers at 1:16 p.m. Gardnerville experienced a brief power bump around then. Estimated restoration 4 p.m. ,2019-06-28 21:17:50+00:00,,
1061,july-end,before,2019-06-30,power outage,1144716150166761472,cliffb_infosec,1/6 of the world's quarterly supply of DRAM is gone after a 13-minute power outage. tl;dr DRAM contract prices have already been set for 3Q2019 and possibly 4Q2019. But spot prices are likely to spike. So you may see some DRAM w…https://lnkd.in/ecVxPUz https://lnkd.in/eEajUjR,2019-06-28 21:16:12+00:00,,
1062,july-end,before,2019-06-30,power outage,1144715288446996480,MiracleNinja777,Power outage? Any cause? #kansascity,2019-06-28 21:12:47+00:00,#kansascity,
1063,july-end,before,2019-06-30,power outage,1144715273720729601,greenbeltpolice,***GENERAL ADVISORY*** A transformer blew in the area of Greenbelt Road and Lakeside Drive. Some power outages have been reported. Notifications have been made.,2019-06-28 21:12:43+00:00,,
1064,july-end,before,2019-06-30,power outage,1144715253630099461,JimmyKicksButt,This is like the forth thing today that’s caused interuption into shadowbringers first internet outage then a to fix something and just now my power out for like 5 seconds l. The light will not prevail #ffxiv,2019-06-28 21:12:38+00:00,#ffxiv,
1065,july-end,before,2019-06-30,power outage,1144715150886240256,hendersonlibs,FYI: The Green Valley Library is closed for the rest of the day due to a power outage. We'll keep you posted about tomorrow! ,2019-06-28 21:12:14+00:00,,
1066,july-end,before,2019-06-30,power outage,1144714835256651776,FambroMedia,From Alabama Power - About 500 area outages remain. Their crews continue their work to restore power. They appreciate your patience as crews work as safely and quickly as they can.,2019-06-28 21:10:59+00:00,,
1067,july-end,before,2019-06-30,power outage,1144714749545996299,CityofSummitNJ,Summit Police reporting traffic signal out on Rte 124East and Summit Ave due to power outage. JCP&amp;L reporting outage affecting approx 500 households. Estimated restoration time 7:30PM but subject to change. Check JCP&amp;L outages map for updates. http://outages.firstenergycorp.com/nj.html #summitnj,2019-06-28 21:10:38+00:00,#summitnj,
1068,july-end,before,2019-06-30,power outage,1144714377917952000,NVEnergy,Hi. We actually don't do brownouts. It looks like the outage in your area was caused by damage to our equipment. We're working to have power restored as quickly and safely as possible. - Lynnette D.,2019-06-28 21:09:10+00:00,,
1069,july-end,before,2019-06-30,power outage,1144714326269419520,mynbc15,Alabama Power reports at 4p.m. that there are still about 500 area outages. Their crews continue to work to restore power as safely and quickly as they can.,2019-06-28 21:08:57+00:00,,
1070,july-end,before,2019-06-30,power outage,1144714175010234373,ehark16,"The hell they arent.. 35 mph wind gusts in PTB, 2 INCHES rain, debris all over the road , power outages",2019-06-28 21:08:21+00:00,,
1071,july-end,before,2019-06-30,power outage,1144713554777563136,millburntwp,"JCP&L has reported a transformer outage that is currently affecting nearly 1,700 customers in Millburn. Power is expected to be restored by 7:30 p.m. Please call JCP&amp;L at 1-888-544-4877 with any questions or to report outages. ",2019-06-28 21:05:53+00:00,,
1072,july-end,before,2019-06-30,power outage,1144713357758349312,KickAssGadgets,Toshiba &amp; WD NAND Production Hit By Power Outage: 6 Exabytes Lost http://bit.ly/2xjG2ax,2019-06-28 21:05:06+00:00,,
1073,july-end,before,2019-06-30,power outage,1144713347763453955,alectranews,Power #Outage event in #Guelph @17:00 PM affecting 929 homes and businesses. Check out our outage map at http://bit.ly/1STLc3d,2019-06-28 21:05:04+00:00,#Outage #Guelph,
1074,july-end,before,2019-06-30,power outage,1144713336111665152,GuelphHydro,Power #Outage event in #Guelph @17:00 PM affecting 929 homes and businesses. Check out our outage map at http://bit.ly/1STLc3d,2019-06-28 21:05:01+00:00,#Outage #Guelph,
1075,july-end,before,2019-06-30,power outage,1144713314242584576,ShopRidgeHill,"Due to a power outage in the area, Yonkers Police have temporarily closed down exit 6A on I-87. Please use the Tuckahoe Road entrance to access Ridge Hill.",2019-06-28 21:04:56+00:00,,
1076,july-end,before,2019-06-30,power outage,1144712295362322433,CapULibrary,"We'll be closed at 5pm today and will re-open on Tuesday, July 2 at 8am. Our campus' planned power outage this weekend shouldn't affect our website but there's always the potential for service disruptions. #sorryjustincase #happycanadaday",2019-06-28 21:00:53+00:00,#sorryjustincase #happycanadaday,
1077,july-end,before,2019-06-30,power outage,1144712263791759360,JanetTXBlessed,Arnold Ahlert: California Will Endure Prearranged Power Outages — The Patriot Post ,2019-06-28 21:00:46+00:00,,
1078,july-end,before,2019-06-30,power outage,1144712197354008577,MLGW,"When the power goes off, everyone's first question is, ""When will it come back on?"" #MLGW's outage line can sometimes provide an ETOR (Estimated Time of Restoration). Read our blog to learn more about how these times are determined: https://bit.ly/2J88AJH. #ServingYouIsWhatWeDo",2019-06-28 21:00:30+00:00,#MLGW #ServingYouIsWhatWeDo,
1079,july-end,before,2019-06-30,power outage,1144712131377602560,SoylentNews,6 to 9 Exabytes of Toshiba/WD NAND Production Gone Due to 13-Minute Power Outage - https://soylentnews.org/article.pl?sid=19/06/28/1950256,2019-06-28 21:00:14+00:00,,
1080,july-end,before,2019-06-30,power outage,1144712092731269121,sbisson,6EB of in-manufacture flash destroyed by one power outage. Buy those SSDs now! ,2019-06-28 21:00:05+00:00,,
1081,july-end,before,2019-06-30,power outage,1144711952901574660,Ice_Izo,Power outage affecting areas of Roodepoort | Roodepoort Record http://roodepoortrecord.co.za/2019/06/28/power-outage-affecting-areas-roodepoort/#.XRZ_rOBlc9Q.twitter,2019-06-28 20:59:31+00:00,,
1082,july-end,before,2019-06-30,power outage,1144711883469049857,CityPowerJhb,Power outage affecting areas of Roodepoort | Roodepoort Record http://roodepoortrecord.co.za/2019/06/28/power-outage-affecting-areas-roodepoort/#.XRZ_nq0Uc-E.twitter,2019-06-28 20:59:15+00:00,,
1083,july-end,before,2019-06-30,power outage,1144711857757917185,DSOElectricCoop,The Lindsborg outage has been restored. If you are still without power please call 1-800-376-3533.,2019-06-28 20:59:09+00:00,,
1084,july-end,before,2019-06-30,power outage,1144711784328290304,IglooTweets,Igloo east is experiencing a power outage. We will be closed until power is restored. Thank you ,2019-06-28 20:58:51+00:00,,
1085,july-end,before,2019-06-30,power outage,1144711660541808640,StormCenter7,Here is an updated look at power outages across the Miami Valley. More information: http://www.whio.com,2019-06-28 20:58:22+00:00,,
1086,july-end,before,2019-06-30,power outage,1144711649745653760,WestarioPower,"Have a safe and enjoyable Canada Day weekend!!! Westario Power will be closed Monday, July 1st to observe Canada Day. To report an electrical emergency or unexpected outage, please call 1-866-978-2746 (Please remember: social media is only monitored during business hours) ",2019-06-28 20:58:19+00:00,,
1087,july-end,before,2019-06-30,power outage,1144711592979787776,eyeslikebadu,My grocery order was cancelled today due to a power outage and we're expecting more rain. I only like storms at night.,2019-06-28 20:58:06+00:00,,
1088,july-end,before,2019-06-30,power outage,1144711471491932166,KenyaPower_Care,Please share your account number and contacts via DM if currently experiencing power outage. ^EM,2019-06-28 20:57:37+00:00,,
1089,july-end,before,2019-06-30,power outage,1144711063516008449,Energy_Tidbits,"Weather Channel July outlook. (i) Below average in Texas, less risk for power outages impacting oil and gas operations. (ii) Key Midwest/East should be a slight positive to HH gas. (iii) But YoY comps are tough as July 2018 was 11th warmest July on record. https://weather.com/amp/forecast/national/news/2019-06-27-july-temperature-outlook-the-weather-company-ibm-business.html?__twitter_impression=true",2019-06-28 20:55:59+00:00,,
1090,july-end,before,2019-06-30,power outage,1144710561822892032,Mynorthwest,An odd power outage hit Phinney Ridge early Friday morning... ,2019-06-28 20:54:00+00:00,,
1091,july-end,before,2019-06-30,power outage,1144710046414069760,ravirbt,Power outages are happening almost daily in BEML Layout helping to reduce power bill. Thanks a lot for your support,2019-06-28 20:51:57+00:00,,
1092,july-end,before,2019-06-30,power outage,1144709286934790145,NewBerlinPolice,"Traffic lights are still down at the intersections of Moorland/National, Moorland/Ryerson, and Moorland/Mayflower due to power outages. Please use caution during the PM rush.",2019-06-28 20:48:56+00:00,,
1093,july-end,before,2019-06-30,power outage,1144708349742800896,dayyanara_,"according to a coworker, my manager brought an Annabelle doll to our theatre and soon after they had a power outage IM SCREAMING ",2019-06-28 20:45:12+00:00,,
1094,july-end,before,2019-06-30,power outage,1144707975506010113,TheStudentTech1,Power outage drops WD's flash output by six… https://www.instagram.com/p/BzRGx3wg1AL/?igshid=1mjwb1bxnd8eh,2019-06-28 20:43:43+00:00,,
1095,july-end,before,2019-06-30,power outage,1144707707464835074,LandingApts,Hey guys! Our whole block is experiencing a power outage. We’ve contacted Oncor and they expect to restore electric by 5:00 pm today. Oncor Electric Delivery 1-888-313-4747 ,2019-06-28 20:42:39+00:00,,
1096,july-end,before,2019-06-30,power outage,1144707499167244288,WolverineHarley,Sorry for the inconvenience but we are closed due to a power outage. We will reopen tomorrow at 10 AM thank you.,2019-06-28 20:41:50+00:00,,
1097,july-end,before,2019-06-30,power outage,1144707043468697602,ENWINUtilities,"#ENWINAlert: Environment Canada has issued a Severe Thunderstorm Warning. For access to our Outage Map and tips on how to stay safe if the power goes out, click here: http://ow.ly/K4gF30oTcSA",2019-06-28 20:40:01+00:00,#ENWINAlert,
1098,july-end,before,2019-06-30,power outage,1144706546192044032,TashaHeadrick,"Thank you my friend, Bear. I am experiencing power outages and storms again and am delayed in response. Marsha's investigation was always turned away and put to the back because she was black, no other reason. She was killed and thrown in the Hudson River in NYC piers.",2019-06-28 20:38:02+00:00,,
1099,july-end,before,2019-06-30,power outage,1144706425194549250,acslko,Today Bescom customer care told power transformer tripped and power was gone from 10.30 Am to 6.30PM but Not only today but everyday their is outage for 2-3 hrs.... something is fishy... b/w distribution company ( BESCOM) &amp; Power purchasing team &amp; Power generation company...,2019-06-28 20:37:34+00:00,,
1100,july-end,before,2019-06-30,power outage,1144706091630116864,alyroe,Heat wave + Heath Offsides Call = power outage in Rennes. What. Is. Happening. Now?! We are 2 minutes from overturned tables here. And that’s just me. ,2019-06-28 20:36:14+00:00,,
1101,july-end,before,2019-06-30,power outage,1144705749244882945,plantaex,You guys spoil ma television with this ur power outage oo... ,2019-06-28 20:34:52+00:00,,
1102,july-end,before,2019-06-30,power outage,1144704602866143233,OPPDCares,"If your power goes out, please report the outage by calling 800-554-6773, use OPPDconnect app, or online at http://ow.ly/dxSQ30nl8T1",2019-06-28 20:30:19+00:00,,
1103,july-end,before,2019-06-30,power outage,1144704601121284096,EOPpower,Note: This page is monitored during regular business hours. For 24/7 Power Outage/Emergency reporting or info dial: 1-844-601-WIRE (9473).,2019-06-28 20:30:19+00:00,,
